anoCenso,cod,nome,codCidade,cidade,estado,regiao,situacaoFuncionamento,dependenciaAdministrativa,idebAI,idebAF,enemMediaGeral,situacaoFuncionamentoTxt,dependenciaAdministrativaTxt
2013,41065123,TEOTONIO VILELA E M EI EF,4112751,JESUITAS,PR,Sul,1,3,0.0,0.0,0.0,Em atividade,Municipal
2013,41051211,ALAIDE S RODRIGUES E M PROFA EF,4112801,JOAQUIM TAVORA,PR,Sul,1,3,0.0,0.0,0.0,Em atividade,Municipal
2013,41051246,ASSAD KALIL RICHA E E DO C EF,4112801,JOAQUIM TAVORA,PR,Sul,1,2,0.0,0.0,0.0,Em atividade,Estadual
2013,41363671,CHAPEUZINHO VERMELHO C M E I,4112801,JOAQUIM TAVORA,PR,Sul,1,3,0.0,0.0,0.0,Em atividade,Municipal
2013,41385152,CRECHE JOAO ANTONIO VIEIRA,4112801,JOAQUIM TAVORA,PR,Sul,1,3,0.0,0.0,0.0,Em atividade,Municipal
2013,41385144,CRECHE SOSSEGO DA MAMAE,4112801,JOAQUIM TAVORA,PR,Sul,1,3,0.0,0.0,0.0,Em atividade,Municipal
2013,41051262,DISTRITAL DE JOA C E DO C EF M,4112801,JOAQUIM TAVORA,PR,Sul,1,2,0.0,0.0,0.0,Em atividade,Estadual
2013,41144163,FRANCISCO BENEDETTI CEEBJA PROF EF M,4112801,JOAQUIM TAVORA,PR,Sul,1,2,0.0,0.0,0.0,Em atividade,Estadual
2013,41051289,FREI FRANCISCO E EI EF MOD ED ESP,4112801,JOAQUIM TAVORA,PR,Sul,1,4,0.0,0.0,0.0,Em atividade,Privada
2013,41051300,JANINA L CAVALHEIRO E M PROF EF,4112801,JOAQUIM TAVORA,PR,Sul,1,3,6.900000095367432,0.0,0.0,Em atividade,Municipal
2013,41051351,MIGUEL DIAS C E EF M,4112801,JOAQUIM TAVORA,PR,Sul,1,2,0.0,4.300000190734863,509.8479919433594,Em atividade,Estadual
2013,41051360,NATAL PANICHI E M EF,4112801,JOAQUIM TAVORA,PR,Sul,1,3,0.0,0.0,0.0,Em atividade,Municipal
2013,41051432,SAO JOSE E M EF,4112801,JOAQUIM TAVORA,PR,Sul,1,3,7.699999809265137,0.0,0.0,Em atividade,Municipal
2013,41051440,SAO SEBASTIAO E M EF,4112801,JOAQUIM TAVORA,PR,Sul,1,3,6.900000095367432,0.0,0.0,Em atividade,Municipal
2013,41382013,SEMENTINHA DO SABER E EI EF,4112801,JOAQUIM TAVORA,PR,Sul,1,4,0.0,0.0,0.0,Em atividade,Privada
2013,41354842,JOSE AUGUSTO DE ANDRADE C M E I,4112900,JUNDIAI DO SUL,PR,Sul,1,3,0.0,0.0,0.0,Em atividade,Municipal
2013,41047605,LUIZ PETRINI E E PROF EF,4112900,JUNDIAI DO SUL,PR,Sul,1,2,0.0,4.199999809265137,0.0,Em atividade,Estadual
2013,41047613,MARIA RUTE CONDE E R M DO C EF,4112900,JUNDIAI DO SUL,PR,Sul,1,3,0.0,0.0,0.0,Em atividade,Municipal
2013,41047630,NICANOR BUENO MENDES C E EM,4112900,JUNDIAI DO SUL,PR,Sul,1,2,0.0,0.0,457.63800048828125,Em atividade,Estadual
2013,41364007,NICE BRAGA C M E I,4112900,JUNDIAI DO SUL,PR,Sul,1,3,0.0,0.0,0.0,Em atividade,Municipal
2013,41404220,PAULO FOGACA E EI EF MOD ED ESP,4112900,JUNDIAI DO SUL,PR,Sul,1,4,0.0,0.0,0.0,Em atividade,Privada
2013,41372255,VILMA V PEREIRA MARQUES E M PROFA EF,4112900,JUNDIAI DO SUL,PR,Sul,1,3,5.199999809265137,0.0,0.0,Em atividade,Municipal
2013,41372123,DIENE C DA SILVA COSTA E EI EF MOD ESP,4112959,JURANDA,PR,Sul,1,4,0.0,0.0,0.0,Em atividade,Privada
2013,41365089,DOCE INFANCIA C M E I,4112959,JURANDA,PR,Sul,1,3,0.0,0.0,0.0,Em atividade,Municipal
2013,41013336,ESCOLA PIO X,4112959,JURANDA,PR,Sul,1,4,0.0,0.0,0.0,Em atividade,Privada
2013,41013212,HELENA CONNOR BRAZ E M EI EF,4112959,JURANDA,PR,Sul,1,3,0.0,0.0,0.0,Em atividade,Municipal
2013,41013239,JOAO MAFFEI ROSA C E EF M,4112959,JURANDA,PR,Sul,1,2,0.0,3.799999952316284,0.0,Em atividade,Estadual
2013,41365119,JURANDA C M E I,4112959,JURANDA,PR,Sul,1,3,0.0,0.0,0.0,Em atividade,Municipal
2013,41013247,LEOPOLDINA C E DONA EF M,4112959,JURANDA,PR,Sul,1,2,0.0,0.0,456.2720031738281,Em atividade,Estadual
2013,41365097,MENINO JESUS C M E I,4112959,JURANDA,PR,Sul,1,3,0.0,0.0,0.0,Em atividade,Municipal
2013,41013298,PAULO LEMINSKI E M EI EF,4112959,JURANDA,PR,Sul,1,3,0.0,0.0,0.0,Em atividade,Municipal
2013,41013301,PAULO R H HREHUCHUK E M EI EF,4112959,JURANDA,PR,Sul,1,3,4.800000190734863,0.0,0.0,Em atividade,Municipal
2013,41013352,RIO VERDE E E EF,4112959,JURANDA,PR,Sul,1,2,0.0,4.5,0.0,Em atividade,Estadual
2013,41010159,BALAO MAGICO C M E I,4113007,JUSSARA,PR,Sul,1,3,0.0,0.0,0.0,Em atividade,Municipal
2013,41010167,JULITA ALVES SOARES E M EF,4113007,JUSSARA,PR,Sul,1,3,6.099999904632568,0.0,0.0,Em atividade,Municipal
2013,41010183,MORAES DE BARROS C E SEN EF M,4113007,JUSSARA,PR,Sul,1,2,0.0,3.5999999046325684,0.0,Em atividade,Estadual
2013,41375637,MUNDO COLORIDO E EI EF,4113007,JUSSARA,PR,Sul,1,4,0.0,0.0,0.0,Em atividade,Privada
2013,41358961,SONHO DE CRIANCA C M E I,4113007,JUSSARA,PR,Sul,1,3,0.0,0.0,0.0,Em atividade,Municipal
2013,41010230,VAMOS CAMINHAR JUNTOS E EI EF MOD E ESP,4113007,JUSSARA,PR,Sul,1,4,0.0,0.0,0.0,Em atividade,Privada
2013,41035224,ABRAHAM LINCOLN C E EF M,4113106,KALORE,PR,Sul,1,2,0.0,5.0,0.0,Em atividade,Estadual
2013,41035232,ALVORADA DA INFANCIA C E C EF M,4113106,KALORE,PR,Sul,1,2,0.0,0.0,424.2200012207031,Em atividade,Estadual
2013,41035240,ANGELO IMPOSSETTO E M EF,4113106,KALORE,PR,Sul,1,3,5.699999809265137,0.0,0.0,Em atividade,Municipal
2013,41363060,CRECHE MUNICIPAL BRANCA DE NEVE,4113106,KALORE,PR,Sul,1,3,0.0,0.0,0.0,Em atividade,Municipal
2013,41363043,LEANDRO A KELLER E EI EF MOD ED ESP,4113106,KALORE,PR,Sul,1,4,0.0,0.0,0.0,Em atividade,Privada
2013,41035364,MONICA C M E I DA,4113106,KALORE,PR,Sul,1,3,0.0,0.0,0.0,Em atividade,Municipal
2013,41035380,PARAISO DA INFANCIA E M EI EF,4113106,KALORE,PR,Sul,1,3,0.0,0.0,0.0,Em atividade,Municipal
2013,41382021,TEREZA VICENTIM C M E I,4113106,KALORE,PR,Sul,1,3,0.0,0.0,0.0,Em atividade,Municipal
2013,41121449,ABIGAIL CORTES E M EF,4113205,LAPA,PR,Sul,1,3,5.800000190734863,0.0,0.0,Em atividade,Municipal
2013,41121457,ALOISIO LEONI E R M DR EF,4113205,LAPA,PR,Sul,1,3,0.0,0.0,0.0,Em atividade,Municipal
2013,41121490,ANTONIO LACERDA BRAGA C E C EF M,4113205,LAPA,PR,Sul,1,2,0.0,4.400000095367432,488.54400634765625,Em atividade,Estadual
2013,41613899,BERNARDO VON MULLER BERNECK C M E I,4113205,LAPA,PR,Sul,1,3,0.0,0.0,0.0,Em atividade,Municipal
2013,41121554,BRASILINO F DE ALMEIDA E R M EF,4113205,LAPA,PR,Sul,1,3,6.099999904632568,0.0,0.0,Em atividade,Municipal
2013,41121570,CANDIDO RONDON E R M MAL EF,4113205,LAPA,PR,Sul,1,3,0.0,0.0,0.0,Em atividade,Municipal
2013,41121600,CARNEIRO C E GAL E F M N,4113205,LAPA,PR,Sul,1,2,0.0,4.5,0.0,Em atividade,Estadual
2013,41121619,CASA DA CCA J LACERDA C M E I,4113205,LAPA,PR,Sul,1,3,0.0,0.0,0.0,Em atividade,Municipal
2013,41144520,CATARINA K RAMOS C M E I,4113205,LAPA,PR,Sul,1,3,0.0,0.0,0.0,Em atividade,Municipal
2013,41144473,CEEBJA PAULO LEMINSKI EF M,4113205,LAPA,PR,Sul,1,2,0.0,0.0,0.0,Em atividade,Estadual
2013,41382579,CENTRO DE EDUCACAO INFANTIL SAO VICENTE DE PAULO,4113205,LAPA,PR,Sul,1,4,0.0,0.0,0.0,Em atividade,Privada
2013,41382560,CENTRO EST EDUC PROFIS AGRIC DA LAPA,4113205,LAPA,PR,Sul,1,2,0.0,0.0,495.7820129394531,Em atividade,Estadual
2013,41613902,CENTRO MUN AT ESP MONS HENRIQUE O FALARZ,4113205,LAPA,PR,Sul,1,3,0.0,0.0,0.0,Em atividade,Municipal
2013,41147847,CONTESTADO C E C EF M,4113205,LAPA,PR,Sul,1,2,0.0,0.0,0.0,Em atividade,Estadual
2013,41385403,CONTESTADO E R M EF,4113205,LAPA,PR,Sul,1,3,0.0,0.0,0.0,Em atividade,Municipal
2013,41144422,COOPERATIVA DA LAPA C ED INF E FUND MED,4113205,LAPA,PR,Sul,1,4,0.0,0.0,0.0,Em atividade,Privada
2013,41121686,DAVID DA S CARNEIRO E M PROF EF,4113205,LAPA,PR,Sul,1,3,6.599999904632568,0.0,0.0,Em atividade,Municipal
2013,41380592,DINAMICO C EI EF M,4113205,LAPA,PR,Sul,1,4,0.0,0.0,551.156005859375,Em atividade,Privada
2013,41121511,DIRCEU B DA LUZ TISIU E R M EF,4113205,LAPA,PR,Sul,1,3,5.199999809265137,0.0,0.0,Em atividade,Municipal
2013,41121716,ELOAH D RYCHWA E M PROFA EF,4113205,LAPA,PR,Sul,1,3,3.5999999046325684,0.0,0.0,Em atividade,Municipal
2013,41121724,EMILIA M F DO AMARAL E M EF,4113205,LAPA,PR,Sul,1,3,0.0,0.0,0.0,Em atividade,Municipal
2013,41121759,FEIJO E R M PE EF,4113205,LAPA,PR,Sul,1,3,6.800000190734863,0.0,0.0,Em atividade,Municipal
2013,41121791,GETULIO VARGAS E R M EF,4113205,LAPA,PR,Sul,1,3,0.0,0.0,0.0,Em atividade,Municipal
2013,41121805,GUSTAVO KUSS E R M EF,4113205,LAPA,PR,Sul,1,3,0.0,0.0,0.0,Em atividade,Municipal
2013,41121813,IMACULADO CORACAO DE MARIA E R M EF,4113205,LAPA,PR,Sul,1,3,0.0,0.0,0.0,Em atividade,Municipal
2013,41144538,INTEGRACAO A VIDA E EI EF MOD ED ESP,4113205,LAPA,PR,Sul,1,4,0.0,0.0,0.0,Em atividade,Privada
2013,41144430,IRMA ANTONIA B BIANCHINI C E PROFA EF M,4113205,LAPA,PR,Sul,1,2,0.0,2.5,0.0,Em atividade,Estadual
2013,41121848,JOAO L JACOMEL E R M DEP EF,4113205,LAPA,PR,Sul,1,3,0.0,0.0,0.0,Em atividade,Municipal
2013,41121902,JUSCELINO K DE OLIVEIRA C E C DR EF M,4113205,LAPA,PR,Sul,1,2,0.0,4.300000190734863,0.0,Em atividade,Estadual
2013,41121910,JUVENAL B DA SILVEIRA C E C EF M,4113205,LAPA,PR,Sul,1,2,0.0,5.0,477.4119873046875,Em atividade,Estadual
2013,41121937,LAURO M MONTENEGRO E M EF,4113205,LAPA,PR,Sul,1,3,0.0,0.0,0.0,Em atividade,Municipal
2013,41144465,LIDIA C M E I IRMA,4113205,LAPA,PR,Sul,1,3,0.0,0.0,0.0,Em atividade,Municipal
2013,41121945,MANOEL A DA CUNHA E E EF,4113205,LAPA,PR,Sul,1,2,0.0,4.199999809265137,0.0,Em atividade,Estadual
2013,41121970,MANOEL PEDRO E M DR EF,4113205,LAPA,PR,Sul,1,3,6.5,0.0,0.0,Em atividade,Municipal
2013,41122011,MIRAZINHA BRAGA E M DONA EF,4113205,LAPA,PR,Sul,1,3,5.699999809265137,0.0,0.0,Em atividade,Municipal
2013,41122100,NOSSA SENHORA DE LOURDES E M EF,4113205,LAPA,PR,Sul,1,3,5.099999904632568,0.0,0.0,Em atividade,Municipal
2013,41122097,NOSSA SRA DO DESTERRO C E C EF M,4113205,LAPA,PR,Sul,1,2,0.0,4.300000190734863,494.9859924316406,Em atividade,Estadual
2013,41122151,OSVALDO CRUZ E R M EF,4113205,LAPA,PR,Sul,1,3,0.0,0.0,0.0,Em atividade,Municipal
2013,41122178,PEDRO FAVARO CAVALIN E M EF,4113205,LAPA,PR,Sul,1,3,5.599999904632568,0.0,0.0,Em atividade,Municipal
2013,41375645,PEDRO M MAGALHAES C M E I,4113205,LAPA,PR,Sul,1,3,0.0,0.0,0.0,Em atividade,Municipal
2013,41122194,PEDRO P LEONI E M DR EF,4113205,LAPA,PR,Sul,1,3,5.599999904632568,0.0,0.0,Em atividade,Municipal
2013,41144503,RUTH C M E I IRMA,4113205,LAPA,PR,Sul,1,3,0.0,0.0,0.0,Em atividade,Municipal
2013,41122240,SANTA RITA E R M IRMA EF,4113205,LAPA,PR,Sul,1,3,6.300000190734863,0.0,0.0,Em atividade,Municipal
2013,41122313,SAO JOSE C E EM PROF,4113205,LAPA,PR,Sul,1,2,0.0,0.0,477.7380065917969,Em atividade,Estadual
2013,41122321,SAO MIGUEL E R M EF,4113205,LAPA,PR,Sul,1,3,0.0,0.0,0.0,Em atividade,Municipal
2013,41526848,SERAFIM F DO AMARAL E M EF,4113205,LAPA,PR,Sul,1,3,6.400000095367432,0.0,0.0,Em atividade,Municipal
2013,41122402,SYBILLA W DE LACERDA E M PROFA EF,4113205,LAPA,PR,Sul,1,3,5.900000095367432,0.0,0.0,Em atividade,Municipal
2013,41122429,TRAJANO EHLKE PIRES C E C EF M,4113205,LAPA,PR,Sul,1,2,0.0,4.5,459.4859924316406,Em atividade,Estadual
2013,41122437,VICENTE MACHADO E R M DR EF,4113205,LAPA,PR,Sul,1,3,0.0,0.0,0.0,Em atividade,Municipal
2013,41367111,CAMINHOS DA ESPERANCA C M E I,4113254,LARANJAL,PR,Sul,1,3,0.0,0.0,0.0,Em atividade,Municipal
2013,41373006,CHAPADAO C E C EF M,4113254,LARANJAL,PR,Sul,1,2,0.0,3.5999999046325684,0.0,Em atividade,Estadual
2013,41094840,CLAUDIO MANOEL DA COSTA E M C EF,4113254,LARANJAL,PR,Sul,1,3,0.0,0.0,0.0,Em atividade,Municipal
2013,41094859,CRISTOVAO COLOMBO E M C EF,4113254,LARANJAL,PR,Sul,1,3,0.0,0.0,0.0,Em atividade,Municipal
2013,41094875,FELIPE DOS SANTOS E M C EF,4113254,LARANJAL,PR,Sul,1,3,0.0,0.0,0.0,Em atividade,Municipal
2013,41094883,GASPAR DE LEMOS E M C EF,4113254,LARANJAL,PR,Sul,1,3,0.0,0.0,0.0,Em atividade,Municipal
2013,41094921,LARANJAL C E DE EF M,4113254,LARANJAL,PR,Sul,1,2,0.0,3.5,0.0,Em atividade,Estadual
2013,41094930,LEONARDO DA VINCI E M C EF,4113254,LARANJAL,PR,Sul,1,3,0.0,0.0,0.0,Em atividade,Municipal
2013,41094948,LUIZ PASTEUR E M C EF,4113254,LARANJAL,PR,Sul,1,3,0.0,0.0,0.0,Em atividade,Municipal
2013,41094964,MARTINS FONTES E M C EF,4113254,LARANJAL,PR,Sul,1,3,0.0,0.0,0.0,Em atividade,Municipal
2013,41094999,MUNHOZ DA ROCHA E M C EF,4113254,LARANJAL,PR,Sul,1,3,4.5,0.0,0.0,Em atividade,Municipal
2013,41367103,PINHAL GRANDE C E C EF M,4113254,LARANJAL,PR,Sul,1,2,0.0,3.9000000953674316,0.0,Em atividade,Estadual
2013,41378156,REVIVER E EI EF MOD ED ESP,4113254,LARANJAL,PR,Sul,1,4,0.0,0.0,0.0,Em atividade,Privada
2013,41382382,VALDEVINO PAES DE FARIAS E M C EF,4113254,LARANJAL,PR,Sul,1,3,0.0,0.0,0.0,Em atividade,Municipal
2013,41095030,VILLA LOBOS E M EF,4113254,LARANJAL,PR,Sul,1,3,4.699999809265137,0.0,0.0,Em atividade,Municipal
2013,41363698,ADELINA DUTRA BOEIRA C M E I,4113304,LARANJEIRAS DO SUL,PR,Sul,1,3,0.0,0.0,0.0,Em atividade,Municipal
2013,41102002,AGUA VERDE E M EI EF,4113304,LARANJEIRAS DO SUL,PR,Sul,1,3,5.400000095367432,0.0,0.0,Em atividade,Municipal
2013,41102010,ALBERTO SANTOS DUMONT E R M EF,4113304,LARANJEIRAS DO SUL,PR,Sul,1,3,0.0,0.0,0.0,Em atividade,Municipal
2013,41102045,ALUISIO MAIER E M EI EF,4113304,LARANJEIRAS DO SUL,PR,Sul,1,3,7.099999904632568,0.0,0.0,Em atividade,Municipal
2013,41102118,ANTONIO R DE OLIVEIRA E M VER EI EF,4113304,LARANJEIRAS DO SUL,PR,Sul,1,3,6.0,0.0,0.0,Em atividade,Municipal
2013,41144899,CEEBJA LARANJEIRAS DO SUL EF M,4113304,LARANJEIRAS DO SUL,PR,Sul,1,2,0.0,0.0,0.0,Em atividade,Estadual
2013,41361784,DIVINA PROVIDENCIA C M E I,4113304,LARANJEIRAS DO SUL,PR,Sul,1,3,0.0,0.0,0.0,Em atividade,Municipal
2013,41151062,EMILIA CESCA ALBERTI C M E I,4113304,LARANJEIRAS DO SUL,PR,Sul,1,3,0.0,0.0,0.0,Em atividade,Municipal
2013,41102274,ERICO VERISSIMO E E EF,4113304,LARANJEIRAS DO SUL,PR,Sul,1,2,0.0,4.699999809265137,0.0,Em atividade,Estadual
2013,41102088,ESCOLA ANJO DA GUARDA - EDUCACAO INFANTIL E ENSINO FUNDAMENTAL,4113304,LARANJEIRAS DO SUL,PR,Sul,1,4,0.0,0.0,0.0,Em atividade,Privada
2013,41102924,ESCOLA VICENTINA SANTA ANA - EDUCACAO INFANTIL E ENSINO FUNDAMENTAL,4113304,LARANJEIRAS DO SUL,PR,Sul,1,4,0.0,0.0,0.0,Em atividade,Privada
2013,41102304,FLORIANO PEIXOTO C E EF M PROFIS,4113304,LARANJEIRAS DO SUL,PR,Sul,1,2,0.0,4.0,497.2179870605469,Em atividade,Estadual
2013,41102312,FLORINDO PELLIZZARI E M VER EF,4113304,LARANJEIRAS DO SUL,PR,Sul,1,3,5.800000190734863,0.0,0.0,Em atividade,Municipal
2013,41102347,GERSON GALVINO E M PE EI EF,4113304,LARANJEIRAS DO SUL,PR,Sul,1,3,6.900000095367432,0.0,0.0,Em atividade,Municipal
2013,41102363,GILDO A SCHUCK C E PROF EM N,4113304,LARANJEIRAS DO SUL,PR,Sul,1,2,0.0,0.0,492.24798583984375,Em atividade,Estadual
2013,41102436,JARDIM ALVORADA C M E I,4113304,LARANJEIRAS DO SUL,PR,Sul,1,3,0.0,0.0,0.0,Em atividade,Municipal
2013,41598180,JOANY G DE LIMA C E C EF M,4113304,LARANJEIRAS DO SUL,PR,Sul,1,2,0.0,0.0,458.3599853515625,Em atividade,Estadual
2013,41102460,JOAO RODRIGUES DA SILVA E R M EF,4113304,LARANJEIRAS DO SUL,PR,Sul,1,3,0.0,0.0,0.0,Em atividade,Municipal
2013,41102541,JOSE BONIFACIO E M EI EF,4113304,LARANJEIRAS DO SUL,PR,Sul,1,3,6.400000095367432,0.0,0.0,Em atividade,Municipal
2013,41144929,JOSE MARCONDES SOBRINHO C E EF M,4113304,LARANJEIRAS DO SUL,PR,Sul,1,2,0.0,3.9000000953674316,0.0,Em atividade,Estadual
2013,41102606,JOSIMO MORAES DE TAVARES E R M PE EF,4113304,LARANJEIRAS DO SUL,PR,Sul,1,3,0.0,0.0,0.0,Em atividade,Municipal
2013,41557891,KO HOMU E E I EI EF,4113304,LARANJEIRAS DO SUL,PR,Sul,1,2,0.0,0.0,0.0,Em atividade,Estadual
2013,41102622,LARANJEIRAS DO SUL C E DE EF M,4113304,LARANJEIRAS DO SUL,PR,Sul,1,2,0.0,4.599999904632568,539.281982421875,Em atividade,Estadual
2013,41102649,LEOCADIO J CORREIA E M DR EI EF,4113304,LARANJEIRAS DO SUL,PR,Sul,1,3,7.199999809265137,0.0,0.0,Em atividade,Municipal
2013,41102754,NELCI FELINI E EI EF MOD ED ESP,4113304,LARANJEIRAS DO SUL,PR,Sul,1,4,0.0,0.0,0.0,Em atividade,Privada
2013,41361792,NOSSA SRA DAS GRACAS C E I VICENTINO,4113304,LARANJEIRAS DO SUL,PR,Sul,1,4,0.0,0.0,0.0,Em atividade,Privada
2013,41395018,PRIMEIROS PASSOS C M E I,4113304,LARANJEIRAS DO SUL,PR,Sul,1,3,0.0,0.0,0.0,Em atividade,Municipal
2013,41102894,RAQUEL DE QUEIROS E R M EF,4113304,LARANJEIRAS DO SUL,PR,Sul,1,3,0.0,0.0,0.0,Em atividade,Municipal
2013,41551974,SALPICOS DE ALEGRIA E EI EF,4113304,LARANJEIRAS DO SUL,PR,Sul,1,4,0.0,0.0,0.0,Em atividade,Privada
2013,41102932,SELS COLEGIO ENSINO FUND MEDIO,4113304,LARANJEIRAS DO SUL,PR,Sul,1,4,0.0,0.0,605.0980224609375,Em atividade,Privada
2013,41363701,SEMENTINHA DO SABER C M E I,4113304,LARANJEIRAS DO SUL,PR,Sul,1,3,0.0,0.0,0.0,Em atividade,Municipal
2013,41102959,TANCREDO DE ALMEIDA NEVES C E EF M,4113304,LARANJEIRAS DO SUL,PR,Sul,1,2,0.0,4.5,481.68798828125,Em atividade,Estadual
2013,41102967,TEOTONIO VILELA E M EI EF,4113304,LARANJEIRAS DO SUL,PR,Sul,1,3,5.400000095367432,0.0,0.0,Em atividade,Municipal
2013,41102983,VALDEMAR BOEIRA E M EI EF,4113304,LARANJEIRAS DO SUL,PR,Sul,1,3,0.0,0.0,0.0,Em atividade,Municipal
2013,41102908,VALMIR NUNES C E C PROF EF M,4113304,LARANJEIRAS DO SUL,PR,Sul,1,2,0.0,0.0,0.0,Em atividade,Estadual
2013,41102991,VILA INDUSTRIAL C E EF M,4113304,LARANJEIRAS DO SUL,PR,Sul,1,2,0.0,4.300000190734863,0.0,Em atividade,Estadual
2013,41044878,ARGENEDE MOTTA PRODOSSIMO E M EF,4113403,LEOPOLIS,PR,Sul,1,3,5.5,0.0,0.0,Em atividade,Municipal
2013,41044894,EURICO PEDROSO DE ALMEIDA E M C EF,4113403,LEOPOLIS,PR,Sul,1,3,0.0,0.0,0.0,Em atividade,Municipal
2013,41044924,JANDINOPOLIS E E DO C DE EF,4113403,LEOPOLIS,PR,Sul,1,2,0.0,0.0,0.0,Em atividade,Estadual
2013,41375319,JOSUE MINOTTO C M E I C,4113403,LEOPOLIS,PR,Sul,1,3,0.0,0.0,0.0,Em atividade,Municipal
2013,41044932,LEOPOLIS E E DO C DE EF,4113403,LEOPOLIS,PR,Sul,1,2,0.0,0.0,0.0,Em atividade,Estadual
2013,41044940,MARIA J P SOUZA C E EM,4113403,LEOPOLIS,PR,Sul,1,2,0.0,0.0,453.3420104980469,Em atividade,Estadual
2013,41551893,MARIA M MENDES E M EI EF MOD ED ESP,4113403,LEOPOLIS,PR,Sul,1,3,0.0,0.0,0.0,Em atividade,Municipal
2013,41044959,MARIA PEREIRA E E EF,4113403,LEOPOLIS,PR,Sul,1,2,0.0,3.700000047683716,0.0,Em atividade,Estadual
2013,41375300,MENINO JESUS C M E I C,4113403,LEOPOLIS,PR,Sul,1,3,0.0,0.0,0.0,Em atividade,Municipal
2013,41044967,PRIMAVERA E M C EF,4113403,LEOPOLIS,PR,Sul,1,3,0.0,0.0,0.0,Em atividade,Municipal
2013,41045009,SAO JOSE C M E I,4113403,LEOPOLIS,PR,Sul,1,3,0.0,0.0,0.0,Em atividade,Municipal
2013,41038398,BENEDITO SERRA E E C EF,4113429,LIDIANOPOLIS,PR,Sul,1,2,0.0,0.0,0.0,Em atividade,Estadual
2013,41038436,ERCILIA CAMARGO COELHO E M EF,4113429,LIDIANOPOLIS,PR,Sul,1,3,0.0,0.0,0.0,Em atividade,Municipal
2013,41038487,MARIA JOSE DE A MOURA E M EF,4113429,LIDIANOPOLIS,PR,Sul,1,3,4.900000095367432,0.0,0.0,Em atividade,Municipal
2013,41038525,PEDRO I C E D E F M P,4113429,LIDIANOPOLIS,PR,Sul,1,2,0.0,4.300000190734863,0.0,Em atividade,Estadual
2013,41379969,PINGO DE GENTE C M E I,4113429,LIDIANOPOLIS,PR,Sul,1,3,0.0,0.0,0.0,Em atividade,Municipal
2013,41359410,ROSA ALVES E EI EF MOD ED ESP,4113429,LIDIANOPOLIS,PR,Sul,1,4,0.0,0.0,0.0,Em atividade,Privada
2013,41379977,SEMENTINHAS DO IVAI C M E I,4113429,LIDIANOPOLIS,PR,Sul,1,3,0.0,0.0,0.0,Em atividade,Municipal
2013,41074203,BARTOLOMEU B SILVA E M EI EF,4113452,LINDOESTE,PR,Sul,1,3,4.900000095367432,0.0,0.0,Em atividade,Municipal
2013,41074238,CERRO AZUL E E DE EF,4113452,LINDOESTE,PR,Sul,1,2,0.0,0.0,0.0,Em atividade,Estadual
2013,41074246,CIELITO LINDO E E EF,4113452,LINDOESTE,PR,Sul,1,2,0.0,4.699999809265137,0.0,Em atividade,Estadual
2013,41363604,DULCE C M E I IRMA,4113452,LINDOESTE,PR,Sul,1,3,0.0,0.0,0.0,Em atividade,Municipal
2013,41074343,JOSE LINHARES E M EI EF,4113452,LINDOESTE,PR,Sul,1,3,0.0,0.0,0.0,Em atividade,Municipal
2013,41074360,LINDOESTE C E EF M,4113452,LINDOESTE,PR,Sul,1,2,0.0,4.300000190734863,461.6440124511719,Em atividade,Estadual
2013,41074386,MAUA E M VISC DE EI EF,4113452,LINDOESTE,PR,Sul,1,3,5.599999904632568,0.0,0.0,Em atividade,Municipal
2013,41363612,NOSSA SENHORA DOS ANJOS C M E I,4113452,LINDOESTE,PR,Sul,1,3,0.0,0.0,0.0,Em atividade,Municipal
2013,41074394,OTAVIO TOZO E R M EI EF,4113452,LINDOESTE,PR,Sul,1,3,0.0,0.0,0.0,Em atividade,Municipal
2013,41357108,SANTA LUZIA C E C EF M,4113452,LINDOESTE,PR,Sul,1,2,0.0,0.0,0.0,Em atividade,Estadual
2013,41359216,SUSANA CASAGRANDE E EI EF MOD ED ESP,4113452,LINDOESTE,PR,Sul,1,4,0.0,0.0,0.0,Em atividade,Privada
2013,41001060,AFONSO CAMARGO C E PRES EF M PROFIS,4113502,LOANDA,PR,Sul,1,2,0.0,3.4000000953674316,0.0,Em atividade,Estadual
2013,41364422,ALVEHY ALVES DE ASSIS E M EI EF,4113502,LOANDA,PR,Sul,1,3,6.099999904632568,0.0,0.0,Em atividade,Municipal
2013,41364430,CARLOS ALBERTO DE A DINIZ E M DR EI EF,4113502,LOANDA,PR,Sul,1,3,5.300000190734863,0.0,0.0,Em atividade,Municipal
2013,41359453,CRIANCA FELIZ C M E I,4113502,LOANDA,PR,Sul,1,4,0.0,0.0,0.0,Em atividade,Privada
2013,41396235,FACINOR - CENTRO DE EDUCACAO PROFISSIONAL DA FACULDADE INTERMUNICIPAL DO NOROESTE DO PARANA,4113502,LOANDA,PR,Sul,1,4,0.0,0.0,0.0,Em atividade,Privada
2013,41001168,FLOR DE LOTUS C M E I,4113502,LOANDA,PR,Sul,1,3,0.0,0.0,0.0,Em atividade,Municipal
2013,41001192,GUILHERME DE ALMEIDA C E EF M N,4113502,LOANDA,PR,Sul,1,2,0.0,3.299999952316284,0.0,Em atividade,Estadual
2013,41001206,JOAO PAULO II E EI EF MOD ED ESP,4113502,LOANDA,PR,Sul,1,4,0.0,0.0,0.0,Em atividade,Privada
2013,41001222,LAMARTINE R SOARES C E DR EF M,4113502,LOANDA,PR,Sul,1,2,0.0,0.0,0.0,Em atividade,Estadual
2013,41380649,LOANDA C EM,4113502,LOANDA,PR,Sul,1,4,0.0,0.0,535.2639770507812,Em atividade,Privada
2013,41353129,LUZIA B MENDONCA C M E I,4113502,LOANDA,PR,Sul,1,3,0.0,0.0,0.0,Em atividade,Municipal
2013,41001230,MARIA DA GLORIA D AVIZ E M EI EF,4113502,LOANDA,PR,Sul,1,3,5.400000095367432,0.0,0.0,Em atividade,Municipal
2013,41353110,MENINO JESUS C M E I,4113502,LOANDA,PR,Sul,1,3,0.0,0.0,0.0,Em atividade,Municipal
2013,41150775,MERCEDES SCAVAZINI C M E I,4113502,LOANDA,PR,Sul,1,3,0.0,0.0,0.0,Em atividade,Municipal
2013,41364465,NOSSA SENHORA PERPETUO SOCORRO C M E I,4113502,LOANDA,PR,Sul,1,3,0.0,0.0,0.0,Em atividade,Municipal
2013,41001249,NOVO HORIZONTE C EF M PROFIS,4113502,LOANDA,PR,Sul,1,4,0.0,0.0,497.4519958496094,Em atividade,Privada
2013,41364457,ODILA INACIO VIEIRA E M PROFA EI EF,4113502,LOANDA,PR,Sul,1,3,4.900000095367432,0.0,0.0,Em atividade,Municipal
2013,41001257,PARANA C E E F PROFIS,4113502,LOANDA,PR,Sul,1,2,0.0,3.799999952316284,0.0,Em atividade,Estadual
2013,41001281,SANTA EDWIGES E EI EF,4113502,LOANDA,PR,Sul,1,4,0.0,0.0,0.0,Em atividade,Privada
2013,41001150,ZULEIKA AP PETERSON E M PROFA EI EF,4113502,LOANDA,PR,Sul,1,3,6.0,0.0,0.0,Em atividade,Municipal
2013,41473825,CENTRO DE ATIVIDADES PEDAGOGICAS,4113601,LOBATO,PR,Sul,1,3,0.0,0.0,0.0,Em atividade,Municipal
2013,41359224,ELIAS ABRAHAO E M EI EF,4113601,LOBATO,PR,Sul,1,3,5.599999904632568,0.0,0.0,Em atividade,Municipal
2013,41148843,MONTEIRO LOBATO C M E I,4113601,LOBATO,PR,Sul,1,3,0.0,0.0,0.0,Em atividade,Municipal
2013,41020189,OSVALDO ARANHA E E EF,4113601,LOBATO,PR,Sul,1,2,0.0,4.400000095367432,0.0,Em atividade,Estadual
2013,41020197,RUI BARBOSA C E EM,4113601,LOBATO,PR,Sul,1,2,0.0,0.0,0.0,Em atividade,Estadual
2013,41359232,ZARA J LEMOS E PROFA EI EF MOD ED ESP,4113601,LOBATO,PR,Sul,1,4,0.0,0.0,0.0,Em atividade,Privada
2013,41029470,A PRINCESINHA CENTRO DE EDUCACAO INFANTIL,4113700,LONDRINA,PR,Sul,1,4,0.0,0.0,0.0,Em atividade,Privada
2013,41386124,A TURMA DO SNOOPY,4113700,LONDRINA,PR,Sul,1,4,0.0,0.0,0.0,Em atividade,Privada
2013,41365461,ABAC CENTRO DE EDUCACAO INFANTIL,4113700,LONDRINA,PR,Sul,1,4,0.0,0.0,0.0,Em atividade,Privada
2013,41365402,ABDIAS DO NASCIMENTO CENTRO MUNICIPAL DE EDUCACAO INFANTIL,4113700,LONDRINA,PR,Sul,1,3,0.0,0.0,0.0,Em atividade,Municipal
2013,41152360,ABILITY BARON C E I,4113700,LONDRINA,PR,Sul,1,4,0.0,0.0,0.0,Em atividade,Privada
2013,41029500,ADELIA D BARBOSA C E PROFA EF M,4113700,LONDRINA,PR,Sul,1,2,0.0,3.299999952316284,0.0,Em atividade,Estadual
2013,41029526,ADVENTISTA COLEGIO EI EF EM,4113700,LONDRINA,PR,Sul,1,4,0.0,0.0,559.1060180664062,Em atividade,Privada
2013,41365038,ALAIDE FAUSTO DE SOUZA CENTRO DE EDUCACAO INFANTIL,4113700,LONDRINA,PR,Sul,1,4,0.0,0.0,0.0,Em atividade,Privada
2013,41029542,ALBINO F SANCHES C E EF M PROFIS,4113700,LONDRINA,PR,Sul,1,2,0.0,4.0,0.0,Em atividade,Estadual
2013,41029569,ALEGRIA CENTRO DE EDUCACAO INFANTIL,4113700,LONDRINA,PR,Sul,1,4,0.0,0.0,0.0,Em atividade,Privada
2013,41152468,ALEGRIA DO BEBE C E I - SUBSEDE,4113700,LONDRINA,PR,Sul,1,4,0.0,0.0,0.0,Em atividade,Privada
2013,41386086,ALEGRIA DO BEBE CENTRO EDUC INF,4113700,LONDRINA,PR,Sul,1,4,0.0,0.0,0.0,Em atividade,Privada
2013,41029593,AMERICA S COIMBRA E M EI EF,4113700,LONDRINA,PR,Sul,1,3,0.0,0.0,0.0,Em atividade,Municipal
2013,41364902,AMPAS CENTRO DE EDUCACAO INFANTIL,4113700,LONDRINA,PR,Sul,1,4,0.0,0.0,0.0,Em atividade,Privada
2013,41029623,ANA MOLINA GARCIA C E EF M,4113700,LONDRINA,PR,Sul,1,2,0.0,2.5999999046325684,0.0,Em atividade,Estadual
2013,41364970,ANA PROVELLER CENTRO DE EDUCACAO INFANTIL,4113700,LONDRINA,PR,Sul,1,4,0.0,0.0,0.0,Em atividade,Privada
2013,41364929,ANALIA FRANCO CENTRO DE EDUCACAO INFANTIL,4113700,LONDRINA,PR,Sul,1,4,0.0,0.0,0.0,Em atividade,Privada
2013,41150570,ANALICE C E I,4113700,LONDRINA,PR,Sul,1,4,0.0,0.0,0.0,Em atividade,Privada
2013,41029631,ANCHIETA E M PE EF,4113700,LONDRINA,PR,Sul,1,3,7.0,0.0,0.0,Em atividade,Municipal
2013,41029658,ANDREA NUZZI E M MAESTRO EI EF,4113700,LONDRINA,PR,Sul,1,3,7.800000190734863,0.0,0.0,Em atividade,Municipal
2013,41393023,ANITA CORREIA CENTRO DE EDUCACAO INFANTIL,4113700,LONDRINA,PR,Sul,1,4,0.0,0.0,0.0,Em atividade,Privada
2013,41029704,ANITA GARIBALDI E M EI EF,4113700,LONDRINA,PR,Sul,1,3,5.599999904632568,0.0,0.0,Em atividade,Municipal
2013,41364988,ANTONIETA TRINDADE CENTRO MUNICIPAL DE EDUCACAO INFANTIL,4113700,LONDRINA,PR,Sul,1,3,0.0,0.0,0.0,Em atividade,Municipal
2013,41365020,ANTONIO AUGUSTO FARIA CENTRO DE EDUCACAO INFANTIL,4113700,LONDRINA,PR,Sul,1,4,0.0,0.0,0.0,Em atividade,Privada
2013,41029712,ANTONIO DE MORAES BARROS C E EF M,4113700,LONDRINA,PR,Sul,1,2,0.0,3.5999999046325684,0.0,Em atividade,Estadual
2013,41384431,APRENDENDO BRINCANDO CENTRO EDUCACAO INFANTIL,4113700,LONDRINA,PR,Sul,1,4,0.0,0.0,0.0,Em atividade,Privada
2013,41029739,ARACY S DOS SANTOS E M PROF EI EF,4113700,LONDRINA,PR,Sul,1,3,5.5,2.799999952316284,0.0,Em atividade,Municipal
2013,41364996,ARACY SOARES SANTOS CENTRO DE EDUCACAO INFANTIL,4113700,LONDRINA,PR,Sul,1,4,0.0,0.0,0.0,Em atividade,Privada
