anoCenso,cod,nome,codCidade,cidade,estado,regiao,situacaoFuncionamento,dependenciaAdministrativa,idebAI,idebAF,enemMediaGeral,situacaoFuncionamentoTxt,dependenciaAdministrativaTxt
2013,41111460,JACIABA E M C DE EI EF,4120606,PRUDENTOPOLIS,PR,Sul,1,3,0.0,0.0,0.0,Em atividade,Municipal
2013,41111486,JESUINO MARCONDES 1 SECCAO E M C EI EF,4120606,PRUDENTOPOLIS,PR,Sul,1,3,0.0,0.0,0.0,Em atividade,Municipal
2013,41111494,JOSE DURSKI E M CEL EI EF,4120606,PRUDENTOPOLIS,PR,Sul,1,3,6.599999904632568,0.0,0.0,Em atividade,Municipal
2013,41111508,JOSE MARTENETZ C E BISPO D EF M,4120606,PRUDENTOPOLIS,PR,Sul,1,2,0.0,0.0,443.88800048828125,Em atividade,Estadual
2013,41111516,JOSE ORESTES PREIMA C E PE EF M,4120606,PRUDENTOPOLIS,PR,Sul,1,2,0.0,4.199999809265137,0.0,Em atividade,Estadual
2013,41364058,JOSEFINA LUIZA AGIBERT C M E I,4120606,PRUDENTOPOLIS,PR,Sul,1,3,0.0,0.0,0.0,Em atividade,Municipal
2013,41111532,LIGACAO E M C DE EI EF,4120606,PRUDENTOPOLIS,PR,Sul,1,3,4.400000095367432,0.0,0.0,Em atividade,Municipal
2013,41111575,LINHA ESPERANCA E M C DE EI EF,4120606,PRUDENTOPOLIS,PR,Sul,1,3,0.0,0.0,0.0,Em atividade,Municipal
2013,41111613,LINHA IVAI 2 SECCAO E M C DE EF,4120606,PRUDENTOPOLIS,PR,Sul,1,3,0.0,0.0,0.0,Em atividade,Municipal
2013,41111630,LINHA MARRECAS DE CIMA E M C EF,4120606,PRUDENTOPOLIS,PR,Sul,1,3,0.0,0.0,0.0,Em atividade,Municipal
2013,41111664,LINHA PARANA SEDE E M C DE EF,4120606,PRUDENTOPOLIS,PR,Sul,1,3,0.0,0.0,0.0,Em atividade,Municipal
2013,41111680,LINHA PIQUIRI E M C DE EF,4120606,PRUDENTOPOLIS,PR,Sul,1,3,0.0,0.0,0.0,Em atividade,Municipal
2013,41111737,LINHA SETE DE SETEMBRO E M C DE EF,4120606,PRUDENTOPOLIS,PR,Sul,1,3,0.0,0.0,0.0,Em atividade,Municipal
2013,41111770,MACACOS E M C DE EF,4120606,PRUDENTOPOLIS,PR,Sul,1,3,0.0,0.0,0.0,Em atividade,Municipal
2013,41364031,MAE HONORINA C M E I,4120606,PRUDENTOPOLIS,PR,Sul,1,3,0.0,0.0,0.0,Em atividade,Municipal
2013,41111788,MANDURI E M C DE EF,4120606,PRUDENTOPOLIS,PR,Sul,1,3,0.0,0.0,0.0,Em atividade,Municipal
2013,41111796,MARCOS ANTONIU E M EI EF,4120606,PRUDENTOPOLIS,PR,Sul,1,3,0.0,0.0,0.0,Em atividade,Municipal
2013,41598016,NOSSA SENHORA DAS GRACAS C M E I,4120606,PRUDENTOPOLIS,PR,Sul,1,3,0.0,0.0,0.0,Em atividade,Municipal
2013,41353587,NOSSA SRA APARECIDA E M EI EF,4120606,PRUDENTOPOLIS,PR,Sul,1,3,5.5,0.0,0.0,Em atividade,Municipal
2013,41111869,NOSSO FUTURO C EI EF M,4120606,PRUDENTOPOLIS,PR,Sul,1,4,0.0,0.0,560.760009765625,Em atividade,Privada
2013,41111877,NOVA GALICIA E M C DE EF,4120606,PRUDENTOPOLIS,PR,Sul,1,3,0.0,0.0,0.0,Em atividade,Municipal
2013,41111915,PAPANDUVA D BAIXO 1 SECCAO E M C EF,4120606,PRUDENTOPOLIS,PR,Sul,1,3,0.0,0.0,0.0,Em atividade,Municipal
2013,41111923,PAPANDUVA DE CIMA C E DE EF M,4120606,PRUDENTOPOLIS,PR,Sul,1,2,0.0,3.799999952316284,0.0,Em atividade,Estadual
2013,41111958,PATOS VELHOS E M C DE EF,4120606,PRUDENTOPOLIS,PR,Sul,1,3,0.0,0.0,0.0,Em atividade,Municipal
2013,41111966,PEDRA BRANCA E M C DE EF,4120606,PRUDENTOPOLIS,PR,Sul,1,3,0.0,0.0,0.0,Em atividade,Municipal
2013,41111974,PEROBAS E M C DE EF,4120606,PRUDENTOPOLIS,PR,Sul,1,3,0.0,0.0,0.0,Em atividade,Municipal
2013,41111982,PIMENTAL 2 SECCAO E M C DE EF,4120606,PRUDENTOPOLIS,PR,Sul,1,3,0.0,0.0,0.0,Em atividade,Municipal
2013,41111990,PIMENTAL E M C DE EF,4120606,PRUDENTOPOLIS,PR,Sul,1,3,0.0,0.0,0.0,Em atividade,Municipal
2013,41112032,PONTE ALTA E M C DE EF,4120606,PRUDENTOPOLIS,PR,Sul,1,3,0.0,0.0,0.0,Em atividade,Municipal
2013,41112040,PONTE NOVA E M C DE EF,4120606,PRUDENTOPOLIS,PR,Sul,1,3,0.0,0.0,0.0,Em atividade,Municipal
2013,41112148,RIO D AREIA ROSA OGG E M C DE EI EF,4120606,PRUDENTOPOLIS,PR,Sul,1,3,0.0,0.0,0.0,Em atividade,Municipal
2013,41112130,RIO D PATOS PRES KENNEDY E M C DE EF,4120606,PRUDENTOPOLIS,PR,Sul,1,3,0.0,0.0,0.0,Em atividade,Municipal
2013,41112237,SANTA C ALEXANDRIA E E EF,4120606,PRUDENTOPOLIS,PR,Sul,1,2,0.0,0.0,0.0,Em atividade,Estadual
2013,41112245,SANTA CLARA E M C DE EF,4120606,PRUDENTOPOLIS,PR,Sul,1,3,0.0,0.0,0.0,Em atividade,Municipal
2013,41375980,SANTA LUZIA C M E I,4120606,PRUDENTOPOLIS,PR,Sul,1,3,0.0,0.0,0.0,Em atividade,Municipal
2013,41112261,SANTANA DO BARRA SECA E M C DE EF,4120606,PRUDENTOPOLIS,PR,Sul,1,3,0.0,0.0,0.0,Em atividade,Municipal
2013,41112288,SAO FRANCISQUINHO E M C DE EF,4120606,PRUDENTOPOLIS,PR,Sul,1,3,0.0,0.0,0.0,Em atividade,Municipal
2013,41150678,SAO JOAO BATISTA E E C EF,4120606,PRUDENTOPOLIS,PR,Sul,1,2,0.0,3.5,0.0,Em atividade,Estadual
2013,41112300,SAO JOSE C EI EF M,4120606,PRUDENTOPOLIS,PR,Sul,1,4,0.0,0.0,539.3140258789062,Em atividade,Privada
2013,41364040,SAO JOSE DE ARIMATEIA C M E I,4120606,PRUDENTOPOLIS,PR,Sul,1,3,0.0,0.0,0.0,Em atividade,Municipal
2013,41112318,SAO LUCAS E E EF,4120606,PRUDENTOPOLIS,PR,Sul,1,2,0.0,4.400000095367432,0.0,Em atividade,Estadual
2013,41112334,SAO PEDRO E M C DE EF,4120606,PRUDENTOPOLIS,PR,Sul,1,3,0.0,0.0,0.0,Em atividade,Municipal
2013,41112342,SAO SEBASTIAO E M C DE EF,4120606,PRUDENTOPOLIS,PR,Sul,1,3,0.0,0.0,0.0,Em atividade,Municipal
2013,41112350,SERRA DA ESPERANCA 1 SECCAO E M C DE EF,4120606,PRUDENTOPOLIS,PR,Sul,1,3,0.0,0.0,0.0,Em atividade,Municipal
2013,41112407,SEVERO AGIBERT E M EI EF,4120606,PRUDENTOPOLIS,PR,Sul,1,3,6.0,0.0,0.0,Em atividade,Municipal
2013,41112423,TABOAO E M C DE EF,4120606,PRUDENTOPOLIS,PR,Sul,1,3,0.0,0.0,0.0,Em atividade,Municipal
2013,41112458,TIJUCO PRETO E M C DE EI EF,4120606,PRUDENTOPOLIS,PR,Sul,1,3,0.0,0.0,0.0,Em atividade,Municipal
2013,41112466,TIRADENTES E M EI EF,4120606,PRUDENTOPOLIS,PR,Sul,1,3,5.300000190734863,0.0,0.0,Em atividade,Municipal
2013,41152263,UEP 28 - UNIDADE DE EDUCACAO PROFISSIONAL DE PRUDENTOPOLIS- SENAC,4120606,PRUDENTOPOLIS,PR,Sul,1,4,0.0,0.0,0.0,Em atividade,Privada
2013,41112482,VILA DAS FLORES E M EI EF,4120606,PRUDENTOPOLIS,PR,Sul,1,3,6.300000190734863,0.0,0.0,Em atividade,Municipal
2013,41112490,VILA NOVA C E EF M,4120606,PRUDENTOPOLIS,PR,Sul,1,2,0.0,3.4000000953674316,0.0,Em atividade,Estadual
2013,41112504,VISTA ALEGRE E M C DE EF,4120606,PRUDENTOPOLIS,PR,Sul,1,3,0.0,0.0,0.0,Em atividade,Municipal
2013,41151151,ZILDA ARNS C M E I,4120606,PRUDENTOPOLIS,PR,Sul,1,3,0.0,0.0,0.0,Em atividade,Municipal
2013,41012070,BANDEIRANTES D OESTE C E EF M,4120655,QUARTO CENTENARIO,PR,Sul,1,2,0.0,4.099999904632568,0.0,Em atividade,Estadual
2013,41012127,CASTELO BRANCO E M PRES EI EF,4120655,QUARTO CENTENARIO,PR,Sul,1,3,6.199999809265137,0.0,0.0,Em atividade,Municipal
2013,41012186,CORACAO DE MARIA C M E I,4120655,QUARTO CENTENARIO,PR,Sul,1,3,0.0,0.0,0.0,Em atividade,Municipal
2013,41012305,GERMANA A MOLEIRO E M EI EF,4120655,QUARTO CENTENARIO,PR,Sul,1,3,5.300000190734863,0.0,0.0,Em atividade,Municipal
2013,41012321,IV CENTENARIO C E EF M,4120655,QUARTO CENTENARIO,PR,Sul,1,2,0.0,4.5,456.5260009765625,Em atividade,Estadual
2013,41051513,BOM PASTOR E M EF,4120705,QUATIGUA,PR,Sul,1,3,7.0,0.0,0.0,Em atividade,Municipal
2013,41051556,JOAO M DA SILVEIRA C E EF M,4120705,QUATIGUA,PR,Sul,1,2,0.0,4.199999809265137,473.8399963378906,Em atividade,Estadual
2013,41383591,SANTA MARIA C M E I,4120705,QUATIGUA,PR,Sul,1,3,0.0,0.0,0.0,Em atividade,Municipal
2013,41145003,SAO LUCAS E EI EF MOD ED ESP,4120705,QUATIGUA,PR,Sul,1,4,0.0,0.0,0.0,Em atividade,Privada
2013,41136292,ANDRE ANDREATTA C E EF M,4120804,QUATRO BARRAS,PR,Sul,1,2,0.0,4.199999809265137,0.0,Em atividade,Estadual
2013,41136306,ARLINDA F CREPLIVE C E EF M PROFIS,4120804,QUATRO BARRAS,PR,Sul,1,2,0.0,3.200000047683716,478.2900085449219,Em atividade,Estadual
2013,41136373,COLEGIO DOM ORIONE - EDUC INF ENS FUND E MEDIO,4120804,QUATRO BARRAS,PR,Sul,1,4,0.0,0.0,576.7999877929688,Em atividade,Privada
2013,41136349,COLEGIO GRACIOSA - EDUCACAO INFANTIL ENSINO FUNDAMENTAL E MEDIO,4120804,QUATRO BARRAS,PR,Sul,1,4,0.0,0.0,581.219970703125,Em atividade,Privada
2013,41417828,COLEGIO SESI - QUATRO BARRAS,4120804,QUATRO BARRAS,PR,Sul,1,4,0.0,0.0,519.2239990234375,Em atividade,Privada
2013,41136322,DEVANIRA F ALVES E M EI EF,4120804,QUATRO BARRAS,PR,Sul,1,3,5.5,0.0,0.0,Em atividade,Municipal
2013,41352610,ELIAS ABRAHAO C E EF M,4120804,QUATRO BARRAS,PR,Sul,1,2,0.0,4.400000095367432,492.27801513671875,Em atividade,Estadual
2013,41136330,ERNESTO MILANI E M EF,4120804,QUATRO BARRAS,PR,Sul,1,3,5.800000190734863,0.0,0.0,Em atividade,Municipal
2013,41136357,IZAIR LAGO E M EI EF,4120804,QUATRO BARRAS,PR,Sul,1,3,5.599999904632568,0.0,0.0,Em atividade,Municipal
2013,41549899,JOANNA VALACHE E M PROFA EI EF MOD E E,4120804,QUATRO BARRAS,PR,Sul,1,3,0.0,0.0,0.0,Em atividade,Municipal
2013,41136365,JOAO C DA SILVA E M EI EF,4120804,QUATRO BARRAS,PR,Sul,1,3,6.900000095367432,0.0,0.0,Em atividade,Municipal
2013,41352637,RUI VALDIR P KERN E M EI EF,4120804,QUATRO BARRAS,PR,Sul,1,3,5.5,0.0,0.0,Em atividade,Municipal
2013,41136381,TANCREDO A NEVES E M PRES EI EF,4120804,QUATRO BARRAS,PR,Sul,1,3,5.099999904632568,0.0,0.0,Em atividade,Municipal
2013,41381319,TIA CARMELITA C M E I,4120804,QUATRO BARRAS,PR,Sul,1,3,0.0,0.0,0.0,Em atividade,Municipal
2013,41360516,TIA ELENAI C M E I,4120804,QUATRO BARRAS,PR,Sul,1,3,0.0,0.0,0.0,Em atividade,Municipal
2013,41360524,TIA ELIANA C M E I,4120804,QUATRO BARRAS,PR,Sul,1,3,0.0,0.0,0.0,Em atividade,Municipal
2013,41148916,TIA INEZ C M E I,4120804,QUATRO BARRAS,PR,Sul,1,3,0.0,0.0,0.0,Em atividade,Municipal
2013,41360494,TIA JACI C M E I,4120804,QUATRO BARRAS,PR,Sul,1,3,0.0,0.0,0.0,Em atividade,Municipal
2013,41360508,TIA LEONOR C M E I,4120804,QUATRO BARRAS,PR,Sul,1,3,0.0,0.0,0.0,Em atividade,Municipal
2013,41546903,CANTINHO FELIZ C M E I,4120853,QUATRO PONTES,PR,Sul,1,3,0.0,0.0,0.0,Em atividade,Municipal
2013,41066880,LEOPOLDINA E M DONA EI EF,4120853,QUATRO PONTES,PR,Sul,1,3,6.0,0.0,0.0,Em atividade,Municipal
2013,41066898,QUATRO PONTES C E EF M,4120853,QUATRO PONTES,PR,Sul,1,2,0.0,5.099999904632568,512.6300048828125,Em atividade,Estadual
2013,41389689,12 DE JULHO E R M EF,4120903,QUEDAS DO IGUACU,PR,Sul,1,3,0.0,0.0,0.0,Em atividade,Municipal
2013,41105656,ALTO ALEGRE C E C EF M,4120903,QUEDAS DO IGUACU,PR,Sul,1,2,0.0,0.0,0.0,Em atividade,Estadual
2013,41105176,ALTO RECREIO C E EF M,4120903,QUEDAS DO IGUACU,PR,Sul,1,2,0.0,4.300000190734863,465.02801513671875,Em atividade,Estadual
2013,41148487,ANJO DA GUARDA C M E I,4120903,QUEDAS DO IGUACU,PR,Sul,1,3,0.0,0.0,0.0,Em atividade,Municipal
2013,41389662,ANTONIO RODRIGUES DA SILVA E R M EF,4120903,QUEDAS DO IGUACU,PR,Sul,1,3,0.0,0.0,0.0,Em atividade,Municipal
2013,41378016,ARAUCARIA E M EI EF,4120903,QUEDAS DO IGUACU,PR,Sul,1,3,0.0,0.0,0.0,Em atividade,Municipal
2013,41105222,ARNALDO BUSATO C E EF M,4120903,QUEDAS DO IGUACU,PR,Sul,1,2,0.0,5.400000095367432,472.75799560546875,Em atividade,Estadual
2013,41105311,CASTELO BRANCO E M EI EF,4120903,QUEDAS DO IGUACU,PR,Sul,1,3,5.800000190734863,0.0,0.0,Em atividade,Municipal
2013,41359690,CASTRO ALVES C E EF M,4120903,QUEDAS DO IGUACU,PR,Sul,1,2,0.0,6.400000095367432,540.5700073242188,Em atividade,Estadual
2013,41105346,CECILIA MEIRELES E M EI EF,4120903,QUEDAS DO IGUACU,PR,Sul,1,3,6.0,0.0,0.0,Em atividade,Municipal
2013,41359704,CEEBJA QUEDAS DO IGUACU EF M,4120903,QUEDAS DO IGUACU,PR,Sul,1,2,0.0,0.0,0.0,Em atividade,Estadual
2013,41389778,CHICO MENDES C E C EF M,4120903,QUEDAS DO IGUACU,PR,Sul,1,2,0.0,3.799999952316284,0.0,Em atividade,Estadual
2013,41557905,CONSTRUINDO NOVOS CAMINHOS E E C EF,4120903,QUEDAS DO IGUACU,PR,Sul,1,2,0.0,3.799999952316284,0.0,Em atividade,Estadual
2013,41380550,CRIANCA FELIZ C M E I,4120903,QUEDAS DO IGUACU,PR,Sul,1,3,0.0,0.0,0.0,Em atividade,Municipal
2013,41105257,ELVIRA A SEVERGNINI E EI EF MOD ED ESP,4120903,QUEDAS DO IGUACU,PR,Sul,1,4,0.0,0.0,0.0,Em atividade,Privada
2013,41148479,ESTRELA GUIA C M E I,4120903,QUEDAS DO IGUACU,PR,Sul,1,3,0.0,0.0,0.0,Em atividade,Municipal
2013,41151054,GABRIEL ARCANJO - C M E I,4120903,QUEDAS DO IGUACU,PR,Sul,1,3,0.0,0.0,0.0,Em atividade,Municipal
2013,41105460,GRALHA AZUL E M EI EF,4120903,QUEDAS DO IGUACU,PR,Sul,1,3,5.300000190734863,0.0,0.0,Em atividade,Municipal
2013,41354044,IMACULADO C DE MARIA C EI EF M,4120903,QUEDAS DO IGUACU,PR,Sul,1,4,0.0,0.0,0.0,Em atividade,Privada
2013,41105486,INDEPENDENCIA E R M EI EF,4120903,QUEDAS DO IGUACU,PR,Sul,1,3,0.0,0.0,0.0,Em atividade,Municipal
2013,41389590,JANETE DOS SANTOS E R M EI EF,4120903,QUEDAS DO IGUACU,PR,Sul,1,3,0.0,0.0,0.0,Em atividade,Municipal
2013,41105508,JARBAS PASSARINHO E R M EI EF,4120903,QUEDAS DO IGUACU,PR,Sul,1,3,0.0,0.0,0.0,Em atividade,Municipal
2013,41151046,JARDIM FLORESTA E M EF,4120903,QUEDAS DO IGUACU,PR,Sul,1,3,0.0,0.0,0.0,Em atividade,Municipal
2013,41105575,JOSE DE ANCHIETA C E EF M,4120903,QUEDAS DO IGUACU,PR,Sul,1,2,0.0,4.099999904632568,0.0,Em atividade,Estadual
2013,41105605,JULIO DE CASTILHOS E M EI EF,4120903,QUEDAS DO IGUACU,PR,Sul,1,3,6.5,0.0,0.0,Em atividade,Municipal
2013,41105613,LAGEADO BONITO C E C EF M,4120903,QUEDAS DO IGUACU,PR,Sul,1,2,0.0,0.0,0.0,Em atividade,Estadual
2013,41105664,LINHA ESTRELA E E DE EF,4120903,QUEDAS DO IGUACU,PR,Sul,1,2,0.0,0.0,0.0,Em atividade,Estadual
2013,41389700,LUIZ CARLOS PRESTES E R M EI EF,4120903,QUEDAS DO IGUACU,PR,Sul,1,3,4.599999904632568,0.0,0.0,Em atividade,Municipal
2013,41359682,MEU CANTINHO C M E I,4120903,QUEDAS DO IGUACU,PR,Sul,1,3,0.0,0.0,0.0,Em atividade,Municipal
2013,41389646,NOSSA SENHORA APARECIDA E R M EF,4120903,QUEDAS DO IGUACU,PR,Sul,1,3,0.0,0.0,0.0,Em atividade,Municipal
2013,41105869,NUCLEO RESID PINDORAMA E E EF,4120903,QUEDAS DO IGUACU,PR,Sul,1,2,0.0,4.400000095367432,0.0,Em atividade,Estadual
2013,41388070,OLGA BENARIO PRESTES C E EF M,4120903,QUEDAS DO IGUACU,PR,Sul,1,2,0.0,3.299999952316284,0.0,Em atividade,Estadual
2013,41105230,PEDRO ALZIDES GIRALDI E M EI EF,4120903,QUEDAS DO IGUACU,PR,Sul,1,3,0.0,0.0,0.0,Em atividade,Municipal
2013,41359674,PEQUENO COLIBRI C M E I,4120903,QUEDAS DO IGUACU,PR,Sul,1,3,0.0,0.0,0.0,Em atividade,Municipal
2013,41105877,PINHEIRAIS E M EI EF,4120903,QUEDAS DO IGUACU,PR,Sul,1,3,6.099999904632568,0.0,0.0,Em atividade,Municipal
2013,41105893,PRIMAVERA E M EI EF,4120903,QUEDAS DO IGUACU,PR,Sul,1,3,6.099999904632568,0.0,0.0,Em atividade,Municipal
2013,41105923,QUINTINO BOCAIUVA E R M EI EF,4120903,QUEDAS DO IGUACU,PR,Sul,1,3,4.800000190734863,0.0,0.0,Em atividade,Municipal
2013,41105931,RAIO DE SOL E EI EF,4120903,QUEDAS DO IGUACU,PR,Sul,1,4,0.0,0.0,0.0,Em atividade,Privada
2013,41389697,ROSELI NUNES E R M EI EF,4120903,QUEDAS DO IGUACU,PR,Sul,1,3,0.0,0.0,0.0,Em atividade,Municipal
2013,41105982,SALTO OSORIO E M EI EF,4120903,QUEDAS DO IGUACU,PR,Sul,1,3,6.800000190734863,0.0,0.0,Em atividade,Municipal
2013,41106016,SANTOS DUMONT E M EI EF,4120903,QUEDAS DO IGUACU,PR,Sul,1,3,5.599999904632568,0.0,0.0,Em atividade,Municipal
2013,41389638,SEMENTES DO AMANHA E R M EF,4120903,QUEDAS DO IGUACU,PR,Sul,1,3,0.0,0.0,0.0,Em atividade,Municipal
2013,41106075,SIGISMUNDO C E PE EF M N PROFIS,4120903,QUEDAS DO IGUACU,PR,Sul,1,2,0.0,5.300000190734863,492.6419982910156,Em atividade,Estadual
2013,41378008,URSINHO CARINHOSO C M E I,4120903,QUEDAS DO IGUACU,PR,Sul,1,3,0.0,0.0,0.0,Em atividade,Municipal
2013,41106172,VILA JOHN KENNEDY C E DA EF M,4120903,QUEDAS DO IGUACU,PR,Sul,1,2,0.0,4.300000190734863,0.0,Em atividade,Estadual
2013,41002954,BRASILIO DE A FILHO E M EI EF,4121000,QUERENCIA DO NORTE,PR,Sul,1,3,0.0,0.0,0.0,Em atividade,Municipal
2013,41002962,CASTRO ALVES C E EF M,4121000,QUERENCIA DO NORTE,PR,Sul,1,2,0.0,4.099999904632568,0.0,Em atividade,Estadual
2013,41144996,CENTRAO C E C EI EF M PROFIS,4121000,QUERENCIA DO NORTE,PR,Sul,1,2,0.0,2.700000047683716,0.0,Em atividade,Estadual
2013,41002970,CHICO MENDES E C M EI EF,4121000,QUERENCIA DO NORTE,PR,Sul,1,3,5.5,0.0,0.0,Em atividade,Municipal
2013,41353595,EZOLDINA SCHUEROFF E EI EF MOD ED ESP,4121000,QUERENCIA DO NORTE,PR,Sul,1,4,0.0,0.0,0.0,Em atividade,Privada
2013,41003012,GILBERTO CONCEICAO BORSATTO E M EF,4121000,QUERENCIA DO NORTE,PR,Sul,1,3,4.0,0.0,0.0,Em atividade,Municipal
2013,41003020,HUMBERTO DE CAMPOS C E EF M N PROFIS,4121000,QUERENCIA DO NORTE,PR,Sul,1,2,0.0,4.300000190734863,0.0,Em atividade,Estadual
2013,41003039,JOSE FRANCISCO COSTA E M EI EF,4121000,QUERENCIA DO NORTE,PR,Sul,1,3,0.0,0.0,0.0,Em atividade,Municipal
2013,41363086,MARIA CRISTINA C M E I,4121000,QUERENCIA DO NORTE,PR,Sul,1,3,0.0,0.0,0.0,Em atividade,Municipal
2013,41378113,MARIA DE L A BARBOSA C M E I,4121000,QUERENCIA DO NORTE,PR,Sul,1,3,0.0,0.0,0.0,Em atividade,Municipal
2013,41003063,MONTEIRO LOBATO E M EF,4121000,QUERENCIA DO NORTE,PR,Sul,1,3,5.099999904632568,0.0,0.0,Em atividade,Municipal
2013,41378105,PEQUENO PRINCIPE C M E I,4121000,QUERENCIA DO NORTE,PR,Sul,1,3,0.0,0.0,0.0,Em atividade,Municipal
2013,41365593,GENTE INOCENTE C M E I,4121109,QUINTA DO SOL,PR,Sul,1,3,0.0,0.0,0.0,Em atividade,Municipal
2013,41018133,PEQUENO PRINCIPE E M EI EF,4121109,QUINTA DO SOL,PR,Sul,1,3,5.599999904632568,0.0,0.0,Em atividade,Municipal
2013,41018150,SAO JUDAS TADEU C E EF M,4121109,QUINTA DO SOL,PR,Sul,1,2,0.0,3.299999952316284,476.4880065917969,Em atividade,Estadual
2013,41151569,ZILDA ARNS E EI EF MOD ED ESP,4121109,QUINTA DO SOL,PR,Sul,1,4,0.0,0.0,0.0,Em atividade,Privada
2013,41357116,ALICE SANTANA PINTO E EI EF MOD ED ESP,4121208,QUITANDINHA,PR,Sul,1,4,0.0,0.0,0.0,Em atividade,Privada
2013,41142004,ANTONIO E M PE EF,4121208,QUITANDINHA,PR,Sul,1,3,6.0,0.0,0.0,Em atividade,Municipal
2013,41142020,BOM JESUS E M EI EF,4121208,QUITANDINHA,PR,Sul,1,3,5.800000190734863,0.0,0.0,Em atividade,Municipal
2013,41142039,CAETANO M DA ROCHA C E DO C DR EF M,4121208,QUITANDINHA,PR,Sul,1,2,0.0,4.300000190734863,0.0,Em atividade,Estadual
2013,41581890,DIVINA MISERICORDIA ESCOLA EDUCACAO INFANTIL E ENSINO FUNDAMENTAL,4121208,QUITANDINHA,PR,Sul,1,4,0.0,0.0,0.0,Em atividade,Privada
2013,41142055,DOCE FINO C E C DE EF M,4121208,QUITANDINHA,PR,Sul,1,2,0.0,4.099999904632568,0.0,Em atividade,Estadual
2013,41142063,ELEUTERIO F DE ANDRADE C E EF M,4121208,QUITANDINHA,PR,Sul,1,2,0.0,4.699999809265137,0.0,Em atividade,Estadual
2013,41142209,ESPERANCA DO AMANHA C M E I,4121208,QUITANDINHA,PR,Sul,1,3,0.0,0.0,0.0,Em atividade,Municipal
2013,41362268,FRANCISCO LECHINOSKI C E C EF M,4121208,QUITANDINHA,PR,Sul,1,2,0.0,3.200000047683716,0.0,Em atividade,Estadual
2013,41142136,JOAO L JACOMEL E R M DEP EI EF,4121208,QUITANDINHA,PR,Sul,1,3,6.0,0.0,0.0,Em atividade,Municipal
2013,41355326,JOAO RIBEIRO DE MOURA C M E I,4121208,QUITANDINHA,PR,Sul,1,3,0.0,0.0,0.0,Em atividade,Municipal
2013,41372581,LAGOA VERDE E E C EF,4121208,QUITANDINHA,PR,Sul,1,2,0.0,0.0,0.0,Em atividade,Estadual
2013,41142101,LEONOR M DE ANDRADE E R M EI EF,4121208,QUITANDINHA,PR,Sul,1,3,4.599999904632568,0.0,0.0,Em atividade,Municipal
2013,41142217,MIGUEL J MICKOSZ C E C MONS EF M,4121208,QUITANDINHA,PR,Sul,1,2,0.0,4.0,0.0,Em atividade,Estadual
2013,41142225,MIGUEL LECZ E R M EI EF,4121208,QUITANDINHA,PR,Sul,1,3,5.599999904632568,0.0,0.0,Em atividade,Municipal
2013,41360486,PAULO FREIRE C E C PROF EF M,4121208,QUITANDINHA,PR,Sul,1,2,0.0,4.599999904632568,0.0,Em atividade,Estadual
2013,41142390,SAO JOAO E R M EI EF,4121208,QUITANDINHA,PR,Sul,1,3,0.0,0.0,0.0,Em atividade,Municipal
2013,41142080,VILSON HASSELMANN E R M EI EF,4121208,QUITANDINHA,PR,Sul,1,3,5.800000190734863,0.0,0.0,Em atividade,Municipal
2013,41078519,ALBERTO SANTOS DUMONT C E C EF M,4121257,RAMILANDIA,PR,Sul,1,2,0.0,0.0,458.26800537109375,Em atividade,Estadual
2013,41078527,ARLINDO GOUVEIA E M EI EF,4121257,RAMILANDIA,PR,Sul,1,3,5.300000190734863,0.0,0.0,Em atividade,Municipal
2013,41389131,MARIA ALICE DE BARROS C M E I,4121257,RAMILANDIA,PR,Sul,1,3,0.0,0.0,0.0,Em atividade,Municipal
2013,41371321,ARTHUR SERAFIM MARQUES E M EF,4121307,RANCHO ALEGRE,PR,Sul,1,3,5.199999809265137,0.0,0.0,Em atividade,Municipal
2013,41376242,MARIA EMILIA B R CUNHA C M E I,4121307,RANCHO ALEGRE,PR,Sul,1,3,0.0,0.0,0.0,Em atividade,Municipal
2013,41041364,PAULINA PACIFICO BORSARI C E EF M N,4121307,RANCHO ALEGRE,PR,Sul,1,2,0.0,3.0999999046325684,471.71600341796875,Em atividade,Estadual
2013,41367154,BOM JESUS C M E I,4121356,RANCHO ALEGRE D OESTE,PR,Sul,1,3,0.0,0.0,0.0,Em atividade,Municipal
2013,41014146,MANOEL M MARTINS E M EF,4121356,RANCHO ALEGRE D OESTE,PR,Sul,1,3,3.9000000953674316,0.0,0.0,Em atividade,Municipal
2013,41602986,PEQUENO PRINCIPE C M E I,4121356,RANCHO ALEGRE D OESTE,PR,Sul,1,3,0.0,0.0,0.0,Em atividade,Municipal
2013,41014154,RANCHO ALEGRE C E EF M,4121356,RANCHO ALEGRE D OESTE,PR,Sul,1,2,0.0,3.700000047683716,464.760009765625,Em atividade,Estadual
2013,41082710,24 DE JUNHO E M EI EF,4121406,REALEZA,PR,Sul,1,3,6.800000190734863,0.0,0.0,Em atividade,Municipal
2013,41082249,CARLOS EDUARDO E E D EF,4121406,REALEZA,PR,Sul,1,2,0.0,5.599999904632568,0.0,Em atividade,Estadual
2013,41611896,CRIANCA FELIZ C M E I,4121406,REALEZA,PR,Sul,1,3,0.0,0.0,0.0,Em atividade,Municipal
2013,41082290,DOZE DE NOVEMBRO C E EM PROFIS,4121406,REALEZA,PR,Sul,1,2,0.0,0.0,512.4520263671875,Em atividade,Estadual
2013,41082320,FLOR DA SERRA C E C DE EF M,4121406,REALEZA,PR,Sul,1,2,0.0,5.5,466.8399963378906,Em atividade,Estadual
2013,41082346,GUERINO LOTICI E M C VER EI EF,4121406,REALEZA,PR,Sul,1,3,0.0,0.0,0.0,Em atividade,Municipal
2013,41082362,INDEPENDENCIA E M EI EF,4121406,REALEZA,PR,Sul,1,3,6.199999809265137,0.0,0.0,Em atividade,Municipal
2013,41082389,JOAO PAULO II C E EF M,4121406,REALEZA,PR,Sul,1,2,0.0,5.0,0.0,Em atividade,Estadual
2013,41082427,JUSCELINO KUBITSCHEK E M EI EF,4121406,REALEZA,PR,Sul,1,3,7.400000095367432,0.0,0.0,Em atividade,Municipal
2013,41421825,LUDOVICO REDIN CENTRO JUVENIL PADRE,4121406,REALEZA,PR,Sul,1,3,0.0,0.0,0.0,Em atividade,Municipal
2013,41082524,MENINO JESUS E M EI EF,4121406,REALEZA,PR,Sul,1,3,7.300000190734863,0.0,0.0,Em atividade,Municipal
2013,41082532,MODESTO DE PALMA E M C EI EF,4121406,REALEZA,PR,Sul,1,3,0.0,0.0,0.0,Em atividade,Municipal
2013,41370970,PEQUENO PRINCIPE C M E I,4121406,REALEZA,PR,Sul,1,3,0.0,0.0,0.0,Em atividade,Municipal
2013,41370953,PINGO DE GENTE C M E I,4121406,REALEZA,PR,Sul,1,3,0.0,0.0,0.0,Em atividade,Municipal
2013,41082567,PRIMAVERA E EI EF MOD ED ESP,4121406,REALEZA,PR,Sul,1,4,0.0,0.0,0.0,Em atividade,Privada
2013,41082591,REAL C EI EF M,4121406,REALEZA,PR,Sul,1,4,0.0,0.0,545.8419799804688,Em atividade,Privada
2013,41082630,SALTINHO E E C EF,4121406,REALEZA,PR,Sul,1,2,0.0,0.0,0.0,Em atividade,Estadual
2013,41145593,SANTO ANTONIO E M EI EF,4121406,REALEZA,PR,Sul,1,3,0.0,0.0,0.0,Em atividade,Municipal
2013,41354346,TESOURO ENCANTADO E EI EF,4121406,REALEZA,PR,Sul,1,4,0.0,0.0,0.0,Em atividade,Privada
2013,41150694,UNIVERSIDADE DA CRIANCA E M EI EF,4121406,REALEZA,PR,Sul,1,3,0.0,0.0,0.0,Em atividade,Municipal
2013,41150686,VO TOTINHA C M E I,4121406,REALEZA,PR,Sul,1,3,0.0,0.0,0.0,Em atividade,Municipal
2013,41114388,DIVINO ESPIRITO SANTO E R M EI EF,4121505,REBOUCAS,PR,Sul,1,3,5.199999809265137,0.0,0.0,Em atividade,Municipal
2013,41114396,ERASMO PILOTTO E M EI EF,4121505,REBOUCAS,PR,Sul,1,3,5.300000190734863,0.0,0.0,Em atividade,Municipal
2013,41114400,FAXINAL DOS FRANCOS C E DE EF M,4121505,REBOUCAS,PR,Sul,1,2,0.0,0.0,0.0,Em atividade,Estadual
2013,41114418,FAXINAL DOS MARMELEIROS C E DE EF M,4121505,REBOUCAS,PR,Sul,1,2,0.0,5.0,0.0,Em atividade,Estadual
2013,41114426,IMACULADA C DE MARIA E M EI EF,4121505,REBOUCAS,PR,Sul,1,3,0.0,0.0,0.0,Em atividade,Municipal
2013,41375467,IRACEMA DE AZEVEDO BITTENCOURT C M E I,4121505,REBOUCAS,PR,Sul,1,3,0.0,0.0,0.0,Em atividade,Municipal
2013,41382030,JOANITA A PEREIRA E M EI EF,4121505,REBOUCAS,PR,Sul,1,3,4.699999809265137,0.0,0.0,Em atividade,Municipal
2013,41114442,JULIO CESAR C E PROF EF M N,4121505,REBOUCAS,PR,Sul,1,2,0.0,3.299999952316284,0.0,Em atividade,Estadual
2013,41114450,LEONARDO KRUL E M PROF EI EF,4121505,REBOUCAS,PR,Sul,1,3,5.599999904632568,0.0,0.0,Em atividade,Municipal
2013,41114469,MARIA IGNACIA C E PROFA EF M,4121505,REBOUCAS,PR,Sul,1,2,0.0,4.5,0.0,Em atividade,Estadual
2013,41375408,NOSSA SENHORA APARECIDA C M E I,4121505,REBOUCAS,PR,Sul,1,3,0.0,0.0,0.0,Em atividade,Municipal
2013,41114507,NOSSA SENHORA DE LOURDES E R M EF,4121505,REBOUCAS,PR,Sul,1,3,0.0,0.0,0.0,Em atividade,Municipal
2013,41375394,OBRA MISSIONARIA MENSAGEM DA PAZ CTRO EDUC INF,4121505,REBOUCAS,PR,Sul,1,4,0.0,0.0,0.0,Em atividade,Privada
2013,41145607,REBOUCAS E DE EI EF MOD ED ESP,4121505,REBOUCAS,PR,Sul,1,4,0.0,0.0,0.0,Em atividade,Privada
2013,41375424,SANTA ROSA - CTRO MUL - EDUC INF,4121505,REBOUCAS,PR,Sul,1,3,0.0,0.0,0.0,Em atividade,Municipal
2013,41114612,SAO JOSE E M EI EF,4121505,REBOUCAS,PR,Sul,1,3,5.900000095367432,0.0,0.0,Em atividade,Municipal
2013,41114620,SAO MIGUEL E R M EF,4121505,REBOUCAS,PR,Sul,1,3,0.0,0.0,0.0,Em atividade,Municipal
2013,41365828,GIRASSOL C M E I,4121604,RENASCENCA,PR,Sul,1,3,0.0,0.0,0.0,Em atividade,Municipal
2013,41088182,IDA KUMMER E M PROFA EF,4121604,RENASCENCA,PR,Sul,1,3,5.400000095367432,0.0,0.0,Em atividade,Municipal
2013,41088093,RENASCENCA E EI EF MOD ED ESP,4121604,RENASCENCA,PR,Sul,1,4,0.0,0.0,0.0,Em atividade,Privada
2013,41088280,RENASCENCA PE J J VICENTE C E DE EF M,4121604,RENASCENCA,PR,Sul,1,2,0.0,4.199999809265137,482.9320068359375,Em atividade,Estadual
2013,41361750,ALBANO G MARTINS E E C PREF EF,4121703,RESERVA,PR,Sul,1,2,0.0,4.099999904632568,0.0,Em atividade,Estadual
2013,41054903,ALBERTO KURCHEIDT E E EF,4121703,RESERVA,PR,Sul,1,2,0.0,0.0,0.0,Em atividade,Estadual
2013,41055039,ARTUR ANTUNES RIBEIRO E R M EF,4121703,RESERVA,PR,Sul,1,3,4.199999809265137,0.0,0.0,Em atividade,Municipal
2013,41055047,ATAIDE MENDES BATISTA E M EF,4121703,RESERVA,PR,Sul,1,3,5.099999904632568,0.0,0.0,Em atividade,Municipal
2013,41055055,AUGUSTO BALHS E R M EF,4121703,RESERVA,PR,Sul,1,3,0.0,0.0,0.0,Em atividade,Municipal
2013,41055080,BENJAMIM BRANCO E R M EF,4121703,RESERVA,PR,Sul,1,3,0.0,0.0,0.0,Em atividade,Municipal
2013,41145704,CAMPINAS BELAS E E EF,4121703,RESERVA,PR,Sul,1,2,0.0,4.300000190734863,0.0,Em atividade,Estadual
2013,41055144,CANECA E R M FR EF,4121703,RESERVA,PR,Sul,1,3,0.0,0.0,0.0,Em atividade,Municipal
2013,41151534,CANTINHO DO SABER - C M E I,4121703,RESERVA,PR,Sul,1,3,0.0,0.0,0.0,Em atividade,Municipal
