anoCenso,cod,nome,codCidade,cidade,estado,regiao,situacaoFuncionamento,dependenciaAdministrativa,idebAI,idebAF,enemMediaGeral,situacaoFuncionamentoTxt,dependenciaAdministrativaTxt
2013,52044580,ESCOLA CORA CORALINA FONTE DO SABER,5205513,COCALZINHO DE GOIAS,GO,Centro-Oeste,1,4,0.0,0.0,0.0,Em atividade,Privada
2013,52044629,ESCOLA MUNICIPAL ALTO DA BOA VISTA,5205513,COCALZINHO DE GOIAS,GO,Centro-Oeste,1,3,4.599999904632568,0.0,0.0,Em atividade,Municipal
2013,52044742,ESCOLA MUNICIPAL LAJES,5205513,COCALZINHO DE GOIAS,GO,Centro-Oeste,1,3,0.0,0.0,0.0,Em atividade,Municipal
2013,52044785,ESCOLA MUNICIPAL LINHARES,5205513,COCALZINHO DE GOIAS,GO,Centro-Oeste,1,3,0.0,0.0,0.0,Em atividade,Municipal
2013,52089150,ESCOLA MUNICIPAL MARIA DO CARMO GUIRRA,5205513,COCALZINHO DE GOIAS,GO,Centro-Oeste,1,3,5.199999809265137,0.0,0.0,Em atividade,Municipal
2013,52045021,ESCOLA MUNICIPAL MODELO,5205513,COCALZINHO DE GOIAS,GO,Centro-Oeste,1,3,5.599999904632568,5.199999809265137,0.0,Em atividade,Municipal
2013,52119203,ESCOLA MUNICIPAL SANTA FELICIDADE,5205513,COCALZINHO DE GOIAS,GO,Centro-Oeste,1,3,0.0,0.0,0.0,Em atividade,Municipal
2013,52013430,COLEGIO ESTADUAL JOAQUIM TOMAZ FERREIRA DA SILVA,5205521,COLINAS DO SUL,GO,Centro-Oeste,1,2,5.0,5.199999809265137,442.093994140625,Em atividade,Estadual
2013,52013413,COLEGIO MUNICIPAL MARIA AUXILIADORA,5205521,COLINAS DO SUL,GO,Centro-Oeste,1,3,6.400000095367432,4.099999904632568,0.0,Em atividade,Municipal
2013,52082490,ESC MUL ISOLADA VILA BORBA,5205521,COLINAS DO SUL,GO,Centro-Oeste,1,3,0.0,0.0,0.0,Em atividade,Municipal
2013,52013421,ESCOLA ESTADUAL ANTONIO RODRIGUES DOS SANTOS,5205521,COLINAS DO SUL,GO,Centro-Oeste,1,2,0.0,0.0,0.0,Em atividade,Estadual
2013,52026701,COLEGIO ESTADUAL BRASIL,5205703,CORREGO DO OURO,GO,Centro-Oeste,1,2,0.0,5.900000095367432,0.0,Em atividade,Estadual
2013,52026744,ESC MUL DE CARMOLANDIA,5205703,CORREGO DO OURO,GO,Centro-Oeste,1,3,0.0,0.0,0.0,Em atividade,Municipal
2013,52026728,ESCOLA MUNICIPAL ANA MORATO,5205703,CORREGO DO OURO,GO,Centro-Oeste,1,3,6.699999809265137,0.0,0.0,Em atividade,Municipal
2013,52077675,ESCOLA MUNICIPAL CASA DA CRIANCA ALEGRE,5205703,CORREGO DO OURO,GO,Centro-Oeste,1,3,0.0,0.0,0.0,Em atividade,Municipal
2013,52045080,COLEGIO ESTADUAL ANDRE GAUDIE,5205802,CORUMBA DE GOIAS,GO,Centro-Oeste,1,2,0.0,5.099999904632568,480.7919921875,Em atividade,Estadual
2013,52045161,ESC MUL APARECIDA DE LOYOLA,5205802,CORUMBA DE GOIAS,GO,Centro-Oeste,1,3,0.0,0.0,0.0,Em atividade,Municipal
2013,52045102,ESC MUL BENEDITO DE FONTES LEAL,5205802,CORUMBA DE GOIAS,GO,Centro-Oeste,1,3,5.800000190734863,0.0,0.0,Em atividade,Municipal
2013,52045188,ESC MUL BENIGNO GOMES TELLES,5205802,CORUMBA DE GOIAS,GO,Centro-Oeste,1,3,0.0,0.0,0.0,Em atividade,Municipal
2013,52094472,ESC MUL BERNARDO ELIS,5205802,CORUMBA DE GOIAS,GO,Centro-Oeste,1,3,6.599999904632568,0.0,0.0,Em atividade,Municipal
2013,52045536,ESC MUL NOSSA SENHORA DA GUIA,5205802,CORUMBA DE GOIAS,GO,Centro-Oeste,1,3,0.0,0.0,0.0,Em atividade,Municipal
2013,52045307,ESC MUL NOSSA SENHORA DE PENHA,5205802,CORUMBA DE GOIAS,GO,Centro-Oeste,1,3,0.0,0.0,0.0,Em atividade,Municipal
2013,52045501,ESC MUL PERCILIO PEREIRA DE SIQUEIRA,5205802,CORUMBA DE GOIAS,GO,Centro-Oeste,1,3,0.0,0.0,0.0,Em atividade,Municipal
2013,52045358,ESC MUL RITA BICUDO DA ROCHA,5205802,CORUMBA DE GOIAS,GO,Centro-Oeste,1,3,0.0,0.0,0.0,Em atividade,Municipal
2013,52045510,ESC MUL SANTA RITA DE CASSIA,5205802,CORUMBA DE GOIAS,GO,Centro-Oeste,1,3,0.0,0.0,0.0,Em atividade,Municipal
2013,52045110,ESCOLA ESTADUAL JOAO MENDES,5205802,CORUMBA DE GOIAS,GO,Centro-Oeste,1,2,0.0,4.900000095367432,0.0,Em atividade,Estadual
2013,52045480,ESCOLA MUNICIPAL FELICIANA DE SOUZA LEITE,5205802,CORUMBA DE GOIAS,GO,Centro-Oeste,1,3,4.199999809265137,0.0,0.0,Em atividade,Municipal
2013,52045528,ESCOLA PAROQUIAL NOSSA SENHORA DA PENHA,5205802,CORUMBA DE GOIAS,GO,Centro-Oeste,1,4,0.0,0.0,0.0,Em atividade,Privada
2013,52065464,COLEGIO ESTADUAL SIMON BOLIVAR,5205901,CORUMBAIBA,GO,Centro-Oeste,1,2,0.0,5.0,471.0799865722656,Em atividade,Estadual
2013,52065510,COLEGIO MUNICIPAL SANTA TEREZINHA,5205901,CORUMBAIBA,GO,Centro-Oeste,1,3,0.0,0.0,0.0,Em atividade,Municipal
2013,52065499,ESC MUL COUTO DE MAGALHAES,5205901,CORUMBAIBA,GO,Centro-Oeste,1,3,7.099999904632568,0.0,0.0,Em atividade,Municipal
2013,52065570,ESC MUL PROF ALBERTO DE MORAIS HOLANDA,5205901,CORUMBAIBA,GO,Centro-Oeste,1,3,0.0,0.0,0.0,Em atividade,Municipal
2013,52069010,ESC MUL REABILITACAO HILDA B QUINTA,5205901,CORUMBAIBA,GO,Centro-Oeste,1,3,0.0,0.0,0.0,Em atividade,Municipal
2013,52069001,ESC MUN GEANE MARCIA DOS SANTOS LOURENCO,5205901,CORUMBAIBA,GO,Centro-Oeste,1,3,0.0,0.0,0.0,Em atividade,Municipal
2013,52065472,ESC MUNICIPAL ASCENDINO CELESTINO DA SILVA,5205901,CORUMBAIBA,GO,Centro-Oeste,1,3,6.800000190734863,0.0,0.0,Em atividade,Municipal
2013,52065502,ESCOLA ESTADUAL OSORIO MARTINS CARDOSO,5205901,CORUMBAIBA,GO,Centro-Oeste,1,2,0.0,4.599999904632568,0.0,Em atividade,Estadual
2013,52068951,ESCOLA MUNICIPAL COMECINHO DE VIDA,5205901,CORUMBAIBA,GO,Centro-Oeste,1,3,0.0,0.0,0.0,Em atividade,Municipal
2013,52188477,ESCOLA MUNICIPAL PEDRO COELHO RIBEIRO,5205901,CORUMBAIBA,GO,Centro-Oeste,1,3,0.0,0.0,0.0,Em atividade,Municipal
2013,52085996,AME-ASSOCIACAO MAE DA ESPERANCA,5206206,CRISTALINA,GO,Centro-Oeste,1,4,0.0,0.0,0.0,Em atividade,Privada
2013,52046133,ASSOCIACAO SAO VICENTE DE PAULO,5206206,CRISTALINA,GO,Centro-Oeste,1,4,0.0,0.0,0.0,Em atividade,Privada
2013,52078833,CENTRO BATISTA DE ASSISTENCIA SOCIO-CULTURAL DE CRISTALINA,5206206,CRISTALINA,GO,Centro-Oeste,1,4,0.0,0.0,0.0,Em atividade,Privada
2013,52097960,CENTRO DE EDUCACAO INFANTIL CIRANDINHA,5206206,CRISTALINA,GO,Centro-Oeste,1,4,0.0,0.0,0.0,Em atividade,Privada
2013,52097951,CENTRO DE EDUCACAO INFANTIL DIVINO ESPIRITO SANTO,5206206,CRISTALINA,GO,Centro-Oeste,1,4,0.0,0.0,0.0,Em atividade,Privada
2013,52097986,CENTRO DE EDUCACAO INFANTIL EDUCANDARIO ESPIRITA ANALIA FRANCO,5206206,CRISTALINA,GO,Centro-Oeste,1,4,0.0,0.0,0.0,Em atividade,Privada
2013,52097978,CENTRO DE EDUCACAO INFANTIL LUISA POVOLO,5206206,CRISTALINA,GO,Centro-Oeste,1,4,0.0,0.0,0.0,Em atividade,Privada
2013,52097994,CENTRO DE EDUCACAO INFANTIL SAO SEBASTIAO,5206206,CRISTALINA,GO,Centro-Oeste,1,4,0.0,0.0,0.0,Em atividade,Privada
2013,52073564,CENTRO EDUCACIONAL LAPIS NA MAO,5206206,CRISTALINA,GO,Centro-Oeste,1,4,0.0,0.0,0.0,Em atividade,Privada
2013,52095606,CENTRO MUNICIPAL DE EDUCACAO INFANTIL DONA AMELIA,5206206,CRISTALINA,GO,Centro-Oeste,1,3,0.0,0.0,0.0,Em atividade,Municipal
2013,52112608,CENTRO MUNICIPAL DE EDUCACAO SANTA LUZIA,5206206,CRISTALINA,GO,Centro-Oeste,1,3,0.0,0.0,0.0,Em atividade,Municipal
2013,52045617,COLEGIO ESTADUAL ADELVINA FLORES RIBEIRO,5206206,CRISTALINA,GO,Centro-Oeste,1,2,0.0,4.400000095367432,0.0,Em atividade,Estadual
2013,52092143,COLEGIO ESTADUAL CAMPOS LINDOS,5206206,CRISTALINA,GO,Centro-Oeste,1,2,0.0,0.0,0.0,Em atividade,Estadual
2013,52045633,COLEGIO ESTADUAL CASTELO BRANCO,5206206,CRISTALINA,GO,Centro-Oeste,1,2,0.0,0.0,0.0,Em atividade,Estadual
2013,52045641,COLEGIO ESTADUAL JOSE DE GOIAS BRASIL,5206206,CRISTALINA,GO,Centro-Oeste,1,2,0.0,4.0,0.0,Em atividade,Estadual
2013,52045595,COLEGIO ESTADUAL OLGA AGUIAR MOHN,5206206,CRISTALINA,GO,Centro-Oeste,1,2,0.0,4.400000095367432,0.0,Em atividade,Estadual
2013,52082202,COLEGIO ESTADUAL ZULCA PEIXOTO DE PAIVA,5206206,CRISTALINA,GO,Centro-Oeste,1,2,0.0,0.0,512.3460083007812,Em atividade,Estadual
2013,52262367,COLEGIO JEAN PIAGET,5206206,CRISTALINA,GO,Centro-Oeste,1,4,0.0,0.0,501.82000732421875,Em atividade,Privada
2013,52045579,COLEGIO MARIA MONTESSORI,5206206,CRISTALINA,GO,Centro-Oeste,1,4,0.0,0.0,553.885986328125,Em atividade,Privada
2013,52097552,COLEGIO MAXIMUS,5206206,CRISTALINA,GO,Centro-Oeste,1,4,0.0,0.0,0.0,Em atividade,Privada
2013,52093697,CRECHE COMUNITARIA HIPOLITA TERESA ERANCI,5206206,CRISTALINA,GO,Centro-Oeste,1,4,0.0,0.0,0.0,Em atividade,Privada
2013,52045668,ESC MUL ADALARDO TIRADENTES BISPO,5206206,CRISTALINA,GO,Centro-Oeste,1,3,4.699999809265137,4.5,0.0,Em atividade,Municipal
2013,52045714,ESC MUL ARGEU PAIM HOFFMANN,5206206,CRISTALINA,GO,Centro-Oeste,1,3,4.800000190734863,4.400000095367432,0.0,Em atividade,Municipal
2013,52045722,ESC MUL CILINEU PEIXOTO DOS SANTOS,5206206,CRISTALINA,GO,Centro-Oeste,1,3,4.300000190734863,0.0,0.0,Em atividade,Municipal
2013,52045803,ESC MUL ITAGIBA JOSE DE SOUZA,5206206,CRISTALINA,GO,Centro-Oeste,1,3,0.0,0.0,0.0,Em atividade,Municipal
2013,52045838,ESC MUL JOSE MIGUEL CURY,5206206,CRISTALINA,GO,Centro-Oeste,1,3,5.099999904632568,4.199999809265137,0.0,Em atividade,Municipal
2013,52045897,ESC MUL MANOEL GONCALVES,5206206,CRISTALINA,GO,Centro-Oeste,1,3,4.800000190734863,0.0,0.0,Em atividade,Municipal
2013,52045790,ESC MUL PAULO GONTIJO,5206206,CRISTALINA,GO,Centro-Oeste,1,3,0.0,0.0,0.0,Em atividade,Municipal
2013,52045650,ESC MUL PRESIDENTE KENNEDY,5206206,CRISTALINA,GO,Centro-Oeste,1,3,4.199999809265137,0.0,0.0,Em atividade,Municipal
2013,52073521,ESC MUL VALDETE DOS SANTOS ABADIA,5206206,CRISTALINA,GO,Centro-Oeste,1,3,4.599999904632568,4.400000095367432,0.0,Em atividade,Municipal
2013,52045587,ESCOLA COMERCIAL MUNICIPAL LEAO RODRIGUES DE AFONSECA,5206206,CRISTALINA,GO,Centro-Oeste,1,3,6.099999904632568,5.300000190734863,0.0,Em atividade,Municipal
2013,52076873,ESCOLA ESPECIAL DR JOAO BOSCO RENNO SALOMON,5206206,CRISTALINA,GO,Centro-Oeste,1,4,0.0,0.0,0.0,Em atividade,Privada
2013,52045692,ESCOLA MUNICIPAL ALEIXO TORRES CAMARGO,5206206,CRISTALINA,GO,Centro-Oeste,1,3,0.0,0.0,0.0,Em atividade,Municipal
2013,52045773,ESCOLA MUNICIPAL EDUARDO DE PAIVA REZENDE,5206206,CRISTALINA,GO,Centro-Oeste,1,3,4.300000190734863,3.9000000953674316,0.0,Em atividade,Municipal
2013,52045820,ESCOLA MUNICIPAL JOSE GOMES GONCALVES,5206206,CRISTALINA,GO,Centro-Oeste,1,3,4.099999904632568,3.9000000953674316,0.0,Em atividade,Municipal
2013,52046087,ESCOLA MUNICIPAL JOSE RODRIGUES DE QUEIROZ,5206206,CRISTALINA,GO,Centro-Oeste,1,3,0.0,0.0,0.0,Em atividade,Municipal
2013,52093689,ESCOLA MUNICIPAL PAROQUIAL SAO JOSE,5206206,CRISTALINA,GO,Centro-Oeste,1,3,4.900000095367432,0.0,0.0,Em atividade,Municipal
2013,52094383,ESCOLA MUNICIPAL PAROQUIAL SAO VICENTE DE PAULO,5206206,CRISTALINA,GO,Centro-Oeste,1,3,5.099999904632568,4.800000190734863,0.0,Em atividade,Municipal
2013,52098800,ESCOLA MUNICIPAL PROFESSORA SUMAIA SALLES COZAC,5206206,CRISTALINA,GO,Centro-Oeste,1,3,4.400000095367432,4.199999809265137,0.0,Em atividade,Municipal
2013,52046028,ESCOLA MUNICIPAL SOUZA LIMA,5206206,CRISTALINA,GO,Centro-Oeste,1,3,3.299999952316284,3.5,0.0,Em atividade,Municipal
2013,52061736,COLEGIO ESTADUAL JOSE PEREIRA FAUSTINO,5206305,CRISTIANOPOLIS,GO,Centro-Oeste,1,2,0.0,0.0,450.1440124511719,Em atividade,Estadual
2013,52061787,CRECHE MUNICIPAL VALERIA JAIME PEIXOTO PERILLO,5206305,CRISTIANOPOLIS,GO,Centro-Oeste,1,3,0.0,0.0,0.0,Em atividade,Municipal
2013,52061752,ESCOLA MUNICIPAL SERGIO CEZAR MACHADO,5206305,CRISTIANOPOLIS,GO,Centro-Oeste,1,3,5.0,4.300000190734863,0.0,Em atividade,Municipal
2013,52079627,CENTRO DE ENSINO ESPECIAL WASHINGTON NEVES SOUZA,5206404,CRIXAS,GO,Centro-Oeste,1,4,0.0,0.0,0.0,Em atividade,Privada
2013,52070751,COLEGIO COC,5206404,CRIXAS,GO,Centro-Oeste,1,4,0.0,0.0,561.4580078125,Em atividade,Privada
2013,52000028,COLEGIO ESTADUAL JOAO XAVIER FERREIRA,5206404,CRIXAS,GO,Centro-Oeste,1,2,0.0,5.199999809265137,0.0,Em atividade,Estadual
2013,52000079,COLEGIO ESTADUAL JURANDIR CARDOSO DIAS,5206404,CRIXAS,GO,Centro-Oeste,1,2,0.0,0.0,0.0,Em atividade,Estadual
2013,52000087,COLEGIO ESTADUAL MANOEL LINO DE CARVALHO,5206404,CRIXAS,GO,Centro-Oeste,1,2,0.0,4.900000095367432,0.0,Em atividade,Estadual
2013,52000095,COLEGIO ESTADUAL PRUDENCIO FERREIRA,5206404,CRIXAS,GO,Centro-Oeste,1,2,0.0,3.700000047683716,0.0,Em atividade,Estadual
2013,52079600,COOP EDUC PAIS E PROF DE CRIXAS COLEGIO CORA CORALINA,5206404,CRIXAS,GO,Centro-Oeste,1,4,0.0,0.0,0.0,Em atividade,Privada
2013,52079619,CRECHE MUL ARCO IRIS,5206404,CRIXAS,GO,Centro-Oeste,1,3,0.0,0.0,0.0,Em atividade,Municipal
2013,52081605,ESC MUL ADALBERTA FRANCISCA DOS SANTOS,5206404,CRIXAS,GO,Centro-Oeste,1,3,4.800000190734863,0.0,0.0,Em atividade,Municipal
2013,52074080,ESC MUL AURITA PEREIRA DA SILVA,5206404,CRIXAS,GO,Centro-Oeste,1,3,5.900000095367432,0.0,0.0,Em atividade,Municipal
2013,52000206,ESC MUL IZABEL MIRANDA,5206404,CRIXAS,GO,Centro-Oeste,1,3,5.400000095367432,0.0,0.0,Em atividade,Municipal
2013,52000214,ESC MUL JOAQUIM DE SOUZA VILAS BOAS,5206404,CRIXAS,GO,Centro-Oeste,1,3,5.699999809265137,0.0,0.0,Em atividade,Municipal
2013,52000613,ESC MUL RURAL CANA BRAVA,5206404,CRIXAS,GO,Centro-Oeste,1,3,0.0,0.0,0.0,Em atividade,Municipal
2013,52000281,ESC MUL RURAL SEBASTIAO MACHADO DE AZEVEDO,5206404,CRIXAS,GO,Centro-Oeste,1,3,0.0,0.0,0.0,Em atividade,Municipal
2013,52079635,ESC MUL SEBASTIAO RODRIGUES DE BRITO,5206404,CRIXAS,GO,Centro-Oeste,1,3,4.699999809265137,0.0,0.0,Em atividade,Municipal
2013,52000486,ESC MUL UNIT RURAL ARLINDO DO C RIBEIRO,5206404,CRIXAS,GO,Centro-Oeste,1,3,0.0,0.0,0.0,Em atividade,Municipal
2013,52096718,ESCOLA MUNICIPAL DE EDUCACAO EM TEMPO INTEGRAL URSULINO TAVARES LEAO,5206404,CRIXAS,GO,Centro-Oeste,1,3,0.0,0.0,0.0,Em atividade,Municipal
2013,52093867,ESCOLA MUNICIPAL HORIZONTE NOVO,5206404,CRIXAS,GO,Centro-Oeste,1,3,5.199999809265137,0.0,0.0,Em atividade,Municipal
2013,52143201,ESCOLA MUNICIPAL PROFESSORA JOANA PAULA PARREIRA ALVES,5206404,CRIXAS,GO,Centro-Oeste,1,3,0.0,0.0,0.0,Em atividade,Municipal
2013,52058778,COLEGIO ESTADUAL PROFESSOR ANTONIO MESTRE,5206503,CROMINIA,GO,Centro-Oeste,1,2,6.699999809265137,5.400000095367432,0.0,Em atividade,Estadual
2013,52082784,CRECHE MUNICIPAL DONA HELENA,5206503,CROMINIA,GO,Centro-Oeste,1,3,0.0,0.0,0.0,Em atividade,Municipal
2013,52058794,ESCOLA ESTADUAL PROFESSORA EMERENCIANA E A DOS SANTOS,5206503,CROMINIA,GO,Centro-Oeste,1,2,0.0,0.0,0.0,Em atividade,Estadual
2013,52058786,ESCOLA MUNICIPAL BENEDITO PEREIRA DE MENEZES,5206503,CROMINIA,GO,Centro-Oeste,1,3,0.0,0.0,0.0,Em atividade,Municipal
2013,52082768,ESCOLA MUNICIPAL DE CROMINIA,5206503,CROMINIA,GO,Centro-Oeste,1,3,0.0,0.0,0.0,Em atividade,Municipal
2013,52065618,COLEGIO ESTADUAL CASTRO ALVES,5206602,CUMARI,GO,Centro-Oeste,1,2,6.800000190734863,0.0,0.0,Em atividade,Estadual
2013,52065600,COLEGIO ESTADUAL GETULIO EVANGELISTA DA ROCHA,5206602,CUMARI,GO,Centro-Oeste,1,2,0.0,5.400000095367432,0.0,Em atividade,Estadual
2013,52065707,CRECHE ESCOLA CORACAO DE MARIA,5206602,CUMARI,GO,Centro-Oeste,1,3,0.0,0.0,0.0,Em atividade,Municipal
2013,52076806,ESCOLA MUNICIPAL GOTINHAS DO SABER,5206602,CUMARI,GO,Centro-Oeste,1,3,0.0,0.0,0.0,Em atividade,Municipal
2013,52040577,COLEGIO ESTADUAL JULIO MOREIRA DE MOURA,5206701,DAMIANOPOLIS,GO,Centro-Oeste,1,2,0.0,0.0,449.70001220703125,Em atividade,Estadual
2013,52040607,ESCOLA ESTADUAL MANOEL LELIS,5206701,DAMIANOPOLIS,GO,Centro-Oeste,1,2,0.0,5.0,0.0,Em atividade,Estadual
2013,52086291,ESCOLA MUNICIPAL FABRICA DE SONHOS,5206701,DAMIANOPOLIS,GO,Centro-Oeste,1,3,0.0,0.0,0.0,Em atividade,Municipal
2013,52040585,ESCOLA MUNICIPAL TANCREDO NEVES,5206701,DAMIANOPOLIS,GO,Centro-Oeste,1,3,4.199999809265137,0.0,0.0,Em atividade,Municipal
2013,52022471,COLEGIO ESTADUAL DOM EMANUEL,5206800,DAMOLANDIA,GO,Centro-Oeste,1,2,0.0,5.099999904632568,0.0,Em atividade,Estadual
2013,52088316,ESCOLA MUNICIPAL PROFESSORA MARIA EUGENIA PESSOA BORGES,5206800,DAMOLANDIA,GO,Centro-Oeste,1,3,5.900000095367432,0.0,0.0,Em atividade,Municipal
2013,52065715,COLEGIO ESTADUAL JOAO BERNARDES DE ASSUNCAO,5206909,DAVINOPOLIS,GO,Centro-Oeste,1,2,0.0,0.0,454.9580078125,Em atividade,Estadual
2013,52078230,ESC CRECHE MUL C E ALESSANDRA D G,5206909,DAVINOPOLIS,GO,Centro-Oeste,1,3,0.0,0.0,0.0,Em atividade,Municipal
2013,52070190,ESCOLA MUNICIPAL BALBINO ANTONIO FERREIRA,5206909,DAVINOPOLIS,GO,Centro-Oeste,1,3,6.0,0.0,0.0,Em atividade,Municipal
2013,52005321,COLEGIO ESTADUAL DONA EVA,5207105,DIORAMA,GO,Centro-Oeste,1,2,0.0,4.900000095367432,448.3380126953125,Em atividade,Estadual
2013,52005330,ESCOLA ESTADUAL ANTONIO MENDES,5207105,DIORAMA,GO,Centro-Oeste,1,2,5.599999904632568,0.0,0.0,Em atividade,Estadual
2013,52005372,ESCOLA MUNICIPAL GUANABARA,5207105,DIORAMA,GO,Centro-Oeste,1,3,0.0,0.0,0.0,Em atividade,Municipal
2013,52005488,PRE ESCOLAR GERALDO GERMANO DA SILVA,5207105,DIORAMA,GO,Centro-Oeste,1,3,0.0,0.0,0.0,Em atividade,Municipal
2013,52052354,COLEGIO ESTADUAL DR PEDRO LUDOVICO TEIXEIRA,5207253,DOVERLANDIA,GO,Centro-Oeste,1,2,6.400000095367432,5.599999904632568,0.0,Em atividade,Estadual
2013,52052346,COLEGIO ESTADUAL JUSCELINO K OLIVEIRA,5207253,DOVERLANDIA,GO,Centro-Oeste,1,2,6.5,4.699999809265137,475.8760070800781,Em atividade,Estadual
2013,52095720,CRECHE MUNICIPAL CRIANCA ESPERANCA,5207253,DOVERLANDIA,GO,Centro-Oeste,1,3,0.0,0.0,0.0,Em atividade,Municipal
2013,52052400,ESC MUL DONA ERNESTINA AUGUSTA DE LIMA,5207253,DOVERLANDIA,GO,Centro-Oeste,1,3,5.5,0.0,0.0,Em atividade,Municipal
2013,52052419,ESC MUL MANOEL RIBEIRO CAMPOS,5207253,DOVERLANDIA,GO,Centro-Oeste,1,3,5.599999904632568,0.0,0.0,Em atividade,Municipal
2013,52052362,ESC MUL RURAL ALEGRIA DO SABER,5207253,DOVERLANDIA,GO,Centro-Oeste,1,3,0.0,0.0,0.0,Em atividade,Municipal
2013,52052516,ESC MUL RURAL SONHO MEU,5207253,DOVERLANDIA,GO,Centro-Oeste,1,3,0.0,0.0,0.0,Em atividade,Municipal
2013,52070263,ESCOLA MUNICIPAL MARIA GUILHERMINA DE JESUS,5207253,DOVERLANDIA,GO,Centro-Oeste,1,3,0.0,0.0,0.0,Em atividade,Municipal
2013,52200361,NUCLEO EDUCACIONAL INTERATIVO,5207253,DOVERLANDIA,GO,Centro-Oeste,1,4,0.0,0.0,0.0,Em atividade,Privada
2013,52083080,NUCLEO MUL EDUC INF VERGILIO PRIMO SILVA,5207253,DOVERLANDIA,GO,Centro-Oeste,1,3,0.0,0.0,0.0,Em atividade,Municipal
2013,52056260,COLEGIO ESTADUAL OLIMPIO SILVA,5207352,EDEALINA,GO,Centro-Oeste,1,2,0.0,0.0,466.9639892578125,Em atividade,Estadual
2013,52173208,CRECHE MUNICIPAL WARLEY JUNIO DE OLIVEIRA,5207352,EDEALINA,GO,Centro-Oeste,1,3,0.0,0.0,0.0,Em atividade,Municipal
2013,52056309,ESC MUL PEDRO JOSE LEANDRO,5207352,EDEALINA,GO,Centro-Oeste,1,3,5.5,3.9000000953674316,0.0,Em atividade,Municipal
2013,52082199,ESCOLA MUNICIPAL 15 DE ABRIL,5207352,EDEALINA,GO,Centro-Oeste,1,3,0.0,0.0,0.0,Em atividade,Municipal
2013,52081630,ASSOCIACAO PAIS AMIGOS DOS EXCEPCIONAIS EDEIA,5207402,EDEIA,GO,Centro-Oeste,1,3,0.0,0.0,0.0,Em atividade,Municipal
2013,52056333,COLEGIO ESTADUAL DE EDEIA,5207402,EDEIA,GO,Centro-Oeste,1,2,0.0,0.0,0.0,Em atividade,Estadual
2013,52056341,COOPERATIVA EDUCACIONAL DE EDEIA,5207402,EDEIA,GO,Centro-Oeste,1,4,0.0,0.0,552.1259765625,Em atividade,Privada
2013,52098605,CRECHE MUNICIPAL CAIRO TASSARA,5207402,EDEIA,GO,Centro-Oeste,1,3,0.0,0.0,0.0,Em atividade,Municipal
2013,52056368,ESCOLA ESTADUAL JOSE DE FARIA,5207402,EDEIA,GO,Centro-Oeste,1,2,0.0,5.0,0.0,Em atividade,Estadual
2013,52056384,ESCOLA MUNICIPAL ALZIRA DE OLIVEIRA ALVES,5207402,EDEIA,GO,Centro-Oeste,1,3,6.300000190734863,0.0,0.0,Em atividade,Municipal
2013,52056350,ESCOLA MUNICIPAL JOAQUIM TEODORO RODRIGUES,5207402,EDEIA,GO,Centro-Oeste,1,3,6.5,0.0,0.0,Em atividade,Municipal
2013,52075303,ESCOLA MUNICIPAL JOSE ESTEVES RODRIGUES,5207402,EDEIA,GO,Centro-Oeste,1,3,5.5,4.5,0.0,Em atividade,Municipal
2013,52056457,ESCOLA MUNICIPAL TIBURCIO BUENO DE AZEREDO,5207402,EDEIA,GO,Centro-Oeste,1,3,5.5,0.0,0.0,Em atividade,Municipal
2013,52006751,COLEGIO ESTADUAL MINISTRO PETRONIO PORTELLA,5207501,ESTRELA DO NORTE,GO,Centro-Oeste,1,2,0.0,0.0,459.6820068359375,Em atividade,Estadual
2013,52006760,COLEGIO ESTADUAL VALDOMIRO LOPES REZENDE,5207501,ESTRELA DO NORTE,GO,Centro-Oeste,1,2,0.0,5.099999904632568,0.0,Em atividade,Estadual
2013,52068560,ESC MUL DE NUT INFANTIL DONA JOVELINA C DE MATTOS,5207501,ESTRELA DO NORTE,GO,Centro-Oeste,1,3,0.0,0.0,0.0,Em atividade,Municipal
2013,52006786,ESCOLA MUNICIPAL CARLOS OLIVEIRA DA SILVA,5207501,ESTRELA DO NORTE,GO,Centro-Oeste,1,3,6.099999904632568,4.800000190734863,0.0,Em atividade,Municipal
2013,52006808,ESCOLA MUNICIPAL JOSE COSTA LIMA,5207501,ESTRELA DO NORTE,GO,Centro-Oeste,1,3,5.0,0.0,0.0,Em atividade,Municipal
2013,52002080,COLEGIO ESTADUAL LINDOLFO MENDES DA CUNHA,5207535,FAINA,GO,Centro-Oeste,1,2,5.400000095367432,4.599999904632568,0.0,Em atividade,Estadual
2013,52002578,COLEGIO ESTADUAL MAJOR JOAO LEITE ORTIZ DE CAMARGO,5207535,FAINA,GO,Centro-Oeste,1,2,0.0,0.0,0.0,Em atividade,Estadual
2013,52088332,CRECHE MUL DONA MARIA CARDOSA,5207535,FAINA,GO,Centro-Oeste,1,3,0.0,0.0,0.0,Em atividade,Municipal
2013,52072673,ESC MUL ALBION DE BARROS,5207535,FAINA,GO,Centro-Oeste,1,3,0.0,0.0,0.0,Em atividade,Municipal
2013,52002241,ESC MUL BRUNO FREIRE DE ANDRADE,5207535,FAINA,GO,Centro-Oeste,1,3,0.0,0.0,0.0,Em atividade,Municipal
2013,52002217,ESC MUL CORREGO GRANDE,5207535,FAINA,GO,Centro-Oeste,1,3,0.0,0.0,0.0,Em atividade,Municipal
2013,52002110,ESC MUL FRANCISCO ELIEZER CURADO,5207535,FAINA,GO,Centro-Oeste,1,3,0.0,0.0,0.0,Em atividade,Municipal
2013,52088324,ESC MUL JOSE PEREIRA BORGES,5207535,FAINA,GO,Centro-Oeste,1,3,0.0,0.0,0.0,Em atividade,Municipal
2013,52002446,ESC MUL SANTA RITA,5207535,FAINA,GO,Centro-Oeste,1,3,0.0,0.0,0.0,Em atividade,Municipal
2013,52002497,ESC MUL VISTA BELA,5207535,FAINA,GO,Centro-Oeste,1,3,0.0,0.0,0.0,Em atividade,Municipal
2013,52002098,ESCOLA ESTADUAL DARIO DE PAIVA SAMPAIO,5207535,FAINA,GO,Centro-Oeste,1,2,0.0,4.300000190734863,0.0,Em atividade,Estadual
2013,52002403,ESCOLA MUNICIPAL JOAO FERREIRA AVELAR,5207535,FAINA,GO,Centro-Oeste,1,3,0.0,0.0,0.0,Em atividade,Municipal
2013,52095096,CENTRO EDUCACIONAL SIGMA,5207600,FAZENDA NOVA,GO,Centro-Oeste,1,4,0.0,0.0,0.0,Em atividade,Privada
2013,52027040,COLEGIO ESTADUAL BACILANDIA,5207600,FAZENDA NOVA,GO,Centro-Oeste,1,2,0.0,0.0,449.00799560546875,Em atividade,Estadual
2013,52026809,COLEGIO ESTADUAL PEDRO LUDOVICO TEIXEIRA,5207600,FAZENDA NOVA,GO,Centro-Oeste,1,2,0.0,0.0,475.760009765625,Em atividade,Estadual
2013,52026817,COLEGIO ESTADUAL TIRADENTES,5207600,FAZENDA NOVA,GO,Centro-Oeste,1,2,0.0,4.900000095367432,0.0,Em atividade,Estadual
2013,52076202,ESC MUL IBERE CORREIA,5207600,FAZENDA NOVA,GO,Centro-Oeste,1,3,0.0,0.0,0.0,Em atividade,Municipal
2013,52026990,ESC MUL RUI BARBOSA,5207600,FAZENDA NOVA,GO,Centro-Oeste,1,3,0.0,0.0,0.0,Em atividade,Municipal
2013,52026850,ESC MUL SERRA DOURADA,5207600,FAZENDA NOVA,GO,Centro-Oeste,1,3,0.0,0.0,0.0,Em atividade,Municipal
2013,52026841,ESCOLA ESTADUAL PROFESSOR ALFREDO NASSER,5207600,FAZENDA NOVA,GO,Centro-Oeste,1,2,6.300000190734863,5.599999904632568,0.0,Em atividade,Estadual
2013,52084850,ESCOLA MUL PEDACINHO DA GENTE,5207600,FAZENDA NOVA,GO,Centro-Oeste,1,3,0.0,0.0,0.0,Em atividade,Municipal
2013,52226352,ESCOLA MUNICIPAL ISMAEL MARTINS SOBRINHO,5207600,FAZENDA NOVA,GO,Centro-Oeste,1,3,0.0,0.0,0.0,Em atividade,Municipal
2013,52029212,CENTRO DE EDUCACAO E CONVIVENCIA JUVENIL CASTELO BRANCO,5207808,FIRMINOPOLIS,GO,Centro-Oeste,1,2,0.0,0.0,0.0,Em atividade,Estadual
2013,52072738,CENTRO DE ENSINO E CULT ISU I LTDA,5207808,FIRMINOPOLIS,GO,Centro-Oeste,1,4,0.0,0.0,0.0,Em atividade,Privada
2013,52029182,COLEGIO ESTADUAL AMERICO GONCALVES FALEIRO,5207808,FIRMINOPOLIS,GO,Centro-Oeste,1,2,0.0,5.300000190734863,0.0,Em atividade,Estadual
2013,52029239,COLEGIO ESTADUAL JUSCELINO KUBITSCHEK,5207808,FIRMINOPOLIS,GO,Centro-Oeste,1,2,0.0,4.400000095367432,0.0,Em atividade,Estadual
2013,52091910,CRECHE MUNICIPAL CRIANCA FELIZ DE FIRMINOPOLIS,5207808,FIRMINOPOLIS,GO,Centro-Oeste,1,3,0.0,0.0,0.0,Em atividade,Municipal
2013,52029298,ESC MUN PROFª CELIA RICARDO DOMINGUES DE ARAUJO,5207808,FIRMINOPOLIS,GO,Centro-Oeste,1,3,6.699999809265137,0.0,0.0,Em atividade,Municipal
2013,52029220,ESCOLA ESTADUAL JOSE MANOEL DA SILVA,5207808,FIRMINOPOLIS,GO,Centro-Oeste,1,2,0.0,0.0,0.0,Em atividade,Estadual
2013,52257410,ESCOLA MUNICIPAL PROFESSOR ANTONIO VIEIRA HUNGRIA,5207808,FIRMINOPOLIS,GO,Centro-Oeste,1,3,6.300000190734863,0.0,0.0,Em atividade,Municipal
2013,52097366,ESCOLA MUNICIPAL PROFESSORA MARIA DE FATIMA PEREIRA,5207808,FIRMINOPOLIS,GO,Centro-Oeste,1,3,6.199999809265137,0.0,0.0,Em atividade,Municipal
2013,52091406,CENTRO MUNICIPAL DE EDUCACAO INFANTIL RAIMUNDA ROSA,5207907,FLORES DE GOIAS,GO,Centro-Oeste,1,3,0.0,0.0,0.0,Em atividade,Municipal
2013,52040771,COLEGIO ESTADUAL JULIO CESAR TEODORO,5207907,FLORES DE GOIAS,GO,Centro-Oeste,1,2,0.0,0.0,0.0,Em atividade,Estadual
2013,52040780,COLEGIO ESTADUAL MARECHAL HUMBERTO DE ALENCAR CASTELO BRANCO,5207907,FLORES DE GOIAS,GO,Centro-Oeste,1,2,0.0,4.599999904632568,0.0,Em atividade,Estadual
2013,52040828,ESC MUL BREJINHO,5207907,FLORES DE GOIAS,GO,Centro-Oeste,1,3,0.0,0.0,0.0,Em atividade,Municipal
2013,52041000,ESC MUL CANABRAVA,5207907,FLORES DE GOIAS,GO,Centro-Oeste,1,3,0.0,0.0,0.0,Em atividade,Municipal
2013,52089037,ESC MUL DEUSDEZINO DE SOUZA FERREIRA,5207907,FLORES DE GOIAS,GO,Centro-Oeste,1,3,3.5,3.9000000953674316,0.0,Em atividade,Municipal
2013,52073394,ESC MUL MONTEIRO LOBATO,5207907,FLORES DE GOIAS,GO,Centro-Oeste,1,3,4.900000095367432,0.0,0.0,Em atividade,Municipal
2013,52040860,ESC MUL MORRO,5207907,FLORES DE GOIAS,GO,Centro-Oeste,1,3,0.0,0.0,0.0,Em atividade,Municipal
2013,52040909,ESC MUL PROFA MARIA JOSE,5207907,FLORES DE GOIAS,GO,Centro-Oeste,1,3,0.0,0.0,0.0,Em atividade,Municipal
2013,52089010,ESC MUL ROSARIO DE SOUZA FERREIRA,5207907,FLORES DE GOIAS,GO,Centro-Oeste,1,3,0.0,0.0,0.0,Em atividade,Municipal
2013,52040950,ESC MUL SANTA MARIA,5207907,FLORES DE GOIAS,GO,Centro-Oeste,1,3,3.5,2.799999952316284,0.0,Em atividade,Municipal
2013,52089053,ESC MUL SANTINO CAMPELO DE MIRANDA,5207907,FLORES DE GOIAS,GO,Centro-Oeste,1,3,4.0,0.0,0.0,Em atividade,Municipal
2013,52089045,ESC MUL SEBASTIAO TEODORO SOBRINHO,5207907,FLORES DE GOIAS,GO,Centro-Oeste,1,3,0.0,0.0,0.0,Em atividade,Municipal
2013,52089029,ESC MUL SINDOVAL CARNEIRO DE ARAUJO,5207907,FLORES DE GOIAS,GO,Centro-Oeste,1,3,0.0,0.0,0.0,Em atividade,Municipal
2013,52070506,ESCOLA ESTADUAL DAMASIO RIBEIRO DE MIRANDA,5207907,FLORES DE GOIAS,GO,Centro-Oeste,1,2,0.0,4.5,0.0,Em atividade,Estadual
2013,52040844,ESCOLA MUNICIPAL CORA CORALINA,5207907,FLORES DE GOIAS,GO,Centro-Oeste,1,3,0.0,0.0,0.0,Em atividade,Municipal
