anoCenso,cod,nome,codCidade,cidade,estado,regiao,situacaoFuncionamento,dependenciaAdministrativa,idebAI,idebAF,enemMediaGeral,situacaoFuncionamentoTxt,dependenciaAdministrativaTxt
2013,52097170,CRECHE LUARA SISTEROLLI DE CARVALHO ANDRADE,5217401,PIRES DO RIO,GO,Centro-Oeste,1,3,0.0,0.0,0.0,Em atividade,Municipal
2013,52121402,CRECHE MUNICIPAL COLANDY DE OLIVEIRA GODOY,5217401,PIRES DO RIO,GO,Centro-Oeste,1,3,0.0,0.0,0.0,Em atividade,Municipal
2013,52062600,ESC MUL CEL LINO SAMPAIO,5217401,PIRES DO RIO,GO,Centro-Oeste,1,3,5.699999809265137,0.0,0.0,Em atividade,Municipal
2013,52062724,ESC MUL ILDA MARTINS ROSA,5217401,PIRES DO RIO,GO,Centro-Oeste,1,3,5.400000095367432,0.0,0.0,Em atividade,Municipal
2013,52062643,ESC MUL SARA SKAF,5217401,PIRES DO RIO,GO,Centro-Oeste,1,3,5.699999809265137,0.0,0.0,Em atividade,Municipal
2013,52094758,ESCOLA CAMINHO FELIZ,5217401,PIRES DO RIO,GO,Centro-Oeste,1,4,0.0,0.0,0.0,Em atividade,Privada
2013,52062589,ESCOLA DE FORMACAO INTEGRAL PARA MENORES,5217401,PIRES DO RIO,GO,Centro-Oeste,1,4,0.0,0.0,0.0,Em atividade,Privada
2013,52062538,ESCOLA ESTADUAL AUGUSTO MONTEIRO DE GODOY,5217401,PIRES DO RIO,GO,Centro-Oeste,1,2,6.800000190734863,0.0,0.0,Em atividade,Estadual
2013,52097242,ESCOLA LUZ DA HUMANIDADE,5217401,PIRES DO RIO,GO,Centro-Oeste,1,4,0.0,0.0,0.0,Em atividade,Privada
2013,52062716,ESCOLA MUNICIPAL DR NATAL GONCALVES ARAUJO,5217401,PIRES DO RIO,GO,Centro-Oeste,1,3,4.699999809265137,0.0,0.0,Em atividade,Municipal
2013,52062848,ESCOLA MUNICIPAL GRAZIELA FELIX DE SOUZA NEY,5217401,PIRES DO RIO,GO,Centro-Oeste,1,3,6.0,0.0,0.0,Em atividade,Municipal
2013,52062562,ESCOLA MUNICIPAL JOAQUIM CAMARA FILHO,5217401,PIRES DO RIO,GO,Centro-Oeste,1,3,6.300000190734863,0.0,0.0,Em atividade,Municipal
2013,52062651,ESCOLA MUNICIPALIZADA SEBASTIAO ANTONIO LEITE,5217401,PIRES DO RIO,GO,Centro-Oeste,1,3,4.300000190734863,0.0,0.0,Em atividade,Municipal
2013,52079015,C M E I SAGRADO CORACAO DE JESUS,5217609,PLANALTINA,GO,Centro-Oeste,1,3,0.0,0.0,0.0,Em atividade,Municipal
2013,52091465,CENTRO EDUCACIONAL SHEKNAH,5217609,PLANALTINA,GO,Centro-Oeste,1,4,0.0,0.0,0.0,Em atividade,Privada
2013,52050793,CENTRO INTEGRADO DE EDUCACAO MODELO CIEM,5217609,PLANALTINA,GO,Centro-Oeste,1,2,0.0,5.099999904632568,482.31201171875,Em atividade,Estadual
2013,52088952,CENTRO MUNICIPAL DE EDUCACAO INFANTIL MONTEIRO LOBATO,5217609,PLANALTINA,GO,Centro-Oeste,1,3,0.0,0.0,0.0,Em atividade,Municipal
2013,52097897,CENTRO MUNICIPAL DE EDUCACAO INFANTIL SONHO DE CRIANCA,5217609,PLANALTINA,GO,Centro-Oeste,1,3,0.0,0.0,0.0,Em atividade,Municipal
2013,52093956,CENTRO MUNICIPAL DE EDUCACAO INFANTIL SONHO ENCANTADO,5217609,PLANALTINA,GO,Centro-Oeste,1,3,0.0,0.0,0.0,Em atividade,Municipal
2013,52134202,CMEI MARIA INEZ PEREIRA CAMPOS,5217609,PLANALTINA,GO,Centro-Oeste,1,3,0.0,0.0,0.0,Em atividade,Municipal
2013,52051129,COLEGIO ESTADUAL ALDA FERREIRA,5217609,PLANALTINA,GO,Centro-Oeste,1,2,0.0,0.0,0.0,Em atividade,Estadual
2013,52050874,COLEGIO ESTADUAL COMPLEXO 07,5217609,PLANALTINA,GO,Centro-Oeste,1,2,0.0,4.099999904632568,463.2659912109375,Em atividade,Estadual
2013,52051099,COLEGIO ESTADUAL COMPLEXO 3,5217609,PLANALTINA,GO,Centro-Oeste,1,2,0.0,3.700000047683716,0.0,Em atividade,Estadual
2013,52051102,COLEGIO ESTADUAL COMPLEXO 9,5217609,PLANALTINA,GO,Centro-Oeste,1,2,0.0,3.9000000953674316,0.0,Em atividade,Estadual
2013,52050840,COLEGIO ESTADUAL COMPLEXO N 01,5217609,PLANALTINA,GO,Centro-Oeste,1,2,0.0,4.099999904632568,0.0,Em atividade,Estadual
2013,52050807,COLEGIO ESTADUAL COMPLEXO N 02,5217609,PLANALTINA,GO,Centro-Oeste,1,2,0.0,0.0,0.0,Em atividade,Estadual
2013,52076008,COLEGIO ESTADUAL COMPLEXO N 10,5217609,PLANALTINA,GO,Centro-Oeste,1,2,0.0,3.5,442.7340087890625,Em atividade,Estadual
2013,52050866,COLEGIO ESTADUAL COMPLEXO N 5,5217609,PLANALTINA,GO,Centro-Oeste,1,2,0.0,3.700000047683716,0.0,Em atividade,Estadual
2013,52050882,COLEGIO ESTADUAL DE PLANALTINA,5217609,PLANALTINA,GO,Centro-Oeste,1,2,0.0,4.099999904632568,0.0,Em atividade,Estadual
2013,52073319,COLEGIO MORAES GUALBERTO,5217609,PLANALTINA,GO,Centro-Oeste,1,4,0.0,0.0,526.4320068359375,Em atividade,Privada
2013,52050785,COLEGIO VOO LIVRE LTDA,5217609,PLANALTINA,GO,Centro-Oeste,1,4,0.0,0.0,525.1240234375,Em atividade,Privada
2013,52075974,ESC ENS ESP CRIANCA FELIZ,5217609,PLANALTINA,GO,Centro-Oeste,1,3,0.0,0.0,0.0,Em atividade,Municipal
2013,52075982,ESC MUL BOA ESPERANCA,5217609,PLANALTINA,GO,Centro-Oeste,1,3,3.9000000953674316,3.5999999046325684,0.0,Em atividade,Municipal
2013,52051064,ESC MUL CANJICA,5217609,PLANALTINA,GO,Centro-Oeste,1,3,0.0,0.0,0.0,Em atividade,Municipal
2013,52092674,ESC MUL CARLOS DRUMMOND DE ANDRADE,5217609,PLANALTINA,GO,Centro-Oeste,1,3,5.300000190734863,3.0999999046325684,0.0,Em atividade,Municipal
2013,52050858,ESC MUL CASTRO ALVES,5217609,PLANALTINA,GO,Centro-Oeste,1,3,0.0,0.0,0.0,Em atividade,Municipal
2013,52089002,ESC MUL CECILIA MEIRELES,5217609,PLANALTINA,GO,Centro-Oeste,1,3,4.599999904632568,4.300000190734863,0.0,Em atividade,Municipal
2013,52092666,ESC MUL CORA CORALINA,5217609,PLANALTINA,GO,Centro-Oeste,1,3,4.900000095367432,0.0,0.0,Em atividade,Municipal
2013,52073254,ESC MUL CORREGO RICO,5217609,PLANALTINA,GO,Centro-Oeste,1,3,0.0,0.0,0.0,Em atividade,Municipal
2013,52051110,ESC MUL CRIANCA ESPERANCA,5217609,PLANALTINA,GO,Centro-Oeste,1,3,4.0,0.0,0.0,Em atividade,Municipal
2013,52088936,ESC MUL DARCY RIBEIRO,5217609,PLANALTINA,GO,Centro-Oeste,1,3,3.799999952316284,2.799999952316284,0.0,Em atividade,Municipal
2013,52083039,ESC MUL ELOY PINTO DE ARAUJO,5217609,PLANALTINA,GO,Centro-Oeste,1,3,4.699999809265137,0.0,0.0,Em atividade,Municipal
2013,52085341,ESC MUL EMILIA FERREIRO,5217609,PLANALTINA,GO,Centro-Oeste,1,3,3.5,3.799999952316284,0.0,Em atividade,Municipal
2013,52050912,ESC MUL ESTRELA DO LESTE,5217609,PLANALTINA,GO,Centro-Oeste,1,3,4.099999904632568,3.299999952316284,0.0,Em atividade,Municipal
2013,52073300,ESC MUL FELIPE DE LYON,5217609,PLANALTINA,GO,Centro-Oeste,1,3,4.400000095367432,4.5,0.0,Em atividade,Municipal
2013,52075966,ESC MUL FLOR DA TERRA,5217609,PLANALTINA,GO,Centro-Oeste,1,3,0.0,0.0,0.0,Em atividade,Municipal
2013,52050955,ESC MUL GENTE PEQUENA,5217609,PLANALTINA,GO,Centro-Oeste,1,3,4.0,3.5999999046325684,0.0,Em atividade,Municipal
2013,52092658,ESC MUL JORGE AMADO,5217609,PLANALTINA,GO,Centro-Oeste,1,3,4.599999904632568,4.0,0.0,Em atividade,Municipal
2013,52050823,ESC MUL MACHADO DE ASSIS,5217609,PLANALTINA,GO,Centro-Oeste,1,3,5.5,0.0,0.0,Em atividade,Municipal
2013,52051080,ESC MUL MARCELO LEMGRUBER,5217609,PLANALTINA,GO,Centro-Oeste,1,3,4.699999809265137,3.0,0.0,Em atividade,Municipal
2013,52050971,ESC MUL NOSSA SENHORA APARECIDA,5217609,PLANALTINA,GO,Centro-Oeste,1,3,5.0,0.0,0.0,Em atividade,Municipal
2013,52092640,ESC MUL OLAVO BILAC,5217609,PLANALTINA,GO,Centro-Oeste,1,3,4.099999904632568,3.299999952316284,0.0,Em atividade,Municipal
2013,52073262,ESC MUL PANORAMA,5217609,PLANALTINA,GO,Centro-Oeste,1,3,3.9000000953674316,0.0,0.0,Em atividade,Municipal
2013,52091473,ESC MUL PINGO DE SABEDORIA,5217609,PLANALTINA,GO,Centro-Oeste,1,3,5.099999904632568,0.0,0.0,Em atividade,Municipal
2013,52092631,ESC MUL PROFESSORA JULIA DA SILVA OLIVEIRA,5217609,PLANALTINA,GO,Centro-Oeste,1,3,4.5,3.299999952316284,0.0,Em atividade,Municipal
2013,52091422,ESC MUL PROFESSORA ZAIDA BOAVENTURA,5217609,PLANALTINA,GO,Centro-Oeste,1,3,4.300000190734863,0.0,0.0,Em atividade,Municipal
2013,52050831,ESC MUL RUI BARBOSA,5217609,PLANALTINA,GO,Centro-Oeste,1,3,4.699999809265137,0.0,0.0,Em atividade,Municipal
2013,52073335,ESC MUL SANTA MARIA,5217609,PLANALTINA,GO,Centro-Oeste,1,3,0.0,0.0,0.0,Em atividade,Municipal
2013,52101401,ESC MUL SIMONE PINTO BOAVENTURA,5217609,PLANALTINA,GO,Centro-Oeste,1,3,5.0,0.0,0.0,Em atividade,Municipal
2013,52050998,ESC MUL VILA MUTIRAO,5217609,PLANALTINA,GO,Centro-Oeste,1,3,3.200000047683716,3.200000047683716,0.0,Em atividade,Municipal
2013,52051005,ESC MUL VILA PALMA,5217609,PLANALTINA,GO,Centro-Oeste,1,3,0.0,0.0,0.0,Em atividade,Municipal
2013,52191389,ESCOLA BEATRIZ APARECIDA - EBA,5217609,PLANALTINA,GO,Centro-Oeste,1,4,0.0,0.0,0.0,Em atividade,Privada
2013,52188442,ESCOLA CRESCER E SABER,5217609,PLANALTINA,GO,Centro-Oeste,1,4,0.0,0.0,0.0,Em atividade,Privada
2013,52147207,ESCOLA LIVRE EXPRESSAO,5217609,PLANALTINA,GO,Centro-Oeste,1,4,0.0,0.0,0.0,Em atividade,Privada
2013,52091414,ESCOLA MILENIO,5217609,PLANALTINA,GO,Centro-Oeste,1,4,0.0,0.0,0.0,Em atividade,Privada
2013,52050890,ESCOLA MUL ALTO DA SERRA,5217609,PLANALTINA,GO,Centro-Oeste,1,3,0.0,0.0,0.0,Em atividade,Municipal
2013,52094901,ESCOLA MUNICIPAL ARCO IRIS,5217609,PLANALTINA,GO,Centro-Oeste,1,3,0.0,0.0,0.0,Em atividade,Municipal
2013,52082709,ESCOLA MUNICIPAL CONQUISTA DO SABER,5217609,PLANALTINA,GO,Centro-Oeste,1,3,5.099999904632568,0.0,0.0,Em atividade,Municipal
2013,52088928,ESCOLA MUNICIPAL ECA DE QUEIROS,5217609,PLANALTINA,GO,Centro-Oeste,1,3,4.400000095367432,0.0,0.0,Em atividade,Municipal
2013,52051021,ESCOLA MUNICIPAL FLOR DO CERRADO,5217609,PLANALTINA,GO,Centro-Oeste,1,3,0.0,0.0,0.0,Em atividade,Municipal
2013,52098044,ESCOLA MUNICIPAL ITAUNA,5217609,PLANALTINA,GO,Centro-Oeste,1,3,0.0,0.0,0.0,Em atividade,Municipal
2013,52073297,ESCOLA MUNICIPAL JARDIM PAQUETA,5217609,PLANALTINA,GO,Centro-Oeste,1,3,4.199999809265137,0.0,0.0,Em atividade,Municipal
2013,52085333,ESCOLA MUNICIPAL PAULO FREIRE,5217609,PLANALTINA,GO,Centro-Oeste,1,3,4.699999809265137,3.799999952316284,0.0,Em atividade,Municipal
2013,52074072,ESCOLA MUNICIPAL PROFESSOR FRANCISCO ALAN,5217609,PLANALTINA,GO,Centro-Oeste,1,3,3.700000047683716,0.0,0.0,Em atividade,Municipal
2013,52094880,ESCOLA MUNICIPAL VIVER E APRENDER,5217609,PLANALTINA,GO,Centro-Oeste,1,3,0.0,0.0,0.0,Em atividade,Municipal
2013,52098559,ESCOLA PEQUENINOS DE JESUS,5217609,PLANALTINA,GO,Centro-Oeste,1,4,0.0,0.0,0.0,Em atividade,Privada
2013,52096769,ESCOLA PRIMEIROS PASSOS,5217609,PLANALTINA,GO,Centro-Oeste,1,4,0.0,0.0,0.0,Em atividade,Privada
2013,52191397,ESCOLA RENASCER DE PLANALTINA,5217609,PLANALTINA,GO,Centro-Oeste,1,4,0.0,0.0,0.0,Em atividade,Privada
2013,52061302,COLEGIO ESTADUAL JERONIMO PEREIRA MAIA,5217708,PONTALINA,GO,Centro-Oeste,1,2,0.0,4.800000190734863,450.0159912109375,Em atividade,Estadual
2013,52061370,COLEGIO ESTADUAL RUI BARBOSA,5217708,PONTALINA,GO,Centro-Oeste,1,2,6.599999904632568,0.0,0.0,Em atividade,Estadual
2013,52061310,COLEGIO ESTADUAL SANTA RITA DE CASSIA,5217708,PONTALINA,GO,Centro-Oeste,1,2,7.400000095367432,5.5,499.75799560546875,Em atividade,Estadual
2013,52280357,COLEGIO GOYAZ,5217708,PONTALINA,GO,Centro-Oeste,1,4,0.0,0.0,0.0,Em atividade,Privada
2013,52061329,COLEGIO INTEGRACAO,5217708,PONTALINA,GO,Centro-Oeste,1,4,0.0,0.0,547.8060302734375,Em atividade,Privada
2013,52079112,CRECHE TIA MARRY,5217708,PONTALINA,GO,Centro-Oeste,1,3,0.0,0.0,0.0,Em atividade,Municipal
2013,52061604,ESCOLA INFANTIL TOQUINHA DO COELHO,5217708,PONTALINA,GO,Centro-Oeste,1,4,0.0,0.0,0.0,Em atividade,Privada
2013,52088456,ESCOLA MUNICIPAL AYRTON SENNA DA SILVA,5217708,PONTALINA,GO,Centro-Oeste,1,3,4.599999904632568,4.199999809265137,0.0,Em atividade,Municipal
2013,52061442,ESCOLA MUNICIPAL DR JOSE GUIMARAES,5217708,PONTALINA,GO,Centro-Oeste,1,3,0.0,0.0,0.0,Em atividade,Municipal
2013,52061337,ESCOLA MUNICIPAL HESMALITA BARBOSA DE ANDRADE,5217708,PONTALINA,GO,Centro-Oeste,1,3,0.0,0.0,0.0,Em atividade,Municipal
2013,52061345,ESCOLA MUNICIPAL JUSTINIANO JOSE MACHADO,5217708,PONTALINA,GO,Centro-Oeste,1,3,5.5,5.0,0.0,Em atividade,Municipal
2013,52061353,ESCOLA MUNICIPAL MESSIAS MONTEIRO PEREIRA,5217708,PONTALINA,GO,Centro-Oeste,1,3,6.5,0.0,0.0,Em atividade,Municipal
2013,52061574,ESCOLA MUNICIPAL OLIMPIO SAMPAIO,5217708,PONTALINA,GO,Centro-Oeste,1,3,0.0,0.0,0.0,Em atividade,Municipal
2013,52061582,ESCOLA MUNICIPAL PROFESSOR JOAO CASSIMIRO DA SILVA,5217708,PONTALINA,GO,Centro-Oeste,1,3,0.0,0.0,0.0,Em atividade,Municipal
2013,52061388,ESCOLA MUNICIPAL ZILDA DE ABREU,5217708,PONTALINA,GO,Centro-Oeste,1,3,0.0,0.0,0.0,Em atividade,Municipal
2013,52069826,CENTRO DE ATENDIMENTO EDUCACIONAL ESPECIALIZADO ELIZA GOMES DA SILVA - APAE,5218003,PORANGATU,GO,Centro-Oeste,1,4,0.0,0.0,0.0,Em atividade,Privada
2013,52084906,CENTRO DE EDUCACAO INFANTIL ABELHINHA,5218003,PORANGATU,GO,Centro-Oeste,1,3,0.0,0.0,0.0,Em atividade,Municipal
2013,52085066,CENTRO DE EDUCACAO INFANTIL FORMIGUINHA,5218003,PORANGATU,GO,Centro-Oeste,1,3,0.0,0.0,0.0,Em atividade,Municipal
2013,52084957,CENTRO DE EDUCACAO INFANTIL LAR SAO VICENTE DE PAULA,5218003,PORANGATU,GO,Centro-Oeste,1,3,0.0,0.0,0.0,Em atividade,Municipal
2013,52200400,CENTRO DE EDUCACAO PROFISSIONAL DE PORANGATU - CEPP,5218003,PORANGATU,GO,Centro-Oeste,1,2,0.0,0.0,0.0,Em atividade,Estadual
2013,52074498,CENTRO EDUCACIONAL EVANGELICO LIBER,5218003,PORANGATU,GO,Centro-Oeste,1,4,0.0,0.0,0.0,Em atividade,Privada
2013,52084930,CENTRO EDUCACIONAL GERALDO MONTEIRO DE LIMA,5218003,PORANGATU,GO,Centro-Oeste,1,3,0.0,0.0,0.0,Em atividade,Municipal
2013,52010279,COLEGIO CENECISTA DE PORANGATU,5218003,PORANGATU,GO,Centro-Oeste,1,4,0.0,0.0,507.1319885253906,Em atividade,Privada
2013,52010325,COLEGIO ESTADUAL JOAO FAGUNDES FURTADO,5218003,PORANGATU,GO,Centro-Oeste,1,2,0.0,4.699999809265137,0.0,Em atividade,Estadual
2013,52010350,COLEGIO ESTADUAL PRESIDENTE KENNEDY,5218003,PORANGATU,GO,Centro-Oeste,1,2,0.0,5.0,0.0,Em atividade,Estadual
2013,52010309,COLEGIO ESTADUAL PROFESSOR WALDEMAR LOPES DO AMARAL BRITO,5218003,PORANGATU,GO,Centro-Oeste,1,2,0.0,0.0,0.0,Em atividade,Estadual
2013,52010287,COLEGIO ESTADUAL STELLANIS KOPANAKIS PACHECO,5218003,PORANGATU,GO,Centro-Oeste,1,2,0.0,0.0,0.0,Em atividade,Estadual
2013,52010368,COLEGIO ESTADUAL TOMAZ MARTINS DA CUNHA,5218003,PORANGATU,GO,Centro-Oeste,1,2,0.0,3.299999952316284,0.0,Em atividade,Estadual
2013,52097633,COLEGIO IMPACTO,5218003,PORANGATU,GO,Centro-Oeste,1,4,0.0,0.0,538.9000244140625,Em atividade,Privada
2013,52093808,COLEGIO NEO OBJETIVO,5218003,PORANGATU,GO,Centro-Oeste,1,4,0.0,0.0,528.0020141601562,Em atividade,Privada
2013,52010856,COLEGIO NOSSA SENHORA DE FATIMA,5218003,PORANGATU,GO,Centro-Oeste,1,4,0.0,0.0,0.0,Em atividade,Privada
2013,52088650,CRECHE DONA ANIZIA CAVALCANTE BATISTA,5218003,PORANGATU,GO,Centro-Oeste,1,3,0.0,0.0,0.0,Em atividade,Municipal
2013,52084922,CRECHE GENTE PEQUENA,5218003,PORANGATU,GO,Centro-Oeste,1,3,0.0,0.0,0.0,Em atividade,Municipal
2013,52084949,CRECHE LAR DOS CANARINHOS,5218003,PORANGATU,GO,Centro-Oeste,1,3,0.0,0.0,0.0,Em atividade,Municipal
2013,52010589,ESC MUL EUZEBIO MARTINS DA CUNHA,5218003,PORANGATU,GO,Centro-Oeste,1,3,4.300000190734863,3.0,0.0,Em atividade,Municipal
2013,52010600,ESC MUL FRANCISCO BORGES DA SILVA,5218003,PORANGATU,GO,Centro-Oeste,1,3,4.5,0.0,0.0,Em atividade,Municipal
2013,52010627,ESC MUL JESUINO GONCALVES DOS REIS,5218003,PORANGATU,GO,Centro-Oeste,1,3,5.300000190734863,0.0,0.0,Em atividade,Municipal
2013,52072223,ESC MUL NOSSA SENHORA DA PIEDADE,5218003,PORANGATU,GO,Centro-Oeste,1,3,4.400000095367432,3.5,0.0,Em atividade,Municipal
2013,52069435,ESC MUL PROF MARIA JOSE GONCALVES,5218003,PORANGATU,GO,Centro-Oeste,1,3,5.199999809265137,3.799999952316284,0.0,Em atividade,Municipal
2013,52010899,ESC MUL REUNIDA SAO SEBASTIAO,5218003,PORANGATU,GO,Centro-Oeste,1,3,0.0,0.0,0.0,Em atividade,Municipal
2013,52010821,ESC MUL STA TEREZINHA,5218003,PORANGATU,GO,Centro-Oeste,1,3,4.5,0.0,0.0,Em atividade,Municipal
2013,52084620,ESC MUL VEREADOR MAURICIO REIS,5218003,PORANGATU,GO,Centro-Oeste,1,3,3.299999952316284,0.0,0.0,Em atividade,Municipal
2013,52010511,ESC REUNIDA ADELINO AMERICO DE AZEVEDO,5218003,PORANGATU,GO,Centro-Oeste,1,3,0.0,0.0,0.0,Em atividade,Municipal
2013,52010570,ESC REUNIDA DA CAPELINHA,5218003,PORANGATU,GO,Centro-Oeste,1,3,0.0,0.0,0.0,Em atividade,Municipal
2013,52010880,ESC REUNIDA LINDA VISTA,5218003,PORANGATU,GO,Centro-Oeste,1,3,0.0,0.0,0.0,Em atividade,Municipal
2013,52010929,ESCOLA ADVENTISTA DE PORANGATU,5218003,PORANGATU,GO,Centro-Oeste,1,4,0.0,0.0,0.0,Em atividade,Privada
2013,52010317,ESCOLA ESTADUAL DONA GERCINA BORGES TEIXEIRA,5218003,PORANGATU,GO,Centro-Oeste,1,2,6.099999904632568,4.699999809265137,0.0,Em atividade,Estadual
2013,52010341,ESCOLA ESTADUAL PEDRO II,5218003,PORANGATU,GO,Centro-Oeste,1,2,5.900000095367432,0.0,0.0,Em atividade,Estadual
2013,52010376,ESCOLA EVANGELICA PRESBITERIANA DE PORANGATU,5218003,PORANGATU,GO,Centro-Oeste,1,4,0.0,0.0,0.0,Em atividade,Privada
2013,52010392,ESCOLA ISOLADA LUDOVICO PEREIRA DO LAGO,5218003,PORANGATU,GO,Centro-Oeste,1,3,0.0,0.0,0.0,Em atividade,Municipal
2013,52010643,ESCOLA MUNICIPAL LUIZ ALVES PEREIRA,5218003,PORANGATU,GO,Centro-Oeste,1,3,5.0,3.5999999046325684,0.0,Em atividade,Municipal
2013,52069494,ESCOLA MUNICIPAL PRESIDIO DE SANTA CRUZ,5218003,PORANGATU,GO,Centro-Oeste,1,3,0.0,0.0,0.0,Em atividade,Municipal
2013,52010732,ESCOLA MUNICIPAL PROFA MARIA DAS GRACAS MARQUES DE MORAIS,5218003,PORANGATU,GO,Centro-Oeste,1,3,0.0,3.5,0.0,Em atividade,Municipal
2013,52010554,ESCOLA REUNIDA BRANDINA TAVARES,5218003,PORANGATU,GO,Centro-Oeste,1,3,0.0,0.0,0.0,Em atividade,Municipal
2013,52090183,SENAC CENTRO DE EDUCACAO PROFISSIONAL DE PORANGATU,5218003,PORANGATU,GO,Centro-Oeste,1,4,0.0,0.0,0.0,Em atividade,Privada
2013,52084507,CENTRO MUL DE EDUCACAO INF FELINTA ROSA VASCONCELOS,5218052,PORTEIRAO,GO,Centro-Oeste,1,3,0.0,0.0,0.0,Em atividade,Municipal
2013,52059235,COLEGIO ESTADUAL PROFESSOR BRAZ SIMOES BORGES,5218052,PORTEIRAO,GO,Centro-Oeste,1,2,0.0,4.300000190734863,0.0,Em atividade,Estadual
2013,52074293,ESC MUL ENS FUND SETE DE SETEMBRO,5218052,PORTEIRAO,GO,Centro-Oeste,1,3,5.599999904632568,0.0,0.0,Em atividade,Municipal
2013,52054101,COLEGIO ESTADUAL MANOEL COSTA LIMA,5218102,PORTELANDIA,GO,Centro-Oeste,1,2,0.0,4.800000190734863,468.5299987792969,Em atividade,Estadual
2013,52054144,ESCOLA MATERNAL DONA LEVINDA MARIA DE RESENDE,5218102,PORTELANDIA,GO,Centro-Oeste,1,3,0.0,0.0,0.0,Em atividade,Municipal
2013,52072711,ESCOLA MUNICIPAL PROFESSORA CELMA PEREIRA BORGES,5218102,PORTELANDIA,GO,Centro-Oeste,1,3,5.800000190734863,0.0,0.0,Em atividade,Municipal
2013,52041840,CEMEI GOTINHA MAGICA,5218300,POSSE,GO,Centro-Oeste,1,3,0.0,0.0,0.0,Em atividade,Municipal
2013,52041859,CEMEI-CENTRO MUNICIPAL DE EDUCACAO INFANTIL MARIA DE OLIVEIRA SILVA CASINHA FELIZ,5218300,POSSE,GO,Centro-Oeste,1,3,0.0,0.0,0.0,Em atividade,Municipal
2013,52041816,COLEGIO ESTADUAL ARGEMIRO ANTONIO DE ARAUJO,5218300,POSSE,GO,Centro-Oeste,1,2,0.0,5.199999809265137,455.2820129394531,Em atividade,Estadual
2013,52041824,COLEGIO ESTADUAL CORONEL ERNESTO ANTONIO DE ARAUJO,5218300,POSSE,GO,Centro-Oeste,1,2,6.099999904632568,5.199999809265137,0.0,Em atividade,Estadual
2013,52041875,COLEGIO ESTADUAL DO POVOADO BARREIRO,5218300,POSSE,GO,Centro-Oeste,1,2,0.0,4.699999809265137,455.114013671875,Em atividade,Estadual
2013,52041883,COLEGIO ESTADUAL DOM PRUDENCIO,5218300,POSSE,GO,Centro-Oeste,1,2,0.0,4.400000095367432,0.0,Em atividade,Estadual
2013,52041921,COLEGIO ESTADUAL PROFESSORA JOSEFA BARBOSA VALENTE,5218300,POSSE,GO,Centro-Oeste,1,2,5.800000190734863,4.900000095367432,0.0,Em atividade,Estadual
2013,52042340,COLEGIO IMACULADO CORACAO DE MARIA,5218300,POSSE,GO,Centro-Oeste,1,4,0.0,0.0,559.719970703125,Em atividade,Privada
2013,52041832,COLEGIO MUNICIPAL CASTRO ALVES,5218300,POSSE,GO,Centro-Oeste,1,3,5.800000190734863,5.300000190734863,592.5700073242188,Em atividade,Municipal
2013,52041867,ESCOLA ADVENTISTA DE POSSE,5218300,POSSE,GO,Centro-Oeste,1,4,0.0,0.0,0.0,Em atividade,Privada
2013,52041891,ESCOLA ESTADUAL DR JOAO TEIXEIRA JUNIOR,5218300,POSSE,GO,Centro-Oeste,1,2,6.800000190734863,5.800000190734863,0.0,Em atividade,Estadual
2013,52041905,ESCOLA ESTADUAL POVOADO NOVA VISTA,5218300,POSSE,GO,Centro-Oeste,1,2,4.800000190734863,4.300000190734863,0.0,Em atividade,Estadual
2013,52041913,ESCOLA ESTADUAL PROFESSORA FRANCISCA PINTO FERNANDES ROSA,5218300,POSSE,GO,Centro-Oeste,1,2,5.699999809265137,5.199999809265137,0.0,Em atividade,Estadual
2013,52041948,ESCOLA MUNICIPAL AMBROSIO FERREIRA DA HORA,5218300,POSSE,GO,Centro-Oeste,1,3,0.0,0.0,0.0,Em atividade,Municipal
2013,52041964,ESCOLA MUNICIPAL ANTONIO AMARAL,5218300,POSSE,GO,Centro-Oeste,1,3,0.0,0.0,0.0,Em atividade,Municipal
2013,52041999,ESCOLA MUNICIPAL AUGUSTO ALVES DOS SANTOS,5218300,POSSE,GO,Centro-Oeste,1,3,0.0,0.0,0.0,Em atividade,Municipal
2013,52042006,ESCOLA MUNICIPAL AURELIANO FERREIRA SILVA,5218300,POSSE,GO,Centro-Oeste,1,3,0.0,0.0,0.0,Em atividade,Municipal
2013,52042014,ESCOLA MUNICIPAL BRAULIO RIBEIRO SOBRINHO,5218300,POSSE,GO,Centro-Oeste,1,3,0.0,0.0,0.0,Em atividade,Municipal
2013,52042022,ESCOLA MUNICIPAL CARLOS BISPO ALVES,5218300,POSSE,GO,Centro-Oeste,1,3,0.0,4.0,0.0,Em atividade,Municipal
2013,52042081,ESCOLA MUNICIPAL DO POVOADO RODOVILANDIA,5218300,POSSE,GO,Centro-Oeste,1,3,0.0,0.0,0.0,Em atividade,Municipal
2013,52086305,ESCOLA MUNICIPAL DR JOAQUIM PEREIRA DA COSTA,5218300,POSSE,GO,Centro-Oeste,1,3,5.5,0.0,0.0,Em atividade,Municipal
2013,52090442,ESCOLA MUNICIPAL EVA ROSA DA SILVA,5218300,POSSE,GO,Centro-Oeste,1,3,5.599999904632568,0.0,0.0,Em atividade,Municipal
2013,52098389,ESCOLA MUNICIPAL FAUSTO BARBOSA DE SOUSA,5218300,POSSE,GO,Centro-Oeste,1,3,0.0,0.0,0.0,Em atividade,Municipal
2013,52042154,ESCOLA MUNICIPAL GUSTAVO FRANCISCO DOS SANTOS,5218300,POSSE,GO,Centro-Oeste,1,3,0.0,0.0,0.0,Em atividade,Municipal
2013,52042049,ESCOLA MUNICIPAL IRACI DO BONFIM,5218300,POSSE,GO,Centro-Oeste,1,3,0.0,0.0,0.0,Em atividade,Municipal
2013,52042189,ESCOLA MUNICIPAL JOAQUIM GOMES DOS SANTOS,5218300,POSSE,GO,Centro-Oeste,1,3,0.0,0.0,0.0,Em atividade,Municipal
2013,52072363,ESCOLA MUNICIPAL JOAQUIM JOSE DOS SANTOS,5218300,POSSE,GO,Centro-Oeste,1,3,0.0,0.0,0.0,Em atividade,Municipal
2013,52042200,ESCOLA MUNICIPAL JOSE PEREIRA DOS SANTOS,5218300,POSSE,GO,Centro-Oeste,1,3,0.0,0.0,0.0,Em atividade,Municipal
2013,52041930,ESCOLA MUNICIPAL MATIAS PINHEIRO LEMOS,5218300,POSSE,GO,Centro-Oeste,1,3,0.0,0.0,0.0,Em atividade,Municipal
2013,52042090,ESCOLA MUNICIPAL NEMISIA VIEIRA DE MELO,5218300,POSSE,GO,Centro-Oeste,1,3,0.0,0.0,0.0,Em atividade,Municipal
2013,52089231,ESCOLA MUNICIPAL PRIMEIROS PASSOS,5218300,POSSE,GO,Centro-Oeste,1,3,0.0,0.0,0.0,Em atividade,Municipal
2013,52082350,ESCOLA MUNICIPAL PROFESSORA AVANI PEREIRA DA ROSA E SILVA,5218300,POSSE,GO,Centro-Oeste,1,3,6.199999809265137,5.300000190734863,0.0,Em atividade,Municipal
2013,52042324,ESCOLA MUNICIPAL PROFESSORA MARIA LEITE DE ALMEIDA NASCIMENTO,5218300,POSSE,GO,Centro-Oeste,1,3,5.800000190734863,3.5,0.0,Em atividade,Municipal
2013,52042294,ESCOLA MUNICIPAL SEVERINO PEREIRA DOS SANTOS,5218300,POSSE,GO,Centro-Oeste,1,3,0.0,0.0,0.0,Em atividade,Municipal
2013,52042308,ESCOLA RAVASCO,5218300,POSSE,GO,Centro-Oeste,1,4,0.0,0.0,0.0,Em atividade,Privada
2013,52061639,COLEGIO ESTADUAL OTONIEL DA CUNHA,5218391,PROFESSOR JAMIL,GO,Centro-Oeste,1,2,5.900000095367432,0.0,0.0,Em atividade,Estadual
2013,52061612,COLEGIO ESTADUAL PROFESSOR JAMIL SAFADY,5218391,PROFESSOR JAMIL,GO,Centro-Oeste,1,2,0.0,5.300000190734863,454.6059875488281,Em atividade,Estadual
2013,52061620,ESCOLA ESTADUAL BOA NOVA,5218391,PROFESSOR JAMIL,GO,Centro-Oeste,1,2,6.900000095367432,0.0,0.0,Em atividade,Estadual
2013,52091880,ESCOLA MUNICIPAL PROFESSOR GERACY PEREIRA DOS SANTOS,5218391,PROFESSOR JAMIL,GO,Centro-Oeste,1,3,0.0,0.0,0.0,Em atividade,Municipal
2013,52069451,CENTRO DE ATENDIMENTO EDUCACIONAL ESPECIALIZADO DOUTOR ALFREDO MARIZ DA COSTA - LIONS CLUBE,5218508,QUIRINOPOLIS,GO,Centro-Oeste,1,4,0.0,0.0,0.0,Em atividade,Privada
2013,52096360,CENTRO DE CIENCIAS CULTURA E TECNOLOGIA SAO JOSE,5218508,QUIRINOPOLIS,GO,Centro-Oeste,1,4,0.0,0.0,0.0,Em atividade,Privada
2013,52095916,CENTRO EDUCACIONAL UNIVERSO DA CRIANCA,5218508,QUIRINOPOLIS,GO,Centro-Oeste,1,4,0.0,0.0,0.0,Em atividade,Privada
2013,52077233,CENTRO MUNICIPAL DE EDUCACAO INFANTIL MARCONZINHO,5218508,QUIRINOPOLIS,GO,Centro-Oeste,1,3,0.0,0.0,0.0,Em atividade,Municipal
2013,52094073,CENTRO MUNICIPAL DE EDUCACAO INFANTIL MARCOS ALVES MAGALHAES,5218508,QUIRINOPOLIS,GO,Centro-Oeste,1,3,0.0,0.0,0.0,Em atividade,Municipal
2013,52097404,CENTRO TECNOLOGICO PAULA PASQUALI,5218508,QUIRINOPOLIS,GO,Centro-Oeste,1,4,0.0,0.0,0.0,Em atividade,Privada
2013,52078302,CMEI NOSSA SENHORA D ABADIA,5218508,QUIRINOPOLIS,GO,Centro-Oeste,1,3,0.0,0.0,0.0,Em atividade,Municipal
2013,52096998,COLEGIO CRISTAO ALFA E OMEGA,5218508,QUIRINOPOLIS,GO,Centro-Oeste,1,4,0.0,0.0,0.0,Em atividade,Privada
2013,52067815,COLEGIO ESTADUAL DR ONERIO PEREIRA VIEIRA,5218508,QUIRINOPOLIS,GO,Centro-Oeste,1,2,6.900000095367432,5.199999809265137,450.70001220703125,Em atividade,Estadual
2013,52067874,COLEGIO ESTADUAL DR PEDRO LUDUVICO,5218508,QUIRINOPOLIS,GO,Centro-Oeste,1,2,0.0,4.5,0.0,Em atividade,Estadual
2013,52067823,COLEGIO ESTADUAL INDEPENDENCIA,5218508,QUIRINOPOLIS,GO,Centro-Oeste,1,2,0.0,0.0,470.7659912109375,Em atividade,Estadual
2013,52067890,COLEGIO ESTADUAL JOAO XXIII,5218508,QUIRINOPOLIS,GO,Centro-Oeste,1,2,0.0,0.0,0.0,Em atividade,Estadual
2013,52067831,COLEGIO ESTADUAL JUSCELINO KUBITSCHEK,5218508,QUIRINOPOLIS,GO,Centro-Oeste,1,2,6.400000095367432,5.400000095367432,0.0,Em atividade,Estadual
2013,52067904,COLEGIO ESTADUAL LAURO JACINTO DA SILVA,5218508,QUIRINOPOLIS,GO,Centro-Oeste,1,2,0.0,0.0,0.0,Em atividade,Estadual
2013,52067912,COLEGIO ESTADUAL OLGA PARREIRA,5218508,QUIRINOPOLIS,GO,Centro-Oeste,1,2,0.0,0.0,0.0,Em atividade,Estadual
2013,52067920,COLEGIO ESTADUAL PRESIDENTE CASTELO BRANCO,5218508,QUIRINOPOLIS,GO,Centro-Oeste,1,2,6.0,0.0,0.0,Em atividade,Estadual
2013,52067858,COLEGIO EXPANSAO DE SANTA MARIA DOS ANJOS,5218508,QUIRINOPOLIS,GO,Centro-Oeste,1,4,0.0,0.0,582.3759765625,Em atividade,Privada
2013,52068390,COLEGIO SAO JOSE LTDA,5218508,QUIRINOPOLIS,GO,Centro-Oeste,1,4,0.0,0.0,505.5060119628906,Em atividade,Privada
2013,52067840,COOPERATIVA DE ENSINO DE QUIRINOPOLIS,5218508,QUIRINOPOLIS,GO,Centro-Oeste,1,4,0.0,0.0,537.0239868164062,Em atividade,Privada
2013,52067998,ESC MUL CANAA,5218508,QUIRINOPOLIS,GO,Centro-Oeste,1,3,6.099999904632568,4.400000095367432,0.0,Em atividade,Municipal
