anoCenso,cod,nome,codCidade,cidade,estado,regiao,situacaoFuncionamento,dependenciaAdministrativa,idebAI,idebAF,enemMediaGeral,situacaoFuncionamentoTxt,dependenciaAdministrativaTxt
2013,41125843,CASTELO BRANCO E M PRES EI EF,4105805,COLOMBO,PR,Sul,1,3,6.199999809265137,0.0,0.0,Em atividade,Municipal
2013,41143809,CEEBJA ULYSSES GUIMARAES EF M,4105805,COLOMBO,PR,Sul,1,2,0.0,0.0,0.0,Em atividade,Estadual
2013,41380851,CENTRO DE EDUC INFANTIL COLOMBINHO,4105805,COLOMBO,PR,Sul,1,4,0.0,0.0,0.0,Em atividade,Privada
2013,41362713,CENTRO DE EDUCACAO E INCLUSAO SOCIAL BETANIA,4105805,COLOMBO,PR,Sul,1,3,0.0,0.0,0.0,Em atividade,Municipal
2013,41358309,CHAPEUZINHO VERMELHO C M E I,4105805,COLOMBO,PR,Sul,1,3,0.0,0.0,0.0,Em atividade,Municipal
2013,41358376,CINDERELA C M E I,4105805,COLOMBO,PR,Sul,1,3,0.0,0.0,0.0,Em atividade,Municipal
2013,41125657,COLEGIO AGAPE EDUCACAO INFANTIL ENSINO FUNDAMENTAL E MEDIO,4105805,COLOMBO,PR,Sul,1,4,0.0,0.0,566.9940185546875,Em atividade,Privada
2013,41126084,COLEGIO CENECISTA JOAO BATISTA LOVATO SOBRINHO ED INF ENS FUND E MEDIO,4105805,COLOMBO,PR,Sul,1,4,0.0,0.0,567.5159912109375,Em atividade,Privada
2013,41126289,COLEGIO PASSIONISTA NOSSA SENHORA DO ROSARIO,4105805,COLOMBO,PR,Sul,1,4,0.0,0.0,539.1060180664062,Em atividade,Privada
2013,41148886,COLOMBO C E EF M,4105805,COLOMBO,PR,Sul,1,2,0.0,3.5999999046325684,442.40399169921875,Em atividade,Estadual
2013,41125860,CRISALIDA C M E I,4105805,COLOMBO,PR,Sul,1,3,0.0,0.0,0.0,Em atividade,Municipal
2013,41125878,CRISTOVAO COLOMBO E M EI EF,4105805,COLOMBO,PR,Sul,1,3,5.5,0.0,0.0,Em atividade,Municipal
2013,41407229,DJALMA JOHNSSON E E PREF EF,4105805,COLOMBO,PR,Sul,1,2,0.0,5.199999809265137,0.0,Em atividade,Estadual
2013,41125886,DURVAL SECCHI E M PE EI EF,4105805,COLOMBO,PR,Sul,1,3,5.599999904632568,0.0,0.0,Em atividade,Municipal
2013,41547896,EL SHADAY ESCOLA EDUCACAO INFANTIL E ENSINO FUNDAMENTAL,4105805,COLOMBO,PR,Sul,1,4,0.0,0.0,0.0,Em atividade,Privada
2013,41126025,ELVIRA N ALBERTI E M EI EF,4105805,COLOMBO,PR,Sul,1,3,6.300000190734863,0.0,0.0,Em atividade,Municipal
2013,41380819,ESCOLA BOM JESUS INTERNACIONAL - EDUCACAO INFANTIL E ENSINO FUNDAMENTAL,4105805,COLOMBO,PR,Sul,1,4,0.0,0.0,0.0,Em atividade,Privada
2013,41125908,ESTRELA DALVA C M E I,4105805,COLOMBO,PR,Sul,1,3,0.0,0.0,0.0,Em atividade,Municipal
2013,41125916,EUGENIO BELOTTO C R M E I PE,4105805,COLOMBO,PR,Sul,1,3,0.0,0.0,0.0,Em atividade,Municipal
2013,41358368,FAVO DE MEL C M E I,4105805,COLOMBO,PR,Sul,1,3,0.0,0.0,0.0,Em atividade,Municipal
2013,41358350,FLORZINHA REINO ENCANTADO C M E I,4105805,COLOMBO,PR,Sul,1,3,0.0,0.0,0.0,Em atividade,Municipal
2013,41125924,FRANCISCO BONATO E R M PE EF,4105805,COLOMBO,PR,Sul,1,3,0.0,0.0,0.0,Em atividade,Municipal
2013,41389174,FUTUROS ESCOLA EDUC INF ENS FUND,4105805,COLOMBO,PR,Sul,1,4,0.0,0.0,0.0,Em atividade,Privada
2013,41125932,GABRIEL D A STRAPASSON E M EI EF,4105805,COLOMBO,PR,Sul,1,3,5.599999904632568,0.0,0.0,Em atividade,Municipal
2013,41125940,GENESIO MORESCHI C E EF M,4105805,COLOMBO,PR,Sul,1,2,0.0,3.5999999046325684,481.0400085449219,Em atividade,Estadual
2013,41358198,GENNIUS - ESC EDUC INF ENS FUND,4105805,COLOMBO,PR,Sul,1,4,0.0,0.0,0.0,Em atividade,Privada
2013,41125959,GENOVEVA BRENNER C M E I,4105805,COLOMBO,PR,Sul,1,3,0.0,0.0,0.0,Em atividade,Municipal
2013,41370686,GIRASSOL C M E I,4105805,COLOMBO,PR,Sul,1,3,0.0,0.0,0.0,Em atividade,Municipal
2013,41358341,GOTA DE ORVALHO C M E I,4105805,COLOMBO,PR,Sul,1,3,0.0,0.0,0.0,Em atividade,Municipal
2013,41125967,GUARAITUBA C E DE EF M,4105805,COLOMBO,PR,Sul,1,2,0.0,0.0,465.697998046875,Em atividade,Estadual
2013,41125975,HEITOR V LOBOS E M EI EF,4105805,COLOMBO,PR,Sul,1,3,5.699999809265137,0.0,0.0,Em atividade,Municipal
2013,41126050,HELENA KOLODY C E EF M,4105805,COLOMBO,PR,Sul,1,2,0.0,3.0,0.0,Em atividade,Estadual
2013,41125983,HERACLITO F SOBRAL PINTO C E EF M,4105805,COLOMBO,PR,Sul,1,2,0.0,3.799999952316284,0.0,Em atividade,Estadual
2013,41125991,IMBUIAL DA ROSEIRA E R M EI EF,4105805,COLOMBO,PR,Sul,1,3,5.800000190734863,0.0,0.0,Em atividade,Municipal
2013,41126009,ISOLINA CECCON E M EI EF,4105805,COLOMBO,PR,Sul,1,3,6.5,0.0,0.0,Em atividade,Municipal
2013,41126017,JARDIM ANA MARIA E M EI EF,4105805,COLOMBO,PR,Sul,1,3,5.199999809265137,0.0,0.0,Em atividade,Municipal
2013,41126033,JARDIM DAS FLORES E M EI EF,4105805,COLOMBO,PR,Sul,1,3,4.800000190734863,0.0,0.0,Em atividade,Municipal
2013,41126041,JARDIM DAS GRACAS E M EI EF,4105805,COLOMBO,PR,Sul,1,3,5.800000190734863,0.0,0.0,Em atividade,Municipal
2013,41146727,JARDIM GUARUJA E M EI EF,4105805,COLOMBO,PR,Sul,1,3,6.300000190734863,0.0,0.0,Em atividade,Municipal
2013,41126076,JARDIM PALMARES C M E I,4105805,COLOMBO,PR,Sul,1,3,0.0,0.0,0.0,Em atividade,Municipal
2013,41126092,JOAO B STOCCO E M EF,4105805,COLOMBO,PR,Sul,1,3,5.5,0.0,0.0,Em atividade,Municipal
2013,41126106,JOAO BOSCO C E D EF M,4105805,COLOMBO,PR,Sul,1,2,0.0,2.9000000953674316,0.0,Em atividade,Estadual
2013,41126114,JOAO GUENO C E EF M,4105805,COLOMBO,PR,Sul,1,2,0.0,4.0,0.0,Em atividade,Estadual
2013,41598113,JOAO JOSE GASPARIN E R M EI EF,4105805,COLOMBO,PR,Sul,1,3,4.900000095367432,0.0,0.0,Em atividade,Municipal
2013,41126122,JOAO R DE CAMARGO C E EF M,4105805,COLOMBO,PR,Sul,1,2,0.0,3.799999952316284,500.55999755859375,Em atividade,Estadual
2013,41126130,JOHN KENNEDY E M EI EF,4105805,COLOMBO,PR,Sul,1,3,5.900000095367432,0.0,0.0,Em atividade,Municipal
2013,41126149,JONES J TIBOLLA E M PE EF,4105805,COLOMBO,PR,Sul,1,3,5.699999809265137,0.0,0.0,Em atividade,Municipal
2013,41126157,JOSE FREDERICO P WEIGERT E M EF,4105805,COLOMBO,PR,Sul,1,3,5.800000190734863,0.0,0.0,Em atividade,Municipal
2013,41126165,JOVINO DO ROSARIO E M EI EF,4105805,COLOMBO,PR,Sul,1,3,5.599999904632568,0.0,0.0,Em atividade,Municipal
2013,41372328,JUCONDO DAGOSTIN E M EI EF,4105805,COLOMBO,PR,Sul,1,3,5.599999904632568,0.0,0.0,Em atividade,Municipal
2013,41126173,JULIA CAVASSIN C E EF M,4105805,COLOMBO,PR,Sul,1,2,0.0,4.199999809265137,0.0,Em atividade,Estadual
2013,41126190,JUSCELINO KUBITSCHEK E M EI EF,4105805,COLOMBO,PR,Sul,1,3,6.300000190734863,0.0,0.0,Em atividade,Municipal
2013,41150244,LAR LUCIANE MARY PARIS E - EI EF,4105805,COLOMBO,PR,Sul,1,4,0.0,0.0,0.0,Em atividade,Privada
2013,41372840,LE SAVANT C EI EF M,4105805,COLOMBO,PR,Sul,1,4,0.0,0.0,512.0599975585938,Em atividade,Privada
2013,41407237,LINDAMIR ALBERTI C E EF M,4105805,COLOMBO,PR,Sul,1,2,0.0,3.700000047683716,467.8739929199219,Em atividade,Estadual
2013,41358333,LUA DE CRISTAL C M E I,4105805,COLOMBO,PR,Sul,1,3,0.0,0.0,0.0,Em atividade,Municipal
2013,41143787,LUIZ SEBASTIAO BALDO C E EF M,4105805,COLOMBO,PR,Sul,1,2,0.0,3.9000000953674316,0.0,Em atividade,Estadual
2013,41126211,MANOEL COSTACURTA E M DR EI EF,4105805,COLOMBO,PR,Sul,1,3,0.0,0.0,0.0,Em atividade,Municipal
2013,41126262,MARIA ANTONIETA FARANI E R M IRMA EF,4105805,COLOMBO,PR,Sul,1,3,5.400000095367432,0.0,0.0,Em atividade,Municipal
2013,41126238,MAUA E M BARAO DE EI EF,4105805,COLOMBO,PR,Sul,1,3,5.0,0.0,0.0,Em atividade,Municipal
2013,41373405,MENINO JESUS C EI EF M,4105805,COLOMBO,PR,Sul,1,4,0.0,0.0,0.0,Em atividade,Privada
2013,41126246,MEU CANTINHO C M E I,4105805,COLOMBO,PR,Sul,1,3,0.0,0.0,0.0,Em atividade,Municipal
2013,41126254,MONTEIRO LOBATO E M EI EF,4105805,COLOMBO,PR,Sul,1,3,5.400000095367432,0.0,0.0,Em atividade,Municipal
2013,41358260,MULTI CORES CENTRO EDUC INF,4105805,COLOMBO,PR,Sul,1,4,0.0,0.0,0.0,Em atividade,Privada
2013,41358384,MUNDO MAGICO C M E I,4105805,COLOMBO,PR,Sul,1,3,0.0,0.0,0.0,Em atividade,Municipal
2013,41148908,NONA JOANA C M E I,4105805,COLOMBO,PR,Sul,1,3,0.0,0.0,0.0,Em atividade,Municipal
2013,41126270,NOSSA SRA DE FATIMA E M EI EF,4105805,COLOMBO,PR,Sul,1,3,6.5,0.0,0.0,Em atividade,Municipal
2013,41568893,NOVA GERACAO ESCOLA,4105805,COLOMBO,PR,Sul,1,4,0.0,0.0,0.0,Em atividade,Privada
2013,41416228,NOVO ATUBINHA C M E I,4105805,COLOMBO,PR,Sul,1,3,0.0,0.0,0.0,Em atividade,Municipal
2013,41126319,PARQUE MONTE CASTELO E M DO EF,4105805,COLOMBO,PR,Sul,1,3,5.5,0.0,0.0,Em atividade,Municipal
2013,41372310,PARQUE SANTA TEREZINHA E M EF,4105805,COLOMBO,PR,Sul,1,3,5.800000190734863,0.0,0.0,Em atividade,Municipal
2013,41126327,PEDACINHO DO CEU C M E I,4105805,COLOMBO,PR,Sul,1,3,0.0,0.0,0.0,Em atividade,Municipal
2013,41126335,PEDRO V P DE SOUZA E M EI EF,4105805,COLOMBO,PR,Sul,1,3,5.199999809265137,0.0,0.0,Em atividade,Municipal
2013,41388054,PEQUENINOS DO JARDIM C M E I,4105805,COLOMBO,PR,Sul,1,3,0.0,0.0,0.0,Em atividade,Municipal
2013,41388038,PEQUENOS BRILHANTES C M E I,4105805,COLOMBO,PR,Sul,1,3,0.0,0.0,0.0,Em atividade,Municipal
2013,41370694,PETER PAN C M E I,4105805,COLOMBO,PR,Sul,1,3,0.0,0.0,0.0,Em atividade,Municipal
2013,41019636,ANTONIO BERTONI E M PROF EF,4105904,COLORADO,PR,Sul,1,3,5.400000095367432,0.0,0.0,Em atividade,Municipal
2013,41019644,CARLOS D DE ANDRADE C EI EF M,4105904,COLORADO,PR,Sul,1,4,0.0,0.0,578.7000122070312,Em atividade,Privada
2013,41019652,CECILIA MEIRELES E E EF,4105904,COLORADO,PR,Sul,1,2,0.0,3.9000000953674316,0.0,Em atividade,Estadual
2013,41143876,CEEBJA COLORADO EF M,4105904,COLORADO,PR,Sul,1,2,0.0,0.0,0.0,Em atividade,Estadual
2013,41365739,CENTRO DE EDUCACAO INFANTIL TURMA DO MICKEY,4105904,COLORADO,PR,Sul,1,4,0.0,0.0,0.0,Em atividade,Privada
2013,41365712,COMECINHO DE VIDA C M E I,4105904,COLORADO,PR,Sul,1,3,0.0,0.0,0.0,Em atividade,Municipal
2013,41019679,CRISTO REI E EI EF MOD ED ESP,4105904,COLORADO,PR,Sul,1,4,0.0,0.0,0.0,Em atividade,Privada
2013,41384768,JOSE PARDINE CENTRO DE EDUCACAO PROFISSIONAL,4105904,COLORADO,PR,Sul,1,4,0.0,0.0,0.0,Em atividade,Privada
2013,41408241,LAZARO SAGRADO E M PROF EF,4105904,COLORADO,PR,Sul,1,3,4.800000190734863,0.0,0.0,Em atividade,Municipal
2013,41019709,LUIS SHUZI OURA E M PROF EF,4105904,COLORADO,PR,Sul,1,3,5.099999904632568,0.0,0.0,Em atividade,Municipal
2013,41019733,MILTON SA SANTOS E M PROF EF,4105904,COLORADO,PR,Sul,1,3,5.699999809265137,0.0,0.0,Em atividade,Municipal
2013,41019741,MONTEIRO LOBATO C E EF M N PROFIS,4105904,COLORADO,PR,Sul,1,2,0.0,4.0,503.5159912109375,Em atividade,Estadual
2013,41376102,NAIR ZANG MARRONI C M E I,4105904,COLORADO,PR,Sul,1,3,0.0,0.0,0.0,Em atividade,Municipal
2013,41365704,NOSSA SENHORA APARECIDA C M E I,4105904,COLORADO,PR,Sul,1,3,0.0,0.0,0.0,Em atividade,Municipal
2013,41373138,NOVA GERACAO C EI EF M PROFIS,4105904,COLORADO,PR,Sul,1,4,0.0,0.0,0.0,Em atividade,Privada
2013,41019717,PAULO FREIRE E M EF,4105904,COLORADO,PR,Sul,1,3,6.0,0.0,0.0,Em atividade,Municipal
2013,41019750,PEDRO FRANCISCO DE ALCANTARA E M EF,4105904,COLORADO,PR,Sul,1,3,4.900000095367432,0.0,0.0,Em atividade,Municipal
2013,41365690,PEQUENO POLEGAR C M E I,4105904,COLORADO,PR,Sul,1,3,0.0,0.0,0.0,Em atividade,Municipal
2013,41365720,PINGUINHO DE GENTE C M E I,4105904,COLORADO,PR,Sul,1,3,0.0,0.0,0.0,Em atividade,Municipal
2013,41019776,TEREZA CRISTINA C E EF M,4105904,COLORADO,PR,Sul,1,2,0.0,3.5999999046325684,436.4119873046875,Em atividade,Estadual
2013,41043642,AIDES N DA SILVA C E PROF EF M N,4106001,CONGONHINHAS,PR,Sul,1,2,0.0,3.0999999046325684,0.0,Em atividade,Estadual
2013,41043650,ANA L CANET C M E I,4106001,CONGONHINHAS,PR,Sul,1,3,0.0,0.0,0.0,Em atividade,Municipal
2013,41043669,ANAZARETH NUNES FERRAZ E M EF,4106001,CONGONHINHAS,PR,Sul,1,3,6.0,0.0,0.0,Em atividade,Municipal
2013,41043707,CRIANCA ESPERANCA C M E I,4106001,CONGONHINHAS,PR,Sul,1,3,0.0,0.0,0.0,Em atividade,Municipal
2013,41359011,GLADYS C SANTOS E PROFA EI EF MOD ED E,4106001,CONGONHINHAS,PR,Sul,1,4,0.0,0.0,0.0,Em atividade,Privada
2013,41043723,JOAO C DA SILVA E M EF,4106001,CONGONHINHAS,PR,Sul,1,3,4.400000095367432,0.0,0.0,Em atividade,Municipal
2013,41372573,JOAO RIBEIRO E M DO C EF,4106001,CONGONHINHAS,PR,Sul,1,3,0.0,0.0,0.0,Em atividade,Municipal
2013,41043758,JOSE D DA COSTA C E EF M,4106001,CONGONHINHAS,PR,Sul,1,2,0.0,3.4000000953674316,0.0,Em atividade,Estadual
2013,41043766,LAURA G PEREIRA C M E I DO C,4106001,CONGONHINHAS,PR,Sul,1,3,0.0,0.0,0.0,Em atividade,Municipal
2013,41043790,OSCAR LUNAS E M DO C EF,4106001,CONGONHINHAS,PR,Sul,1,3,0.0,0.0,0.0,Em atividade,Municipal
2013,41043820,PATRIMONIO DO VAZ E M DO C EF,4106001,CONGONHINHAS,PR,Sul,1,3,0.0,0.0,0.0,Em atividade,Municipal
2013,41043812,PATRIMONIO SANTA MARIA C E C EF M,4106001,CONGONHINHAS,PR,Sul,1,2,0.0,0.0,0.0,Em atividade,Estadual
2013,41043839,SAO FRANCISCO IMBAU E M DO C EF,4106001,CONGONHINHAS,PR,Sul,1,3,0.0,0.0,0.0,Em atividade,Municipal
2013,41048920,CECILIA MEIRELES E M EI EF,4106100,CONSELHEIRO MAIRINCK,PR,Sul,1,3,5.599999904632568,0.0,0.0,Em atividade,Municipal
2013,41378687,DONA ZEZE C M E I,4106100,CONSELHEIRO MAIRINCK,PR,Sul,1,3,0.0,0.0,0.0,Em atividade,Municipal
2013,41048938,FRANCISCO A ALMEIDA C E EMN,4106100,CONSELHEIRO MAIRINCK,PR,Sul,1,2,0.0,0.0,440.0220031738281,Em atividade,Estadual
2013,41048946,MACARIA E E DONA EF,4106100,CONSELHEIRO MAIRINCK,PR,Sul,1,2,0.0,4.199999809265137,0.0,Em atividade,Estadual
2013,41367162,MOVIMENTO DE BEM ESTAR SOCIAL KOLPING,4106100,CONSELHEIRO MAIRINCK,PR,Sul,1,4,0.0,0.0,0.0,Em atividade,Privada
2013,41372182,SOL ENCANTADO E EI EF MOD ED ESP,4106100,CONSELHEIRO MAIRINCK,PR,Sul,1,4,0.0,0.0,0.0,Em atividade,Privada
2013,41378237,ADHELMAR SICURO C E C DR EF M,4106209,CONTENDA,PR,Sul,1,2,0.0,4.699999809265137,468.7359924316406,Em atividade,Estadual
2013,41358015,ALAOR C DE SOUZA E EI EF MOD ED ESP,4106209,CONTENDA,PR,Sul,1,4,0.0,0.0,0.0,Em atividade,Privada
2013,41453840,ANJO DA GUARDA CASA LAR,4106209,CONTENDA,PR,Sul,1,3,0.0,0.0,0.0,Em atividade,Municipal
2013,41126599,ANTONIO BORKOVSKI E M VER EI EF,4106209,CONTENDA,PR,Sul,1,3,5.900000095367432,0.0,0.0,Em atividade,Municipal
2013,41387813,CEEBJA PROFA ZILOAH DE M CARVALHO EF M,4106209,CONTENDA,PR,Sul,1,2,0.0,0.0,0.0,Em atividade,Estadual
2013,41382765,FRANCISCO CORDEIRO E E VER DR EF,4106209,CONTENDA,PR,Sul,1,2,0.0,3.700000047683716,0.0,Em atividade,Estadual
2013,41126629,JOAO FRANCO E M EI EF,4106209,CONTENDA,PR,Sul,1,3,5.900000095367432,0.0,0.0,Em atividade,Municipal
2013,41382757,JULIA P BAUMEL E T C OLIVEIRA PRE ESC M,4106209,CONTENDA,PR,Sul,1,3,0.0,0.0,0.0,Em atividade,Municipal
2013,41126653,LEONOR DE M CARVALHO E M EF,4106209,CONTENDA,PR,Sul,1,3,5.5,0.0,0.0,Em atividade,Municipal
2013,41126670,MIGUEL FRANCO FILHO C E EF M,4106209,CONTENDA,PR,Sul,1,2,0.0,3.799999952316284,0.0,Em atividade,Estadual
2013,41126688,NHANA MARIA C M E I,4106209,CONTENDA,PR,Sul,1,3,0.0,0.0,0.0,Em atividade,Municipal
2013,41126718,NOSSA SRA DAS GRACAS E R M EI EF,4106209,CONTENDA,PR,Sul,1,3,5.199999809265137,0.0,0.0,Em atividade,Municipal
2013,41126726,PAULINA U STABACH E M PROFA EF,4106209,CONTENDA,PR,Sul,1,3,6.599999904632568,0.0,0.0,Em atividade,Municipal
2013,41389298,PEDRO JOSE PUCHALSKI C E C PROF EF M,4106209,CONTENDA,PR,Sul,1,2,0.0,4.300000190734863,479.4519958496094,Em atividade,Estadual
2013,41126742,RUI BARBOSA E R M EF,4106209,CONTENDA,PR,Sul,1,3,0.0,0.0,0.0,Em atividade,Municipal
2013,41126858,SENHOR BOM JESUS E R M EI EF,4106209,CONTENDA,PR,Sul,1,3,5.900000095367432,0.0,0.0,Em atividade,Municipal
2013,41126874,VANILDA DZIERWA E M PROFA EI EF,4106209,CONTENDA,PR,Sul,1,3,5.400000095367432,0.0,0.0,Em atividade,Municipal
2013,41381696,VO ELOYNA C M E I,4106209,CONTENDA,PR,Sul,1,3,0.0,0.0,0.0,Em atividade,Municipal
2013,41149149,ZENEIDE C M E I DONA,4106209,CONTENDA,PR,Sul,1,3,0.0,0.0,0.0,Em atividade,Municipal
2013,41072804,1 DE MAIO E M EI EF,4106308,CORBELIA,PR,Sul,1,3,7.099999904632568,0.0,0.0,Em atividade,Municipal
2013,41072626,AMANCIO MORO C E EF M N PROFIS,4106308,CORBELIA,PR,Sul,1,2,0.0,4.300000190734863,0.0,Em atividade,Estadual
2013,41072634,ANITA GARIBALDI E M EI EF,4106308,CORBELIA,PR,Sul,1,3,0.0,0.0,0.0,Em atividade,Municipal
2013,41072650,BOSCO E M DOM EI EF,4106308,CORBELIA,PR,Sul,1,3,5.5,0.0,0.0,Em atividade,Municipal
2013,41072685,CASTRO ALVES E M EI EF,4106308,CORBELIA,PR,Sul,1,3,5.099999904632568,0.0,0.0,Em atividade,Municipal
2013,41072693,CAXIAS C E DQ DE EF M,4106308,CORBELIA,PR,Sul,1,2,0.0,5.300000190734863,0.0,Em atividade,Estadual
2013,41072723,GABRIEL DE LARA E M EI EF,4106308,CORBELIA,PR,Sul,1,3,0.0,0.0,0.0,Em atividade,Municipal
2013,41384946,IRACEMA ZANATO C M E I,4106308,CORBELIA,PR,Sul,1,3,0.0,0.0,0.0,Em atividade,Municipal
2013,41152433,MUNDO ENCANTADO E - EI,4106308,CORBELIA,PR,Sul,1,4,0.0,0.0,0.0,Em atividade,Privada
2013,41143930,NOVO HORIZONTE E EI EF MOD ED ESP,4106308,CORBELIA,PR,Sul,1,4,0.0,0.0,0.0,Em atividade,Privada
2013,41072782,OLAVO BILAC C E E F M,4106308,CORBELIA,PR,Sul,1,2,0.0,4.300000190734863,0.0,Em atividade,Estadual
2013,41072839,SAO FCO DE ASSIS E E EF,4106308,CORBELIA,PR,Sul,1,2,0.0,4.699999809265137,0.0,Em atividade,Estadual
2013,41072847,SAO JOSE E M EI EF,4106308,CORBELIA,PR,Sul,1,3,6.300000190734863,0.0,0.0,Em atividade,Municipal
2013,41072855,TANCREDO NEVES E M EI EF,4106308,CORBELIA,PR,Sul,1,3,4.599999904632568,0.0,0.0,Em atividade,Municipal
2013,41043880,ACYR IVO CARAZZAI E M DR EI EF,4106407,CORNELIO PROCOPIO,PR,Sul,1,3,4.900000095367432,0.0,0.0,Em atividade,Municipal
2013,41043901,ALBERTO CARAZZAI C E EF M,4106407,CORNELIO PROCOPIO,PR,Sul,1,2,0.0,0.0,0.0,Em atividade,Estadual
2013,41043928,ALICE C DINIZ E M PROFA EI EF,4106407,CORNELIO PROCOPIO,PR,Sul,1,3,6.0,0.0,0.0,Em atividade,Municipal
2013,41043936,ANDRE SEUGLING C E EF M PROFIS,4106407,CORNELIO PROCOPIO,PR,Sul,1,2,0.0,3.799999952316284,493.7860107421875,Em atividade,Estadual
2013,41043944,ANGELO MAZZAROTTO E M PROF EI EF,4106407,CORNELIO PROCOPIO,PR,Sul,1,3,4.300000190734863,0.0,0.0,Em atividade,Municipal
2013,41043952,ANIBAL CAMPI E M PROF EI EF,4106407,CORNELIO PROCOPIO,PR,Sul,1,3,5.0,0.0,0.0,Em atividade,Municipal
2013,41044002,ANJO DA GUARDA C E I,4106407,CORNELIO PROCOPIO,PR,Sul,1,4,0.0,0.0,0.0,Em atividade,Privada
2013,41366298,ANJO GABRIEL C M E I,4106407,CORNELIO PROCOPIO,PR,Sul,1,3,0.0,0.0,0.0,Em atividade,Municipal
2013,41043979,ANTONIO LOCK E M PE EI EF,4106407,CORNELIO PROCOPIO,PR,Sul,1,3,4.900000095367432,0.0,0.0,Em atividade,Municipal
2013,41385829,ATILA S BRASIL E M PROF EI EF,4106407,CORNELIO PROCOPIO,PR,Sul,1,3,0.0,0.0,0.0,Em atividade,Municipal
2013,41044061,CASTRO ALVES C E EF M PROFIS,4106407,CORNELIO PROCOPIO,PR,Sul,1,2,0.0,3.5,483.77801513671875,Em atividade,Estadual
2013,41357272,CEEBJA CORNELIO PROCOPIO EF M,4106407,CORNELIO PROCOPIO,PR,Sul,1,2,0.0,0.0,0.0,Em atividade,Estadual
2013,41385845,COLEGIO AGUIA MASTER,4106407,CORNELIO PROCOPIO,PR,Sul,1,4,0.0,0.0,561.8280029296875,Em atividade,Privada
2013,41044533,COLEGIO DOM BOSCO,4106407,CORNELIO PROCOPIO,PR,Sul,1,4,0.0,0.0,541.1199951171875,Em atividade,Privada
2013,41044410,COLEGIO NOSSA SENHORA DO ROSARIO - EI-EF-EM,4106407,CORNELIO PROCOPIO,PR,Sul,1,4,0.0,0.0,569.0900268554688,Em atividade,Privada
2013,41044126,CRISTO REI C E NORMAL,4106407,CORNELIO PROCOPIO,PR,Sul,1,2,0.0,0.0,0.0,Em atividade,Estadual
2013,41044134,DAMASCO A SOTTILE E M VER EI EF,4106407,CORNELIO PROCOPIO,PR,Sul,1,3,0.0,0.0,0.0,Em atividade,Municipal
2013,41366280,DJALMA P DANTAS C M E I,4106407,CORNELIO PROCOPIO,PR,Sul,1,3,0.0,0.0,0.0,Em atividade,Municipal
2013,41044169,DULCE DE S CARVALHO C E EF M,4106407,CORNELIO PROCOPIO,PR,Sul,1,2,0.0,4.599999904632568,441.3039855957031,Em atividade,Estadual
2013,41044177,EDGARD GALAFASSI E M EI EF,4106407,CORNELIO PROCOPIO,PR,Sul,1,3,6.199999809265137,0.0,0.0,Em atividade,Municipal
2013,41366310,EMAUS C E I,4106407,CORNELIO PROCOPIO,PR,Sul,1,4,0.0,0.0,0.0,Em atividade,Privada
2013,41044568,ESCOLA RUI BARBOSA EDUCACAO INFANTIL E ENSINO FUNDAMENTAL,4106407,CORNELIO PROCOPIO,PR,Sul,1,4,0.0,0.0,0.0,Em atividade,Privada
2013,41044193,EUNICE G GOMES E M PROF EI EF,4106407,CORNELIO PROCOPIO,PR,Sul,1,3,6.599999904632568,0.0,0.0,Em atividade,Municipal
2013,41378334,FLORENCE CENTRO DE ED PROF,4106407,CORNELIO PROCOPIO,PR,Sul,1,4,0.0,0.0,0.0,Em atividade,Privada
2013,41044223,GINO AZZOLINI E M COM EI EF,4106407,CORNELIO PROCOPIO,PR,Sul,1,3,5.900000095367432,0.0,0.0,Em atividade,Municipal
2013,41044096,INST ESP AREA VIS SU VISIAUDIO MOD E E,4106407,CORNELIO PROCOPIO,PR,Sul,1,4,0.0,0.0,0.0,Em atividade,Privada
2013,41044258,JOAO CARLOS DE FARIA E E MAJ EF,4106407,CORNELIO PROCOPIO,PR,Sul,1,2,0.0,4.800000190734863,0.0,Em atividade,Estadual
2013,41044274,JOAO PAULO II C M E I,4106407,CORNELIO PROCOPIO,PR,Sul,1,3,0.0,0.0,0.0,Em atividade,Municipal
2013,41044312,LOURENCO FILHO E M PROF EI EF,4106407,CORNELIO PROCOPIO,PR,Sul,1,3,5.199999809265137,0.0,0.0,Em atividade,Municipal
2013,41044320,MANUEL DA NOBREGA E E PE EF,4106407,CORNELIO PROCOPIO,PR,Sul,1,2,0.0,0.0,0.0,Em atividade,Estadual
2013,41385837,MARIA DE JESUS FERNANDES C M E I,4106407,CORNELIO PROCOPIO,PR,Sul,1,3,0.0,0.0,0.0,Em atividade,Municipal
2013,41044355,MARIO EDUARDO LOTTI C M E I,4106407,CORNELIO PROCOPIO,PR,Sul,1,3,0.0,0.0,0.0,Em atividade,Municipal
2013,41044363,MONTEIRO LOBATO C E EF M,4106407,CORNELIO PROCOPIO,PR,Sul,1,2,0.0,5.300000190734863,492.1000061035156,Em atividade,Estadual
2013,41044371,NAIR D CANARIO C M E I,4106407,CORNELIO PROCOPIO,PR,Sul,1,3,0.0,0.0,0.0,Em atividade,Municipal
2013,41044398,NILSON B RIBAS E M DEP EI EF,4106407,CORNELIO PROCOPIO,PR,Sul,1,3,6.0,0.0,0.0,Em atividade,Municipal
2013,41044401,NOEMIA OLIVEIRA BRUNO E M EI EF,4106407,CORNELIO PROCOPIO,PR,Sul,1,3,5.400000095367432,0.0,0.0,Em atividade,Municipal
2013,41044100,NOVO MILENIUM C EF M,4106407,CORNELIO PROCOPIO,PR,Sul,1,4,0.0,0.0,552.5999755859375,Em atividade,Privada
2013,41044487,NOVO MILENIUM JUNIOR E EI EF,4106407,CORNELIO PROCOPIO,PR,Sul,1,4,0.0,0.0,0.0,Em atividade,Privada
2013,41385810,PAULO FREIRE E E EF,4106407,CORNELIO PROCOPIO,PR,Sul,1,2,0.0,0.0,0.0,Em atividade,Estadual
2013,41380657,PIA GIOCONDA VIEIRA C M E I IRMA,4106407,CORNELIO PROCOPIO,PR,Sul,1,3,0.0,0.0,0.0,Em atividade,Municipal
2013,41044517,PROCOPENSE E M EI EF MOD ED ESP,4106407,CORNELIO PROCOPIO,PR,Sul,1,3,0.0,0.0,0.0,Em atividade,Municipal
2013,41388410,SESC CORNELIO PROCOPIO CENTRO DE EDUCACAO INFANTIL,4106407,CORNELIO PROCOPIO,PR,Sul,1,4,0.0,0.0,0.0,Em atividade,Privada
2013,41372476,SUZANA WESLEY C EI EF M,4106407,CORNELIO PROCOPIO,PR,Sul,1,4,0.0,0.0,0.0,Em atividade,Privada
2013,41044088,UNIVERSIDADE TECNOLOGICA FEDERAL DO PR CAMPUS CORN,4106407,CORNELIO PROCOPIO,PR,Sul,1,1,0.0,0.0,588.9760131835938,Em atividade,Federal
2013,41044649,VANDYR DE ALMEIDA C E EF M,4106407,CORNELIO PROCOPIO,PR,Sul,1,2,0.0,3.4000000953674316,456.84600830078125,Em atividade,Estadual
2013,41044657,VITORINO GOMES HENRIQUES E M EI EF,4106407,CORNELIO PROCOPIO,PR,Sul,1,3,0.0,0.0,0.0,Em atividade,Municipal
2013,41143922,WILLIAM MADI E E PROF EF,4106407,CORNELIO PROCOPIO,PR,Sul,1,2,0.0,3.5999999046325684,0.0,Em atividade,Estadual
2013,41044665,YOLANDA G CORREA E M PROFA EI EF,4106407,CORNELIO PROCOPIO,PR,Sul,1,3,0.0,0.0,0.0,Em atividade,Municipal
2013,41044681,ZULMIRA MARCHESI SILVA C E EF M,4106407,CORNELIO PROCOPIO,PR,Sul,1,2,0.0,4.199999809265137,473.7179870605469,Em atividade,Estadual
2013,41385756,ANJO DA GUARDA C M E I,4106456,CORONEL DOMINGOS SOARES,PR,Sul,1,3,0.0,0.0,0.0,Em atividade,Municipal
2013,41598130,ANTONIO ARTEMIO FRANCA C E C EF M,4106456,CORONEL DOMINGOS SOARES,PR,Sul,1,2,0.0,0.0,0.0,Em atividade,Estadual
2013,41108787,AURORA F DAS N TORTELLI E M PROFA EI EF,4106456,CORONEL DOMINGOS SOARES,PR,Sul,1,3,4.5,0.0,0.0,Em atividade,Municipal
2013,41372786,CANDIDO ROSSONI C E C EF M,4106456,CORONEL DOMINGOS SOARES,PR,Sul,1,2,0.0,0.0,0.0,Em atividade,Estadual
2013,41108736,CAXIAS E R M DQ DE EF,4106456,CORONEL DOMINGOS SOARES,PR,Sul,1,3,0.0,0.0,0.0,Em atividade,Municipal
2013,41108779,DANILO BORDIGNON E R M EF,4106456,CORONEL DOMINGOS SOARES,PR,Sul,1,3,0.0,0.0,0.0,Em atividade,Municipal
2013,41378067,ELENITA A FERREIRA E EI EF MOD ED ESP,4106456,CORONEL DOMINGOS SOARES,PR,Sul,1,4,0.0,0.0,0.0,Em atividade,Privada
2013,41108833,FRANCISCO TAQUES E R M EF,4106456,CORONEL DOMINGOS SOARES,PR,Sul,1,3,0.0,0.0,0.0,Em atividade,Municipal
2013,41108876,IRARAS E R M EF,4106456,CORONEL DOMINGOS SOARES,PR,Sul,1,3,0.0,0.0,0.0,Em atividade,Municipal
2013,41363590,MONTEIRO LOBATO C E C EF M,4106456,CORONEL DOMINGOS SOARES,PR,Sul,1,2,0.0,0.0,0.0,Em atividade,Estadual
2013,41109090,NOSSA SENHORA CONSOLADORA E R M EF,4106456,CORONEL DOMINGOS SOARES,PR,Sul,1,3,0.0,0.0,0.0,Em atividade,Municipal
2013,41109112,NOSSA SENHORA DAS GRACAS E R M EF,4106456,CORONEL DOMINGOS SOARES,PR,Sul,1,3,0.0,0.0,0.0,Em atividade,Municipal
2013,41109210,PEDRO F DE ALMEIDA E R M EI EF,4106456,CORONEL DOMINGOS SOARES,PR,Sul,1,3,0.0,0.0,0.0,Em atividade,Municipal
2013,41385764,PEQUENO POLEGAR C M E I,4106456,CORONEL DOMINGOS SOARES,PR,Sul,1,3,0.0,0.0,0.0,Em atividade,Municipal
2013,41109244,SANTA CATARINA C E EF M,4106456,CORONEL DOMINGOS SOARES,PR,Sul,1,2,0.0,3.5,0.0,Em atividade,Estadual
2013,41382609,SANTA RITA DE CASSIA E R M EF,4106456,CORONEL DOMINGOS SOARES,PR,Sul,1,3,0.0,0.0,0.0,Em atividade,Municipal
2013,41109368,SANTINA PERRET CARRARO E R M EI EF,4106456,CORONEL DOMINGOS SOARES,PR,Sul,1,3,0.0,0.0,0.0,Em atividade,Municipal
2013,41109414,SAO VICENTE E R M EF,4106456,CORONEL DOMINGOS SOARES,PR,Sul,1,3,0.0,0.0,0.0,Em atividade,Municipal
2013,41387759,AQUARELA C M E I,4106506,CORONEL VIVIDA,PR,Sul,1,3,0.0,0.0,0.0,Em atividade,Municipal
2013,41146689,ARCO IRIS C M E I,4106506,CORONEL VIVIDA,PR,Sul,1,3,0.0,0.0,0.0,Em atividade,Municipal
2013,41091710,ARNALDO BUSATO C E EF M N PROFIS,4106506,CORONEL VIVIDA,PR,Sul,1,2,0.0,4.5,488.74200439453125,Em atividade,Estadual
2013,41091809,CASTELO BRANCO C E C EF M,4106506,CORONEL VIVIDA,PR,Sul,1,2,0.0,5.099999904632568,496.5060119628906,Em atividade,Estadual
2013,41091825,CAXIAS C E DO C DQ EF M,4106506,CORONEL VIVIDA,PR,Sul,1,2,0.0,0.0,0.0,Em atividade,Estadual
2013,41383265,FUTURA C EI EF M,4106506,CORONEL VIVIDA,PR,Sul,1,4,0.0,0.0,0.0,Em atividade,Privada
2013,41091965,JUVENTINO RUFATTO E M EF,4106506,CORONEL VIVIDA,PR,Sul,1,3,6.199999809265137,0.0,0.0,Em atividade,Municipal
2013,41091973,KENNEDY E M PRES EI EF,4106506,CORONEL VIVIDA,PR,Sul,1,3,6.400000095367432,0.0,0.0,Em atividade,Municipal
2013,41092090,LIBANO ALZIRO MERLO E EI EF MOD ED ESP,4106506,CORONEL VIVIDA,PR,Sul,1,4,0.0,0.0,0.0,Em atividade,Privada
